store_name,address,nickname,content,cleaned_content,tokenized_words,sentiment,sentiment_score
국립현대미술관 서울,서울 종로구 삼청로 30,햅삐한 틈새소풍러,7월 13일이면 전시가 끝나서 서둘러서 왔다.전시 끄트머리라 사람들도 많다.론뮤익의 작품들은 실제 크기 그대로인게 없고 더 크거나 더 작거나 그렇다.그냥 실제와 똑같은 것을 보여주려는 것이 아니라과장된 사람의 이면에 다른 면을 보라고 한다.론뮤익의 작품은 그냥 정면에서 보는 것뿐만 아니라옆에서 뒤에서 보아야 진짜 작가가 말하고 싶은 걸볼 수 있다.커다란 자신의 자화상의 제목은 ‘마스크’작품의 뒷면은 텅 비어있다. 그냥 얼굴은 마스크일뿐이다.‘연인’이라는 작품도 뒤에서 보면 남자가 여자의 팔목을잡고있다. 둘 사이의 또다른 감정선이 느껴지는 부분이다.우리에게 보여지고 우리가 보던 모습들은 수많은 것 중하나일뿐이다.론뮤익이 우리에게 말하고 싶은 게 무엇인지 느껴보자.,7월 13일이면 전시가 끝나서 서둘러서 왔다.전시 끄트머리라 사람들도 많다.론뮤익의 작품들은 실제 크기 그대로인게 없고 더 크거나 더 작거나 그렇다.그냥 실제와 똑같은 것을 보여주려는 것이 아니라과장된 사람의 이면에 다른 면을 보라고 한다.론뮤익의 작품은 그냥 정면에서 보는 것뿐만 아니라옆에서 뒤에서 보아야 진짜 작가가 말하고 싶은 걸볼 수 있다.커다란 자신의 자화상의 제목은 마스크작품의 뒷면은 텅 비어있다. 그냥 얼굴은 마스크일뿐이다.연인이라는 작품도 뒤에서 보면 남자가 여자의 팔목을잡고있다. 둘 사이의 또다른 감정선이 느껴지는 부분이다.우리에게 보여지고 우리가 보던 모습들은 수많은 것 중하나일뿐이다.론뮤익이 우리에게 말하고 싶은 게 무엇인지 느껴보자.,"['전시', '전시', '끄트머리', '사람', '많다', '론뮤익', '작품', '실제', '크기', '그대로', '없다', '작다', '그렇다', '그냥', '실제', '똑같다', '아니다', '과장', '사람', '이면', '다른', '보라', '론뮤익', '작품', '그냥', '정면', '아니다', '보아', '진짜', '작가', '걸볼', '있다', '커다랗다', '자신', '자화상', '제목', '마스크', '작품', '그냥', '얼굴', '마스크', '연인', '작품', '남자', '여자', '팔목', '사이', '정선', '부분', '우리', '우리', '모습', '수많다', '중하', '나일', '론뮤익', '우리', '무엇']",Negative,0.5007797479629517
국립현대미술관 서울,서울 종로구 삼청로 30,Moschino,사람도 적당하고 관람하기 너무 좋았어요~,사람도 적당하고 관람하기 너무 좋았어요,"['사람', '적당하다', '관람', '좋다']",Positive,0.9741151332855225
국립현대미술관 서울,서울 종로구 삼청로 30,빠덜마덜알러뷰,한국근현대미술전 어린이(유아)전시도 아이가 뛰어놀며 참여형 전시로정말 좋았고 상설전시도 굿굿굿~!평일엔 관람객도 적당해 쾌적하게 관람 가능!!,한국근현대미술전 어린이유아전시도 아이가 뛰어놀며 참여형 전시로정말 좋았고 상설전시도 굿굿굿!평일엔 관람객도 적당해 쾌적하게 관람 가능!!,"['한국', '미술', '어린이', '유아', '전시', '아이', '참여', '전시', '정말', '좋다', '설전', '시도', '굿굿굿', '평일', '관람객', '적당하다', '쾌적하다', '관람', '가능']",Positive,0.969764232635498
국립현대미술관 서울,서울 종로구 삼청로 30,Trysin93,목요일방문 여자친구랑 7월13일 론뮤익 전시회 종료라날도 더운데 실내데이트 하러 왔어요!전시회 여러곳 가긴했는데 좋은 작품보게되어영광이고 진짜 같이 만들어서 대박이였네용주말에는 엄두도 안날것같아요 저는 사람 최대한안나오게 찍은거고 사진 안나오게 찍으시고 싶으시면평일 낮에 오시는걸 추천드려요 오후는 발권도 길고 사람도 많았어요 4시40분에 들어간 리뷰입니다!참고하시고 즐감하세요 ~~~,목요일방문 여자친구랑 7월13일 론뮤익 전시회 종료라날도 더운데 실내데이트 하러 왔어요!전시회 여러곳 가긴했는데 좋은 작품보게되어영광이고 진짜 같이 만들어서 대박이였네용주말에는 엄두도 안날것같아요 저는 사람 최대한안나오게 찍은거고 사진 안나오게 찍으시고 싶으시면평일 낮에 오시는걸 추천드려요 오후는 발권도 길고 사람도 많았어요 4시40분에 들어간 리뷰입니다!참고하시고 즐감하세요,"['목요일', '방문', '여자친구', '론뮤익', '전시회', '종료', '덥다', '실내', '데이트', '전시회', '좋다', '작품', '영광', '진짜', '대박', '엄두', '같다', '사람', '최대한', '안나', '사진', '평일', '추천', '오후', '발권', '길다', '사람', '많다', '리뷰', '이다', '참고', '즐감']",Positive,0.9315317273139954
국립현대미술관 서울,서울 종로구 삼청로 30,Bangrang1026,"론 뮤익 전시와 함께 현대미술 상설전이 열려 갔습니다. 사람과 사물 묘사에 극사실적인, 그리고 보는 시각마다 다른 의미를 찾아볼 수 있는 론 뮤익 작가 작품은 인상깊었습니다. 저는 일요일 오전 개관시간(10시)에 맞춰 가서 비교적 한산하게 보았는데 일찍, 또는 평일에 가시면 좋겠습니다.한국 상설전시관도 김환기, 서세옥, 이응노, 장욱진, 오윤, 신학철, 백남준 등 내로라하는 작가들의 걸작이 많으니 꼭 보시길 바랍니다.","론 뮤익 전시와 함께 현대미술 상설전이 열려 갔습니다. 사람과 사물 묘사에 극사실적인, 그리고 보는 시각마다 다른 의미를 찾아볼 수 있는 론 뮤익 작가 작품은 인상깊었습니다. 저는 일요일 오전 개관시간10시에 맞춰 가서 비교적 한산하게 보았는데 일찍, 또는 평일에 가시면 좋겠습니다.한국 상설전시관도 김환기, 서세옥, 이응노, 장욱진, 오윤, 신학철, 백남준 등 내로라하는 작가들의 걸작이 많으니 꼭 보시길 바랍니다.","['뮤익', '전시', '현대', '미술', '설전', '사람과', '사물', '묘사', '사실', '시각', '다른', '의미', '있다', '뮤익', '작가', '작품', '인상', '깊다', '일요일', '오전', '개관', '시간', '비교', '한산하다', '일찍', '평일', '가시', '좋다', '한국', '상설', '전시관', '김환기', '서세옥', '이응노', '장욱진', '오윤', '신학', '백남준', '로라', '작가', '걸작', '많다']",Positive,0.963650107383728
국립현대미술관 서울,서울 종로구 삼청로 30,별에서 나온 이미,도심속 느긋하게 미술작품 감상하며 가을을 보내기 좋은날이었음,도심속 느긋하게 미술작품 감상하며 가을을 보내기 좋은날이었음,"['도심', '느긋하다', '미술', '작품', '감상', '가을', '좋다']",Positive,0.9578200578689575
국립현대미술관 서울,서울 종로구 삼청로 30,김토끼와 카페투어,전시 잘 보고 왔어요,전시 잘 보고 왔어요,"['전시', '보고']",Positive,0.973023533821106
국립현대미술관 서울,서울 종로구 삼청로 30,쏘garden,자주가도 좋은 곳.다시 가고 싶은 곳.자주 가고 싶네요~,자주가도 좋은 곳.다시 가고 싶은 곳.자주 가고 싶네요,"['자주', '가도', '좋다', '다시', '자주']",Positive,0.9740604758262634
국립현대미술관 서울,서울 종로구 삼청로 30,캐밀,굿즈 구경하고 기념품도 샀어요👍,굿즈 구경하고 기념품도 샀어요,"['구경', '기념품']",Positive,0.8866026401519775
국립현대미술관 서울,서울 종로구 삼청로 30,쪽둘리,"호주 태생의 조각가 론뮤익의 아시아 첫개인전으로요즘 가장 핫한 전시회중 하나.국립현대미술관 무료 개방인 날에 방문했어요.그만큼 사람들로 발디딜틈 없어서 정신없이 구경함.5전시실, 6전시실에서 볼 수 있고 입장 줄은 금방 줄어요.옆으로 누워있는 거대한 크기의 론뮤익 얼굴 자화상을 시작으로침대에 누워있는 작품도 굉장히 크게 제작되었고,작품들이 너무 사실적이라 살짝 소름마저 돋을 정도였어요😂작품 수가 많이 없는데 이유가 있었음하나하나 작업하는데 오랜 공을 들였을 것 같아요.6전시실에는 작품 2개를 보고나서 연결된 계단을 내려가서 사진전시 및 영상을 보고나면 끝나는 코스.전시실입장부터 약40분 걸렸습니다.작품은 10개로 많지않아 금방봐요.해골 쌓인곳에서 인증샷 찍기⭐️✅️10:00-18:00","호주 태생의 조각가 론뮤익의 아시아 첫개인전으로요즘 가장 핫한 전시회중 하나.국립현대미술관 무료 개방인 날에 방문했어요.그만큼 사람들로 발디딜틈 없어서 정신없이 구경함.5전시실, 6전시실에서 볼 수 있고 입장 줄은 금방 줄어요.옆으로 누워있는 거대한 크기의 론뮤익 얼굴 자화상을 시작으로침대에 누워있는 작품도 굉장히 크게 제작되었고,작품들이 너무 사실적이라 살짝 소름마저 돋을 정도였어요작품 수가 많이 없는데 이유가 있었음하나하나 작업하는데 오랜 공을 들였을 것 같아요.6전시실에는 작품 2개를 보고나서 연결된 계단을 내려가서 사진전시 및 영상을 보고나면 끝나는 코스.전시실입장부터 약40분 걸렸습니다.작품은 10개로 많지않아 금방봐요.해골 쌓인곳에서 인증샷 찍기10001800","['호주', '태생', '조각가', '론뮤익', '아시아', '개인', '요즘', '가장', '전시회', '하나', '국립', '현대', '미술관', '무료', '개방', '방문', '사람', '없다', '구경', '전시', '있다', '입장', '금방', '거대하다', '크기', '론뮤익', '얼굴', '자화상', '시작', '침대', '작품', '굉장하다', '크게', '제작', '작품', '사실', '살짝', '소름', '정도', '작품', '수가', '없다', '이유', '있다', '하나', '작업', '같다', '작품', '연결', '계단', '사진', '전시', '영상', '코스', '입장', '작품', '많다', '금방', '해골', '인증샷', '찍기']",Positive,0.9550795555114746
국립현대미술관 서울,서울 종로구 삼청로 30,at****,"<론 뮤익 후기> 실제적인 입체감과 묘사, 디테일이하나하나 다 살아 있으며, 많은 생각과영감을 얻게 되는 시간이었다🍀창작의 고통 끝에 하나의 예술이 탄생되듯이나 또한 삶의 많은 인내와 더불어 창작의 시간을가져보고 싶다는 하나의 작은 소망이 생기게 되었다📝","론 뮤익 후기 실제적인 입체감과 묘사, 디테일이하나하나 다 살아 있으며, 많은 생각과영감을 얻게 되는 시간이었다창작의 고통 끝에 하나의 예술이 탄생되듯이나 또한 삶의 많은 인내와 더불어 창작의 시간을가져보고 싶다는 하나의 작은 소망이 생기게 되었다","['뮤익', '후기', '실제', '체감', '묘사', '디테', '하나', '있다', '많다', '생각', '영감', '시간', '창작', '고통', '하나', '예술', '탄생', '이나', '또한', '많다', '인내', '창작', '시간', '보고', '하나', '작다', '소망', '생기']",Positive,0.9721395969390869
국립현대미술관 서울,서울 종로구 삼청로 30,냥냥이er,"웅장하고, 멋진 전시였습니다","웅장하고, 멋진 전시였습니다","['웅장', '멋지다', '전시']",Positive,0.973663330078125
국립현대미술관 서울,서울 종로구 삼청로 30,숀 더 쉬프,궁궐 안 일제가 지은 건물을 미술관으로 재활용해서 운영을 한 곳이지만 우리나라 미술사를 자세하게 알게 된 곳이어서 의미가 굉장히 깊습니다.,궁궐 안 일제가 지은 건물을 미술관으로 재활용해서 운영을 한 곳이지만 우리나라 미술사를 자세하게 알게 된 곳이어서 의미가 굉장히 깊습니다.,"['궁궐', '일제', '지은', '건물', '미술관', '재활용', '운영', '우리나라', '미술사', '자세하다', '의미', '굉장하다', '깊다']",Positive,0.9693045616149902
국립현대미술관 서울,서울 종로구 삼청로 30,미우나무,여전히 좋은  현대미술관이에요.  몰랐던 현대미술과 이건희컬렉션에 있는 작품들까지 너무 행복한 전시였어요 ♡,여전히 좋은 현대미술관이에요. 몰랐던 현대미술과 이건희컬렉션에 있는 작품들까지 너무 행복한 전시였어요,"['여전하다', '좋다', '미술관', '미술', '이건희', '컬렉션', '있다', '작품', '행복하다', '전시']",Positive,0.9739187955856323
국립현대미술관 서울,서울 종로구 삼청로 30,네겝,무더운 날씨에 많은 사람들이 방문하는 곳.생각보다 넓고 쾌적한 전시관과 수준높은 작품들에 놀랐습니다.이런가격에 멋진 작품들추천합니다.밖은 폭염이지만정말 시원하게 즐겼습니다.국립현대미술관 멋진곳입니다!,무더운 날씨에 많은 사람들이 방문하는 곳.생각보다 넓고 쾌적한 전시관과 수준높은 작품들에 놀랐습니다.이런가격에 멋진 작품들추천합니다.밖은 폭염이지만정말 시원하게 즐겼습니다.국립현대미술관 멋진곳입니다!,"['무덥다', '날씨', '많다', '사람', '방문', '생각', '넓다', '쾌적하다', '전시관', '수준', '높다', '작품', '가격', '멋지다', '작품', '천하다', '폭염', '정말', '시원하다', '국립', '현대', '미술관', '멋지다', '이다']",Positive,0.9747976064682007
국립현대미술관 서울,서울 종로구 삼청로 30,부익부,내일까지미리 예약하고 갔는데 그래도 표받는 줄이 장난아님오전에 가는게 좋을듯줄 길게 섰는데 제법 빠르게 지나감좋은기회에  좋은전시회 볼 수 있어 좋음,내일까지미리 예약하고 갔는데 그래도 표받는 줄이 장난아님오전에 가는게 좋을듯줄 길게 섰는데 제법 빠르게 지나감좋은기회에 좋은전시회 볼 수 있어 좋음,"['내일', '미리', '예약', '장난', '아니다', '좋다', '길다', '제법', '빠르다', '좋다', '기회', '좋다', '전시회', '있다', '좋다']",Positive,0.9595258831977844
국립현대미술관 서울,서울 종로구 삼청로 30,두기두기스,행복한 라짜로를 보러 방문!,행복한 라짜로를 보러 방문!,"['행복하다', '방문']",Positive,0.9302981495857239
국립현대미술관 서울,서울 종로구 삼청로 30,간첩,미술관 관람👍너무 좋았습니다🤗,미술관 관람너무 좋았습니다,"['미술관', '관람', '좋다']",Positive,0.9726196527481079
국립현대미술관 서울,서울 종로구 삼청로 30,공간리뷰,김창열 작가님 물방울에 빠지고 왔습니다. 아름답습니다,김창열 작가님 물방울에 빠지고 왔습니다. 아름답습니다,"['김창열', '작가', '물방울', '아름답다']",Positive,0.973488986492157
국립현대미술관 서울,서울 종로구 삼청로 30,travelingtogether,국립현대미술관 서울관에서는 한국현대미술하이라이트전이 열리고 있습니다. 김환기 김창열 이우환 이응노 유영국 서도호 등 수많은 대한민국의 내노라하는 작가들의 작품들을 보실수 있습니다.  그들의 노력과 시간을 들인 값진 작품들 감상하시러 가보시길~ 5월  매주 수요일은 무료 행사진행 중입니다~,국립현대미술관 서울관에서는 한국현대미술하이라이트전이 열리고 있습니다. 김환기 김창열 이우환 이응노 유영국 서도호 등 수많은 대한민국의 내노라하는 작가들의 작품들을 보실수 있습니다. 그들의 노력과 시간을 들인 값진 작품들 감상하시러 가보시길 5월 매주 수요일은 무료 행사진행 중입니다,"['국립', '현대', '미술관', '한국', '현대', '미술', '하이라이트', '전이', '있다', '김환기', '김창열', '이우환', '이응노', '유영국', '도호', '수많다', '대한민국', '작가', '작품', '있다', '노력', '시간', '값지다', '작품', '감상', '수요일', '무료', '행사', '진행', '이다']",Positive,0.9624095559120178
국립현대미술관 서울,서울 종로구 삼청로 30,travelingtogether,호주의 극사실주의 작가 론뮤익의 전시가 열리고 있습니다. 인간의 일상적 모습의 삶과 죽음을 표현한 론뮤익은 30년에 걸쳐 48점의 작품만 작업할 정도로 정교하고 세밀하게 표현하였습니다. 론뮤익의 일상 작업을 담은 영상도 보실수있습니다. 너무나도 정밀한 사실적 표현에도 놀라고 압도되는 크기에도 놀랐습니다.,호주의 극사실주의 작가 론뮤익의 전시가 열리고 있습니다. 인간의 일상적 모습의 삶과 죽음을 표현한 론뮤익은 30년에 걸쳐 48점의 작품만 작업할 정도로 정교하고 세밀하게 표현하였습니다. 론뮤익의 일상 작업을 담은 영상도 보실수있습니다. 너무나도 정밀한 사실적 표현에도 놀라고 압도되는 크기에도 놀랐습니다.,"['호주', '사실', '주의', '작가', '론뮤익', '전시', '있다', '인간', '일상', '모습', '죽음', '표현', '론뮤', '작품', '작업', '정도', '정교하다', '세밀', '표현', '론뮤익', '일상', '작업', '영상', '정밀', '사실', '표현', '압도', '크기']",Positive,0.9692215919494629
국립현대미술관 서울,서울 종로구 삼청로 30,금빛할망구,북촌 방문시 함께 방문하기 좋은 미술관!,북촌 방문시 함께 방문하기 좋은 미술관!,"['북촌', '방문', '방문', '좋다', '미술관']",Positive,0.9639596343040466
국립현대미술관 서울,서울 종로구 삼청로 30,불어오는바람따라,오랜만에 방문한 국립현대미술관에서 하이라이트 전시를 봤다. 가장 인상깊었던 작품 한장만 사진으로 남겼는데 이 한장에 들어온 건 거대한 10000장의 목판과 추억의 사물들 중 일부이다. 직접보면 강익중 작가의 삼라만상의 어마어마란 작품을 시간가는줄 모르고 감상하게 된다.,오랜만에 방문한 국립현대미술관에서 하이라이트 전시를 봤다. 가장 인상깊었던 작품 한장만 사진으로 남겼는데 이 한장에 들어온 건 거대한 10000장의 목판과 추억의 사물들 중 일부이다. 직접보면 강익중 작가의 삼라만상의 어마어마란 작품을 시간가는줄 모르고 감상하게 된다.,"['방문', '국립', '미술관', '하이라이트', '전시', '가장', '인상', '깊다', '작품', '한장', '사진', '한장', '거대하다', '장의', '목판', '추억', '사물', '일부', '직접', '강익중', '작가', '삼라만상', '어마', '마란', '작품', '시간', '감상']",Positive,0.9675031304359436
국립현대미술관 서울,서울 종로구 삼청로 30,고상이,실내 실외 언제나 좋아요.관람하고 뷰 좋은 곳 찾아 먹고 감상하고 최고예요,실내 실외 언제나 좋아요.관람하고 뷰 좋은 곳 찾아 먹고 감상하고 최고예요,"['실내', '실외', '좋다', '관람', '좋다', '감상', '최고']",Positive,0.9724336266517639
국립현대미술관 서울,서울 종로구 삼청로 30,masitseoyeon,좋았어요 전시 구경 하기 좋슴다,좋았어요 전시 구경 하기 좋슴다,"['좋다', '전시', '구경', '좋슴다']",Positive,0.9710500240325928
국립현대미술관 서울,서울 종로구 삼청로 30,위드산부인과0광화문0종로0의학박사,사색과 감상으로 하루를 채울 수 있는 곳강추,사색과 감상으로 하루를 채울 수 있는 곳강추,"['사색', '감상', '하루', '있다', '곳강추']",Positive,0.947819709777832
국립현대미술관 서울,서울 종로구 삼청로 30,비비웅이,올만에 전시 관람~작가 론 뮤익👍🏼👍🏽👍🏾만드는 과정을 영상으로도 보며 열심히 작품을 만들었던 대학때 추억을 떠올렸다.😁세심하게 표현한 작가의 작품을 보면서 친구들과 알찬 시간을 보냈다.🥰,올만에 전시 관람작가 론 뮤익만드는 과정을 영상으로도 보며 열심히 작품을 만들었던 대학때 추억을 떠올렸다.세심하게 표현한 작가의 작품을 보면서 친구들과 알찬 시간을 보냈다.,"['전시', '관람', '작가', '뮤익', '과정', '영상', '작품', '대학', '추억', '세심', '표현', '작가', '작품', '친구', '알차다', '시간']",Positive,0.9742338061332703
국립현대미술관 서울,서울 종로구 삼청로 30,ohg****,기획전시도 좋았고 오랜만의 백남준 작가의 작품도 볼 수 있어 좋았다.,기획전시도 좋았고 오랜만의 백남준 작가의 작품도 볼 수 있어 좋았다.,"['기획전', '시도', '좋다', '백남준', '작가', '작품', '있다', '좋다']",Positive,0.9724032878875732
국립현대미술관 서울,서울 종로구 삼청로 30,시농,"론뮤익 전시 마지막날~ 오픈전에 온 덕분에 여유롭게 전시를 보고, 도록도 샀다. 이곳의 전시는 항상 느끼지만~~  가성비 갑오브갑~~ 좋은 전시 감사합니다~^^","론뮤익 전시 마지막날 오픈전에 온 덕분에 여유롭게 전시를 보고, 도록도 샀다. 이곳의 전시는 항상 느끼지만 가성비 갑오브갑 좋은 전시 감사합니다","['론뮤익', '전시', '마지막', '오픈', '덕분', '전시', '보고', '도록', '전시', '항상', '가성', '오브', '좋다', '전시']",Positive,0.9749084115028381
국립현대미술관 서울,서울 종로구 삼청로 30,스콘맛집찾아요,요즘 학교에서 조소를 배우고 있다는 아이가 보고 싶은 전시가 있다며 론뮤익을 이야기했어요. 마침 청와대 관람 신청을 해놓았는데 바로 옆 😀 날씨도 맑고 바람도 시원하고 즐거운 전시였어요. 나만 몰랐나;; 너무 유명한 작가였는지 사람이 바글바글.. 미술관 다니면서 이렇게 사람많은 전시는 처음이었네요 ㅎ,요즘 학교에서 조소를 배우고 있다는 아이가 보고 싶은 전시가 있다며 론뮤익을 이야기했어요. 마침 청와대 관람 신청을 해놓았는데 바로 옆 날씨도 맑고 바람도 시원하고 즐거운 전시였어요. 나만 몰랐나 너무 유명한 작가였는지 사람이 바글바글.. 미술관 다니면서 이렇게 사람많은 전시는 처음이었네요 ㅎ,"['요즘', '학교', '조소', '있다', '아이', '보고', '전시', '있다', '론뮤익', '이야기', '마침', '청와대', '관람', '신청', '바로', '날씨', '맑다', '바람', '시원하다', '즐겁다', '전시', '유명하다', '작다', '사람', '미술관', '사람', '많다', '전시', '처음']",Positive,0.9714046716690063
국립현대미술관 서울,서울 종로구 삼청로 30,눈꽃2022,주말이라 그런지 방문객이 엄청 많아서 줄서서 대기하여 들어갔어요.사람이 너무 많아서 정신 없었지만전시장 안은 시원하니 좋았네요.,주말이라 그런지 방문객이 엄청 많아서 줄서서 대기하여 들어갔어요.사람이 너무 많아서 정신 없었지만전시장 안은 시원하니 좋았네요.,"['주말', '그렇다', '방문객', '많다', '서서', '대기', '사람', '많다', '정신', '없다', '전시장', '시원하다', '좋다']",Positive,0.9676494002342224
국립현대미술관 서울,서울 종로구 삼청로 30,phjgjy,다양한 볼거리와 쾌적한 공간~ 너무 좋은곳이네요~ 주중에 와보고 싶은곳!,다양한 볼거리와 쾌적한 공간 너무 좋은곳이네요 주중에 와보고 싶은곳!,"['다양하다', '볼거리', '쾌적하다', '공간', '좋다', '주중', '보고']",Positive,0.9751670360565186
국립현대미술관 서울,서울 종로구 삼청로 30,yulkun,너무 좋은곳ㅎ우리나라 힘내요~~,너무 좋은곳ㅎ우리나라 힘내요,"['좋다', '우리나라']",Positive,0.9744972586631775
국립현대미술관 서울,서울 종로구 삼청로 30,두기두기스,"론 뮤익 작가의 전시 두 번 째 관람!ㅎㅎ어두운 장소 라는 작품을 지난 첫 번 째 때는 사람이 너무 많아서 안 보고(웁스..) 갔는데, 이 날은 줄 서서 봤다. 왜 안 봤을까 했을 정도로 작품을 마주하자마자 압도되었다. 매서운 눈빛.. 에 머리 양쪽이 무언가에 눌리는 기분이 들었다.","론 뮤익 작가의 전시 두 번 째 관람!ㅎㅎ어두운 장소 라는 작품을 지난 첫 번 째 때는 사람이 너무 많아서 안 보고웁스.. 갔는데, 이 날은 줄 서서 봤다. 왜 안 봤을까 했을 정도로 작품을 마주하자마자 압도되었다. 매서운 눈빛.. 에 머리 양쪽이 무언가에 눌리는 기분이 들었다.","['뮤익', '작가', '전시', '관람', '두운', '장소', '작품', '지난', '사람', '많다', '보고', '웁스', '서서', '정도', '작품', '마주', '자마자', '압도', '눈빛', '머리', '양쪽', '무언가', '눌리', '기분']",Positive,0.8582016825675964
국립현대미술관 서울,서울 종로구 삼청로 30,로빈2187,직원분들이 너무 친절하시고 귀한작품을 감상하기 너무 좋은공간🫶🏻,직원분들이 너무 친절하시고 귀한작품을 감상하기 너무 좋은공간,"['직원', '친절하다', '작품', '감상', '좋다', '공간']",Positive,0.9732457995414734
