store_name,address,nickname,content,cleaned_content,tokenized_words,sentiment,sentiment_score
서울스카이,서울 송파구 올림픽로 300 117~123층,말티푸키,시부모님이 멀리서 오셔서롯데타워에는 한번 모시고 가보고 싶었어요~아쿠아리움은 아기가 너무 좋아했고전망대에서는 미세먼지 때문에 잘 안보이긴 했지만멋지고 행복한 시간이었습니다🤗,시부모님이 멀리서 오셔서롯데타워에는 한번 모시고 가보고 싶었어요아쿠아리움은 아기가 너무 좋아했고전망대에서는 미세먼지 때문에 잘 안보이긴 했지만멋지고 행복한 시간이었습니다,"['시부모', '멀리', '롯데', '타워', '한번', '모시', '아쿠아리움', '아기', '좋아하다', '전망대', '미세먼지', '때문', '멋지다', '행복하다', '시간']",Positive,0.974808931350708
서울스카이,서울 송파구 올림픽로 300 117~123층,ysh****,"올라감에 2시간의 기다림 15분의 즐거움, 다시 내려옴에 1시간의 기다림","올라감에 2시간의 기다림 15분의 즐거움, 다시 내려옴에 1시간의 기다림","['기다림', '즐거움', '다시', '기다림']",Positive,0.6814783215522766
서울스카이,서울 송파구 올림픽로 300 117~123층,ojs****,👍🏻👍🏻👍🏻👍🏻👍🏻,,[],Neutral,0.0
서울스카이,서울 송파구 올림픽로 300 117~123층,마트레인,서울123층타워입니다,서울123층타워입니다,"['서울', '타워', '이다']",Positive,0.7915471196174622
서울스카이,서울 송파구 올림픽로 300 117~123층,견군,멋진 야경 멋진 서울 멋진 서울스카이!,멋진 야경 멋진 서울 멋진 서울스카이!,"['멋지다', '야경', '멋지다', '서울', '멋지다', '서울', '스카이']",Positive,0.9672013521194458
서울스카이,서울 송파구 올림픽로 300 117~123층,원더우먼A,덕분에 좋은 추억남겼습니다!!,덕분에 좋은 추억남겼습니다!!,"['덕분', '좋다', '추억']",Positive,0.970443844795227
서울스카이,서울 송파구 올림픽로 300 117~123층,kimicc,업무상 일본 손님이 방한하면 매번 들리는 코스중에 한 곳 입니다. 전망대에 올라가서 볼거리도 많고 즐거웠다고 해서 이번에도 만족합니다 😊,업무상 일본 손님이 방한하면 매번 들리는 코스중에 한 곳 입니다. 전망대에 올라가서 볼거리도 많고 즐거웠다고 해서 이번에도 만족합니다,"['업무', '일본', '손님', '방한', '매번', '코스', '이다', '전망대', '볼거리', '많다', '즐겁다', '이번', '만족하다']",Positive,0.973861813545227
서울스카이,서울 송파구 올림픽로 300 117~123층,먹자구먹자구,꽃 전시를 하고 있어서사진찍기에는 좋았으나정가로 오면 조금 돈 아까운 느낌이에요!할인을 받아서 다행이었지만다소 즐길게 없어서 아쉬웠어요,꽃 전시를 하고 있어서사진찍기에는 좋았으나정가로 오면 조금 돈 아까운 느낌이에요!할인을 받아서 다행이었지만다소 즐길게 없어서 아쉬웠어요,"['전시', '있다', '사진', '찍기', '좋다', '정가', '조금', '아깝다', '느낌', '할인', '다행', '다소', '없다', '아쉽다']",Negative,0.9299411177635193
서울스카이,서울 송파구 올림픽로 300 117~123층,귀요미 홍이맘,네이버에서 구매 후 사전구매로 입장하는데 QR 코드가 인식이 안되서 좀 곤란했어요.. ㅠㅠ,네이버에서 구매 후 사전구매로 입장하는데 QR 코드가 인식이 안되서 좀 곤란했어요.. ㅠㅠ,"['네이버', '구매', '구매', '입장', '코드', '인식', '안되다', '곤란하다']",Positive,0.5524846911430359
서울스카이,서울 송파구 올림픽로 300 117~123층,흙마늘,외쿡사람  있다 신기 하냐?,외쿡사람 있다 신기 하냐?,"['외쿡', '사람', '있다', '신기']",Negative,0.8578733205795288
서울스카이,서울 송파구 올림픽로 300 117~123층,tae****,흠..기대가 너무 컸나봐요 ㅎㅎ,흠..기대가 너무 컸나봐요 ㅎㅎ,['기대'],Negative,0.6744263768196106
서울스카이,서울 송파구 올림픽로 300 117~123층,biki83n,저렴하게 구입하고 즉시 사용가능해서 좋았습니다,저렴하게 구입하고 즉시 사용가능해서 좋았습니다,"['저렴하다', '구입', '즉시', '사용', '가능하다', '좋다']",Positive,0.9706911444664001
서울스카이,서울 송파구 올림픽로 300 117~123층,pps****,명절당일에가서그런진 예약을했는데 1시간 넘어서 들어갔고 아쿠아는 생각보다 괜찮았어요 스카이는 비가 와서 그런지 완전 곰탕 비올때는 절대 가지마세요,명절당일에가서그런진 예약을했는데 1시간 넘어서 들어갔고 아쿠아는 생각보다 괜찮았어요 스카이는 비가 와서 그런지 완전 곰탕 비올때는 절대 가지마세요,"['명절', '당일', '예약', '아쿠아', '생각', '괜찮다', '스카이', '그렇다', '완전', '곰탕', '비올', '절대', '가지']",Positive,0.6020622253417969
서울스카이,서울 송파구 올림픽로 300 117~123층,투현이와엄마책장,넘멋진곳이예요💓💓💓💓,넘멋진곳이예요,['멋지다'],Positive,0.9747359752655029
서울스카이,서울 송파구 올림픽로 300 117~123층,릴리849,한번쯤은  꼭  오고싶었는데  드디여  방문했네요아쿠아도  애들데리고  꼭  들리면 볼꺼리도  많고  먹거리도  많아요없는게 없네요저녁에  뷰는 기가막히네요,한번쯤은 꼭 오고싶었는데 드디여 방문했네요아쿠아도 애들데리고 꼭 들리면 볼꺼리도 많고 먹거리도 많아요없는게 없네요저녁에 뷰는 기가막히네요,"['한번', '드디', '방문', '아쿠아', '데리', '많다', '먹거리', '많다', '없다', '없다', '저녁']",Positive,0.9737890958786011
서울스카이,서울 송파구 올림픽로 300 117~123층,LIFE MOVIE,너무 뷰가좋아요 추천합니다.,너무 뷰가좋아요 추천합니다.,"['좋다', '추천']",Positive,0.9747171998023987
서울스카이,서울 송파구 올림픽로 300 117~123층,쨀1207,날씨가 흐려서 조금 아쉬웠지만 시드니타워보다 훨씬 잘 되어있어서 좋았어요 ㅎㅎ 우리나라 짱!,날씨가 흐려서 조금 아쉬웠지만 시드니타워보다 훨씬 잘 되어있어서 좋았어요 ㅎㅎ 우리나라 짱!,"['날씨', '조금', '아쉽다', '시드니타워', '좋다', '우리나라']",Positive,0.9721643924713135
서울스카이,서울 송파구 올림픽로 300 117~123층,사람3732,야경뷰 아주 좋았습니당,야경뷰 아주 좋았습니당,"['야경', '아주', '좋다']",Positive,0.9748104810714722
서울스카이,서울 송파구 올림픽로 300 117~123층,즐겨랏,좋은 날씨로 시야까지 좋았어요.빙~ 돌아가며 구경하는 재미가 있어요.,좋은 날씨로 시야까지 좋았어요.빙 돌아가며 구경하는 재미가 있어요.,"['좋다', '날씨', '시야', '좋다', '구경', '재미', '있다']",Positive,0.9738839864730835
서울스카이,서울 송파구 올림픽로 300 117~123층,아름다운hee,멋져요~,멋져요,['멋지다'],Positive,0.9692167639732361
서울스카이,서울 송파구 올림픽로 300 117~123층,son****,비온뒤라 너무 맑고 뷰가 깨끗했어요.평일이라 붐비지 않아서 사진 찍기 편했어요.다음에 야경보러 또 갈꺼에요^^,비온뒤라 너무 맑고 뷰가 깨끗했어요.평일이라 붐비지 않아서 사진 찍기 편했어요.다음에 야경보러 또 갈꺼에요,"['비온뒤', '맑다', '깨끗하다', '평일', '사진', '찍기', '편하다', '다음', '야경']",Positive,0.9698421359062195
서울스카이,서울 송파구 올림픽로 300 117~123층,직경,높고 전망 좋긴 한데... 흠..최상층이 레스토랑 전용인건 좀 그렇네요.,높고 전망 좋긴 한데... 흠..최상층이 레스토랑 전용인건 좀 그렇네요.,"['높다', '전망', '좋다', '최상', '레스토랑', '전용', '그렇다']",Negative,0.9368268251419067
서울스카이,서울 송파구 올림픽로 300 117~123층,복숭아9686,연휴에 부모님 모시고 방문했는데 입장시간이 너무 오래걸렸어요..날 좋은 평일 방문 추천해요.,연휴에 부모님 모시고 방문했는데 입장시간이 너무 오래걸렸어요..날 좋은 평일 방문 추천해요.,"['연휴', '부모님', '모시', '방문', '입장', '시간', '좋다', '평일', '방문', '추천']",Positive,0.7264052033424377
서울스카이,서울 송파구 올림픽로 300 117~123층,popolily,뷰 맛집입니다~🌌 날씨가 흐려서 아쉬웠지만 그래도 나름 즐길만 했습니다밤에오면 더 예쁠것 같아요!!,뷰 맛집입니다 날씨가 흐려서 아쉬웠지만 그래도 나름 즐길만 했습니다밤에오면 더 예쁠것 같아요!!,"['맛집', '이다', '날씨', '아쉽다', '나름', '예쁘다', '같다']",Positive,0.9692772626876831
서울스카이,서울 송파구 올림픽로 300 117~123층,quf****,아이들이 너무 좋아합니다송파살면서 한번은 다녀오기 좋을것같아서 다녀옴,아이들이 너무 좋아합니다송파살면서 한번은 다녀오기 좋을것같아서 다녀옴,"['아이', '좋아하다', '송파', '한번', '좋다', '같다']",Positive,0.9646116495132446
서울스카이,서울 송파구 올림픽로 300 117~123층,박의선,날씨도 한목 ㅋㅋ좋았어요 ^^,날씨도 한목 ㅋㅋ좋았어요,"['날씨', '좋다']",Positive,0.973166286945343
서울스카이,서울 송파구 올림픽로 300 117~123층,스마일30,올해 여름 휴가는 Seoul sky에서~시원하고 재미있고 맛있게 즐겼네요!!^^,올해 여름 휴가는 Seoul sky에서시원하고 재미있고 맛있게 즐겼네요!!,"['올해', '여름', '휴가', '시원하다', '재미있다', '맛있다']",Positive,0.9711769819259644
서울스카이,서울 송파구 올림픽로 300 117~123층,꽁이5633,초고속 엘리베이터타는것도 신기했고  야경이 넘 멋져요!!!,초고속 엘리베이터타는것도 신기했고 야경이 넘 멋져요!!!,"['고속', '엘리베이터', '신기하다', '야경', '멋지다']",Positive,0.9736865758895874
서울스카이,서울 송파구 올림픽로 300 117~123층,hmo****,"한번가야지 하다가,방문하게 되었어요.낮에  방문.조금은 아쉬웠어요.다음 야간에  방문하고 싶어요","한번가야지 하다가,방문하게 되었어요.낮에 방문.조금은 아쉬웠어요.다음 야간에 방문하고 싶어요","['한번', '가야', '방문', '방문', '조금', '아쉽다', '다음', '야간', '방문']",Positive,0.9709068536758423
서울스카이,서울 송파구 올림픽로 300 117~123층,Gyver Choi,가족 모임과 아이들 나들일로 좋아요,가족 모임과 아이들 나들일로 좋아요,"['가족', '모임', '아이', '일로', '좋다']",Positive,0.9676921963691711
서울스카이,서울 송파구 올림픽로 300 117~123층,김미미,"그냥저냥 너무 더워서 저번에 외국인들 줄 겁나 길길래 궁금해서 가족나들이로 다녀왔어여. 나중엔 한번 더 와서 스카이 워크도 해보면 좋을 듯..! (가격이 근데 ..ㅎㄷㄷ..) 사람 많고… 덥고, 입장 관람 순서가 뒤바껴서 상영관도 요청해야 보여주고 아쉬운게 많았어요! 하지만 뷰는 대박임! 카페 좌석수를 좀 늘리고 시간 제한이 있으면 좋을 거같아요..","그냥저냥 너무 더워서 저번에 외국인들 줄 겁나 길길래 궁금해서 가족나들이로 다녀왔어여. 나중엔 한번 더 와서 스카이 워크도 해보면 좋을 듯..! 가격이 근데 ..ㅎㄷㄷ.. 사람 많고 덥고, 입장 관람 순서가 뒤바껴서 상영관도 요청해야 보여주고 아쉬운게 많았어요! 하지만 뷰는 대박임! 카페 좌석수를 좀 늘리고 시간 제한이 있으면 좋을 거같아요..","['덥다', '저번', '외국', '궁금하다', '가족', '나들이', '나중', '한번', '스카이', '좋다', '가격', '사람', '많다', '덥다', '입장', '관람', '순서', '뒤바', '상영', '관도', '요청', '아쉽다', '많다', '대박', '카페', '좌석', '시간', '제한', '있다', '좋다', '같다']",Positive,0.9578987956047058
서울스카이,서울 송파구 올림픽로 300 117~123층,꽃분이95,가족나들이로 좋아요 사진도 인화해주는서비스있으니 가족사진도 생겨요 더운여름날 당일치기피서여행으로 좋아요,가족나들이로 좋아요 사진도 인화해주는서비스있으니 가족사진도 생겨요 더운여름날 당일치기피서여행으로 좋아요,"['가족', '나들이', '좋다', '사진', '인화', '서비스', '있다', '가족사진', '덥다', '여름날', '당일치기', '여행', '좋다']",Positive,0.9704071283340454
서울스카이,서울 송파구 올림픽로 300 117~123층,푸른이슬82,"비가 오는 날씨였지만 구름 사이로 보이는 전망이 멋졌어요. 맑을 때, 저녁 때 또 오고 싶어요.","비가 오는 날씨였지만 구름 사이로 보이는 전망이 멋졌어요. 맑을 때, 저녁 때 또 오고 싶어요.","['날씨', '구름', '사이', '전망', '멋지다', '맑다', '저녁']",Positive,0.9743134379386902
서울스카이,서울 송파구 올림픽로 300 117~123층,댕솔직함,롯데타워 뭐 말할것도 없죠.좋습니다.,롯데타워 뭐 말할것도 없죠.좋습니다.,"['롯데', '타워', '없다', '좋다']",Positive,0.9737833738327026
서울스카이,서울 송파구 올림픽로 300 117~123층,SummerHere,서울 투어하면 무조건 가는데 이번 플라워 컨셉 상당히 마음에 듬!,서울 투어하면 무조건 가는데 이번 플라워 컨셉 상당히 마음에 듬!,"['서울', '투어', '무조건', '이번', '플라워', '컨셉', '상당하다', '마음']",Positive,0.9692352414131165
서울스카이,서울 송파구 올림픽로 300 117~123층,찌니내꺼거든,전망대 + 아쿠아리움 패키지로 예약. 서울 스카이는 두번째 와봤는데 역시 멋지네요. 아쿠아리움은 아쿠아플래닛을 가봐서 그런지 좀 시시하긴 하지만 볼만해요. 수달이 정말정말 귀여워요. 근데 벨루가는 어디..?,전망대 아쿠아리움 패키지로 예약. 서울 스카이는 두번째 와봤는데 역시 멋지네요. 아쿠아리움은 아쿠아플래닛을 가봐서 그런지 좀 시시하긴 하지만 볼만해요. 수달이 정말정말 귀여워요. 근데 벨루가는 어디..?,"['전망대', '아쿠아리움', '패키지', '예약', '서울', '스카이', '두번째', '역시', '멋지다', '아쿠아리움', '아쿠아플래닛', '그렇다', '시시하다', '만해', '수달', '귀엽다', '벨루가', '어디']",Positive,0.9689058065414429
서울스카이,서울 송파구 올림픽로 300 117~123층,yis****,뷰가 넘 멋져요 야경까지 봤네요 힐링 제대로 하고왔어요 파스테르 아이스크림콘 하고 쉐이크음료까지 넘 맛나요,뷰가 넘 멋져요 야경까지 봤네요 힐링 제대로 하고왔어요 파스테르 아이스크림콘 하고 쉐이크음료까지 넘 맛나요,"['멋지다', '야경', '힐링', '제대로', '파스', '테르', '아이스크림', '쉐이크', '음료']",Positive,0.9732421040534973
서울스카이,서울 송파구 올림픽로 300 117~123층,염염이,다음엔 야경읏 꼭 보고싶어요,다음엔 야경읏 꼭 보고싶어요,"['다음', '야경']",Positive,0.9671599864959717
서울스카이,서울 송파구 올림픽로 300 117~123층,hhlv,가족들과 오랜만에 나들이가서 즐거웠어요. 시원한곳에서 야경도 보고 아이스크림도 먹으며 가볍게 즐기기좋습니다.,가족들과 오랜만에 나들이가서 즐거웠어요. 시원한곳에서 야경도 보고 아이스크림도 먹으며 가볍게 즐기기좋습니다.,"['가족', '나들이', '즐겁다', '시원하다', '야경', '보고', '아이스크림', '가볍다', '좋다']",Positive,0.9721595048904419
서울스카이,서울 송파구 올림픽로 300 117~123층,hr0041,누군가 한낮은 덥다고 비추라고해서 흐린날 방문~~그래서 뷰가 저모양 ㅎㅎㅎ아쿠아리움까지 도보 5분이상 걸어가야함전망대 보고 식사후 느긋하게 아쿠아리움 투어하면 딱 3시간 소요되나 사람이 어마어마 많음.전망대보고 아쿠아가든카페에서 편히 커피나마실걸하고 깊이 반성함 ㅎㅎㅎ,누군가 한낮은 덥다고 비추라고해서 흐린날 방문그래서 뷰가 저모양 ㅎㅎㅎ아쿠아리움까지 도보 5분이상 걸어가야함전망대 보고 식사후 느긋하게 아쿠아리움 투어하면 딱 3시간 소요되나 사람이 어마어마 많음.전망대보고 아쿠아가든카페에서 편히 커피나마실걸하고 깊이 반성함 ㅎㅎㅎ,"['누군가', '한낮', '덥다', '방문', '모양', '아쿠아리움', '도보', '전망대', '보고', '식사', '느긋하다', '아쿠아리움', '투어', '소요', '사람', '많다', '전망대', '보고', '아쿠아', '가든', '카페', '편하다', '커피', '실걸', '깊이', '성함']",Positive,0.6342342495918274
서울스카이,서울 송파구 올림픽로 300 117~123층,오늘도 즐겁다9,진짜찐뷰맛집!!! 사진 너무 잘나와서 또 가야겠어요 저녁도 이쁠거같아요 ㅎㅎ,진짜찐뷰맛집!!! 사진 너무 잘나와서 또 가야겠어요 저녁도 이쁠거같아요 ㅎㅎ,"['진짜', '맛집', '사진', '저녁', '이쁘다', '같다']",Positive,0.9733668565750122
서울스카이,서울 송파구 올림픽로 300 117~123층,오드리친구,아이가 롯데월드타워 꼭대기 늘 가보고 싶데서잠실 간김에 급 예약하고 갔는데 네이버로 예약하니할인도 되고 바로입장도 가능하네요~그래도 가격이 비싸긴하지만ㅠ 뷰도 좋고 구경 잘하고 왔습니다!,아이가 롯데월드타워 꼭대기 늘 가보고 싶데서잠실 간김에 급 예약하고 갔는데 네이버로 예약하니할인도 되고 바로입장도 가능하네요그래도 가격이 비싸긴하지만ㅠ 뷰도 좋고 구경 잘하고 왔습니다!,"['아이', '롯데', '월드', '타워', '꼭대기', '잠실', '간김', '예약', '네이버', '예약', '할인', '바로', '입장', '가능하다', '가격', '비싸다', '좋다', '구경']",Positive,0.9699130058288574
서울스카이,서울 송파구 올림픽로 300 117~123층,차늬91,날씨가 너무 좋아서 안가면 후회 할거 같아서 ㅎ갓어용 네이버 에서 예약 하고 가니깐 저렴해요나중에 밤ㅇㅔ 한번 가볼까 합니다,날씨가 너무 좋아서 안가면 후회 할거 같아서 ㅎ갓어용 네이버 에서 예약 하고 가니깐 저렴해요나중에 밤ㅇㅔ 한번 가볼까 합니다,"['날씨', '좋다', '후회', '같다', '네이버', '예약', '저렴하다', '나중', '한번']",Positive,0.9652417302131653
서울스카이,서울 송파구 올림픽로 300 117~123층,릿G,서울스카이 뷰는 정말 최고였습니다. 한번쯤 가보는걸 추천해요~,서울스카이 뷰는 정말 최고였습니다. 한번쯤 가보는걸 추천해요,"['서울', '스카이', '정말', '최고', '한번', '추천']",Positive,0.9746169447898865
서울스카이,서울 송파구 올림픽로 300 117~123층,팔라스676,"워낙 상징적인 장소이니 한번 쯤은 가볼 만하나 그렇기 때문에 전혀 서비스마인드나 고객이 고객스러운 취급을 받기는 어렵고 직원들이 안내를 지시처럼하는 그리고 손님은 가고싶어 내발로 왔으니 따라야하는? 그런 분위기이다.몇 해전에 왔을때는 영상보고 스크린이 올라가면서 전망이 보이는 그게 가장 인상적이었는데 이번에는 케리커처가 6,000원이라고 써놓고 앉았더니 이사이즈로 하실래요 4명이세요 58,000원이요하고 동시에 그림그리기 시작해서 사기당한것 같은 느낌이 가장 인상적이었다","워낙 상징적인 장소이니 한번 쯤은 가볼 만하나 그렇기 때문에 전혀 서비스마인드나 고객이 고객스러운 취급을 받기는 어렵고 직원들이 안내를 지시처럼하는 그리고 손님은 가고싶어 내발로 왔으니 따라야하는? 그런 분위기이다.몇 해전에 왔을때는 영상보고 스크린이 올라가면서 전망이 보이는 그게 가장 인상적이었는데 이번에는 케리커처가 6,000원이라고 써놓고 앉았더니 이사이즈로 하실래요 4명이세요 58,000원이요하고 동시에 그림그리기 시작해서 사기당한것 같은 느낌이 가장 인상적이었다","['워낙', '상징', '장소', '한번', '만하', '그렇다', '때문', '전혀', '서비스', '마인드', '고객', '고객', '취급', '어렵다', '직원', '안내', '지시', '손님', '야하다', '그렇다', '분위기', '해전', '영상', '보고', '스크린', '전망', '그게', '가장', '인상', '이번', '케리', '처가', '사이즈', '이세', '동시', '그림', '그리기', '시작', '사기', '당하다', '같다', '느낌', '가장', '인상']",Negative,0.9192898273468018
서울스카이,서울 송파구 올림픽로 300 117~123층,sml****,서울스카이에서 보는 올림픽공원과 발밑으로 보이는 덜덜한 높이즐겁게 관람했습니다!!,서울스카이에서 보는 올림픽공원과 발밑으로 보이는 덜덜한 높이즐겁게 관람했습니다!!,"['스카이', '올림픽', '공원', '발밑', '덜덜', '높이', '즐겁다', '관람']",Positive,0.9725016951560974
서울스카이,서울 송파구 올림픽로 300 117~123층,viv****,아이와함께한 서울나들이~아침일찍 기차타고 놀이공원갔다가 피곤한상태에서 간 서울스카이~뷰를 보는순간 피로가 싹~가시는 느낌이었다.카메라로 다 닮을수없는것이 아쉬웠다.,아이와함께한 서울나들이아침일찍 기차타고 놀이공원갔다가 피곤한상태에서 간 서울스카이뷰를 보는순간 피로가 싹가시는 느낌이었다.카메라로 다 닮을수없는것이 아쉬웠다.,"['아이', '서울', '나들이', '아침', '일찍', '기차', '타고', '놀이', '공원', '피곤하다', '상태', '스카이', '순간', '피로', '카메라', '없다', '아쉽다']",Positive,0.9635964035987854
서울스카이,서울 송파구 올림픽로 300 117~123층,eun****,"멋져요! 생각보다 입장 대기가 길었지만 의미있었어요 👍🏻 부모님도 좋아하시고, 외국인 관광객 분들도 많았습니다!","멋져요! 생각보다 입장 대기가 길었지만 의미있었어요 부모님도 좋아하시고, 외국인 관광객 분들도 많았습니다!","['멋지다', '생각', '입장', '대기', '길다', '의미', '있다', '부모님', '좋아하다', '외국인', '관광객', '많다']",Positive,0.972976565361023
서울스카이,서울 송파구 올림픽로 300 117~123층,Hwangshinhyepiano,잊지못할 하루 만들어준 블루밍 서울스카이 쵝오❤️!,잊지못할 하루 만들어준 블루밍 서울스카이 쵝오!,"['하루', '블루', '서울', '스카이', '쵝오']",Positive,0.972271203994751
서울스카이,서울 송파구 올림픽로 300 117~123층,시편138,"비가 오락가락 하는 날 관람을 갔는데도 시야가 맑아서 잘 보였어요한강을 제대로 본 하루였습니다피아노치는 분들도 있어 운치있는 구경을 했지만, 한국사람보다 외국인이 더 많아서 놀랐어요단체 사진찍으며 시끄럽게 소리 지르니 천장이 높아 더 울려서 눈쌀을 찌푸리게 합니다117층에서 엘베는 내리고카페랑 레스토랑은 계속 에스컬레이터를 타고 올라가야합니다커피도 비쌀거라 여겼는데 괜찮았어요파스퇴르 아이스크림도 팔구요","비가 오락가락 하는 날 관람을 갔는데도 시야가 맑아서 잘 보였어요한강을 제대로 본 하루였습니다피아노치는 분들도 있어 운치있는 구경을 했지만, 한국사람보다 외국인이 더 많아서 놀랐어요단체 사진찍으며 시끄럽게 소리 지르니 천장이 높아 더 울려서 눈쌀을 찌푸리게 합니다117층에서 엘베는 내리고카페랑 레스토랑은 계속 에스컬레이터를 타고 올라가야합니다커피도 비쌀거라 여겼는데 괜찮았어요파스퇴르 아이스크림도 팔구요","['오락가락', '관람', '시야', '맑다', '한강', '제대로', '하루', '피아노', '있다', '운치', '있다', '구경', '한국', '사람', '외국인', '많다', '단체', '사진', '시끄럽다', '소리', '천장', '높다', '눈쌀', '엘베', '카페', '레스토랑', '계속', '에스컬레이터', '타고', '커피', '비싸다', '괜찮다', '파스퇴르', '아이스크림', '팔구']",Positive,0.9205752015113831
서울스카이,서울 송파구 올림픽로 300 117~123층,gkd****,7년만에 다시방문햇네요예전엔없던 영상상영도 새로 생겼구요 날씨가 좋아서 뷰가 멋지더라구요사람들이너무많아 포토존이용은 어려웠지만 주말이니까요,7년만에 다시방문햇네요예전엔없던 영상상영도 새로 생겼구요 날씨가 좋아서 뷰가 멋지더라구요사람들이너무많아 포토존이용은 어려웠지만 주말이니까요,"['다시', '방문', '예전', '없다', '영상', '상영', '새롭다', '날씨', '좋다', '멋지다', '사람', '많다', '포토', '이용', '어렵다', '주말']",Positive,0.9635568261146545
