store_name,address,nickname,content,cleaned_content,tokenized_words,sentiment,sentiment_score
성심당 본점,대전 중구 대종로480번길 15,쁘미뿌,샌드위치 정거장 생기고 처음 가봤는데 저녁에 간 거라 종류는 많지 않았는데 제가 좋아하는 애플브리샌드위치랑 잠봉이랑 잠봉애플 있어서 좋았어요! 잠봉은 짠맛이 강해서 애플잠봉으로 샀는데 너무 맛있었어요👍🏻 애플잠봉으로 꼭 드세요!,샌드위치 정거장 생기고 처음 가봤는데 저녁에 간 거라 종류는 많지 않았는데 제가 좋아하는 애플브리샌드위치랑 잠봉이랑 잠봉애플 있어서 좋았어요! 잠봉은 짠맛이 강해서 애플잠봉으로 샀는데 너무 맛있었어요 애플잠봉으로 꼭 드세요!,"['샌드위치', '정거장', '생기', '처음', '저녁', '종류', '많다', '좋아하다', '애플', '브리', '샌드위치', '잠봉', '잠봉', '애플', '있다', '좋다', '잠봉', '짠맛', '강하다', '애플', '잠봉', '맛있다', '애플', '잠봉']",Positive,0.9687271118164062
성심당 본점,대전 중구 대종로480번길 15,ska****,이미 성심당에 150만원 이상 쓰고 거의 대부분 종류의 빵을 먹어본 사람으로서 가장 최애빵만 10만원어치 사서 2일간 빵만 먹기 챌린지 후기.빵 다먹고 나서 살 5키로 쪗습니다 ㅋㅋ 하지만 전혀 후회되거나 하진않고 일년에 한번씩 하면 좋지 않을까 싶을정도로 만족도는 높습니다 빵을 굉장히 좋아하는 빵돌이로서 토요빵 퀸아망 월넛브레드 카카오순정 초코촉탄 초코버터바게트 튀소 튀소구마 크리미튀소 초코튀소 아몬드크로와상 부추빵 야채고로케 우유고로케 치즈퐁듀 티라미수파이 전부 맘에 맘에 들었습니다초코의 녹진함과 무거움 너무 달지않아서 초코버터바게트 이번에 새로 먹어봤는데 맘에 들었구요 야채고로케도 새로 제 위시 리스트에 넣어뒀습니다 성심당 빵중 초코류는 경험상 절대 실망시키지 않네요 좋은재료 왕창 넣어서 그런듯,이미 성심당에 150만원 이상 쓰고 거의 대부분 종류의 빵을 먹어본 사람으로서 가장 최애빵만 10만원어치 사서 2일간 빵만 먹기 챌린지 후기.빵 다먹고 나서 살 5키로 쪗습니다 ㅋㅋ 하지만 전혀 후회되거나 하진않고 일년에 한번씩 하면 좋지 않을까 싶을정도로 만족도는 높습니다 빵을 굉장히 좋아하는 빵돌이로서 토요빵 퀸아망 월넛브레드 카카오순정 초코촉탄 초코버터바게트 튀소 튀소구마 크리미튀소 초코튀소 아몬드크로와상 부추빵 야채고로케 우유고로케 치즈퐁듀 티라미수파이 전부 맘에 맘에 들었습니다초코의 녹진함과 무거움 너무 달지않아서 초코버터바게트 이번에 새로 먹어봤는데 맘에 들었구요 야채고로케도 새로 제 위시 리스트에 넣어뒀습니다 성심당 빵중 초코류는 경험상 절대 실망시키지 않네요 좋은재료 왕창 넣어서 그런듯,"['성심당', '이상', '거의', '대부분', '종류', '사람', '가장', '최애', '사서', '먹기', '린지', '후기', '쪗습니', '전혀', '후회되다', '하진', '한번', '좋다', '정도', '만족도', '높다', '굉장하다', '좋아하다', '돌이', '로서', '월넛', '브레드', '카카오', '순정', '초코', '초코', '버터', '바게트', '구마', '크리미', '초코', '아몬드', '크로와상', '부추', '야채', '고로케', '우유', '고로케', '치즈', '퐁듀', '티라미수', '파이', '전부', '초코', '녹진하다', '무거', '초코', '버터', '바게트', '이번', '새롭다', '야채', '고로케', '새롭다', '위시', '리스트', '성심당', '초코', '경험', '절대', '실망', '좋다', '재료', '왕창', '그렇다']",Positive,0.9492448568344116
성심당 본점,대전 중구 대종로480번길 15,꾸1489,튀소 / 초코튀소 / 작은메아리 / 명란바게트 강추!!!! 너무 맛있어서 매일 오고싶어요 😭,튀소 초코튀소 작은메아리 명란바게트 강추!!!! 너무 맛있어서 매일 오고싶어요,"['초코', '작다', '메아리', '명란', '바게트', '강추', '맛있다', '매일']",Positive,0.9733896851539612
성심당 본점,대전 중구 대종로480번길 15,춘삼2323,여러분 애플브리치즈 샌드위치 꼭 드시고요 그냥 먹고싶은 거 다 먹으세요 웬만하면 다 맛있으니깐요근데 저 딱 하나 실패했는데 저 메론 데니쉬???안에 메론맛 나는 크림이 너무 인위적이라 좀 먹기 힘들었네요☆ 근데 하나도 안서운함 하나 빼고는 다 맛있어서;;,여러분 애플브리치즈 샌드위치 꼭 드시고요 그냥 먹고싶은 거 다 먹으세요 웬만하면 다 맛있으니깐요근데 저 딱 하나 실패했는데 저 메론 데니쉬???안에 메론맛 나는 크림이 너무 인위적이라 좀 먹기 힘들었네요 근데 하나도 안서운함 하나 빼고는 다 맛있어서,"['여러분', '애플', '브리', '치즈', '샌드위치', '그냥', '웬만하다', '맛있다', '하나', '실패하다', '메론', '데니', '메론', '크림', '인위', '먹기', '힘들다', '하나', '서운하다', '하나', '맛있다']",Positive,0.8394176959991455
성심당 본점,대전 중구 대종로480번길 15,alt****,"대전의 자랑 성심당⭐️대전의 자랑답게 빵종류가 다양하고, 정말 정말 크고 한번쯤 살면서 가볼 가치가 있었어요!대전역 내리자마자 대전역 성심당점 간판도 보여서 사진찍었지만, 제가 방문한곳은 대전역에서 한정거장 떨어진 거리의 중앙역 성심당 본점✨저는 취향이 할매입맛으로 확실해서 본점에선아래 리스트로 빵 구매해 왔구, 가족들 반응도 좋았습니다. (+가격이 너무너무너무너무 착해요! ㅠㅠ)*성심당 본점 빵구매 리스트 -호밀브롯 하프 -튀김소보로 X2-튀소구마 X2-공주알밤식빵 -월넛브레드 -토요빵 비록 본점 내부로 입장하면, 도떼기 시장 같은 풍경이지만.. 빵에 눈돌아가면 그런건 신경도 안쓰이고 원하는 빵 찾으려 눈에 불을키고 돌진하게 되니, 양손은 일단 가볍게 입장하시라는 팁드립니다!","대전의 자랑 성심당대전의 자랑답게 빵종류가 다양하고, 정말 정말 크고 한번쯤 살면서 가볼 가치가 있었어요!대전역 내리자마자 대전역 성심당점 간판도 보여서 사진찍었지만, 제가 방문한곳은 대전역에서 한정거장 떨어진 거리의 중앙역 성심당 본점저는 취향이 할매입맛으로 확실해서 본점에선아래 리스트로 빵 구매해 왔구, 가족들 반응도 좋았습니다. 가격이 너무너무너무너무 착해요! ㅠㅠ성심당 본점 빵구매 리스트 호밀브롯 하프 튀김소보로 X2튀소구마 X2공주알밤식빵 월넛브레드 토요빵 비록 본점 내부로 입장하면, 도떼기 시장 같은 풍경이지만.. 빵에 눈돌아가면 그런건 신경도 안쓰이고 원하는 빵 찾으려 눈에 불을키고 돌진하게 되니, 양손은 일단 가볍게 입장하시라는 팁드립니다!","['대전', '자랑', '성심당', '대전', '자랑', '종류', '다양하다', '정말', '정말', '한번', '가치', '있다', '전역', '전역', '성심당', '간판', '사진', '방문', '전역', '정거장', '거리', '중앙', '성심당', '본점', '취향', '입맛', '확실하다', '본점', '아래', '리스트', '구매', '가족', '반응', '좋다', '가격', '착하다', '성심당', '본점', '구매', '리스트', '호밀', '브롯', '하프', '튀김', '소보', '구마', '공주', '알밤', '식빵', '월넛', '브레드', '비록', '본점', '내부', '입장', '시장', '같다', '풍경', '그렇다', '신경', '원하다', '돌진', '일단', '가볍다', '입장']",Positive,0.9520036578178406
성심당 본점,대전 중구 대종로480번길 15,진주송이,성심당 샌드위치와 빵은 포기 못하쥬 ㅋㅋㅋ대전에 들렀다 가는길에 일부러 본점 들러 샌드위치와 빵 구입했어요 샌드위치 일반 빵집의 반값밖에 안되는거 같아요 맛도 좋고 가격도 착하고 푸짐하게 한 가득 사갑니다.,성심당 샌드위치와 빵은 포기 못하쥬 ㅋㅋㅋ대전에 들렀다 가는길에 일부러 본점 들러 샌드위치와 빵 구입했어요 샌드위치 일반 빵집의 반값밖에 안되는거 같아요 맛도 좋고 가격도 착하고 푸짐하게 한 가득 사갑니다.,"['성심당', '샌드위치', '포기', '못하쥬', '대전', '일부러', '본점', '샌드위치', '구입', '샌드위치', '일반', '빵집', '반값', '안되다', '같다', '좋다', '가격', '착하다', '가득']",Positive,0.952263355255127
성심당 본점,대전 중구 대종로480번길 15,릴리9597,"대전가면 늘 들리는 성심당, 이번엔 샌드위치정거장이 생겼다고해서 처음들러봤는데, 애플브리치즈랑 잠봉뵈르 다 너무너무 맛있어요!!! 재구매각입니당~","대전가면 늘 들리는 성심당, 이번엔 샌드위치정거장이 생겼다고해서 처음들러봤는데, 애플브리치즈랑 잠봉뵈르 다 너무너무 맛있어요!!! 재구매각입니당","['대전', '가면', '성심당', '이번', '샌드위치', '정거', '처음', '애플', '브리', '치즈', '잠봉뵈르', '맛있다', '매각', '이다']",Positive,0.9722771644592285
성심당 본점,대전 중구 대종로480번길 15,로미스토리4,"오랜만에 대전가서 왕관 샌드위치, 🥪이탈리안, 애플 브리치즈, 파사비포카차, 시칠리안살사 등 여러 가지 샌드위치 사먹었어요~ 언제나 사람이 많은 성심당이지만 빵순이라면 지날칠 수 없는 곳!😊 🥖","오랜만에 대전가서 왕관 샌드위치, 이탈리안, 애플 브리치즈, 파사비포카차, 시칠리안살사 등 여러 가지 샌드위치 사먹었어요 언제나 사람이 많은 성심당이지만 빵순이라면 지날칠 수 없는 곳!","['전가', '왕관', '샌드위치', '이탈리안', '애플', '브리', '치즈', '사비', '포카차', '리안', '살사', '여러', '가지', '샌드위치', '사람', '많다', '성심당', '순이', '라면', '없다']",Positive,0.9633468985557556
성심당 본점,대전 중구 대종로480번길 15,ssslllsss01,대전하면 성심당!당연 맛있는 튀소메뉴들👍🏻👍🏻👍🏻👍🏻👍🏻최애는 튀소구마바삭 달콤 부드러움❤️최고최고👍🏻,대전하면 성심당!당연 맛있는 튀소메뉴들최애는 튀소구마바삭 달콤 부드러움최고최고,"['대전', '성심당', '맛있다', '메뉴', '최애', '구마', '바삭', '달콤', '부드러움', '최고', '최고']",Positive,0.9723736047744751
성심당 본점,대전 중구 대종로480번길 15,jjjyyy00,임산부 프리패스 이용으로 방문했어요 !!친절하게 안내해주시고 계산할 때 할인 안내도 해주셔서 감사했습니당빵도 너무 맛있게 잘 먹었습니당,임산부 프리패스 이용으로 방문했어요 !!친절하게 안내해주시고 계산할 때 할인 안내도 해주셔서 감사했습니당빵도 너무 맛있게 잘 먹었습니당,"['임산부', '프리', '패스', '이용', '방문', '친절하다', '안내', '계산', '할인', '안내', '맛있다']",Positive,0.9729598760604858
성심당 본점,대전 중구 대종로480번길 15,비주71,성심당에서 빵 구입하려고 아침 새벽에 3시간 달려가 구입했네요.기다리지 않아 다행이고 맛있게 먹었습니다.,성심당에서 빵 구입하려고 아침 새벽에 3시간 달려가 구입했네요.기다리지 않아 다행이고 맛있게 먹었습니다.,"['성심당', '구입', '아침', '새벽', '구입', '다행', '맛있다']",Positive,0.9693341255187988
성심당 본점,대전 중구 대종로480번길 15,wodmfcx,시루만 살 거면시루 전용 매장으로 가세요!!줄 짧습니다...토요일 오후에 갔는데도 10분 기다린 듯..맛있는 옛날케이크맛 ㅜㅜ🥹👍🏻💗,시루만 살 거면시루 전용 매장으로 가세요!!줄 짧습니다...토요일 오후에 갔는데도 10분 기다린 듯..맛있는 옛날케이크맛 ㅜㅜ,"['시루', '시루', '전용', '매장', '가세', '짧다', '토요일', '오후', '맛있다', '옛날', '케이크']",Negative,0.7698859572410583
성심당 본점,대전 중구 대종로480번길 15,MSAK,성심당 가려고 들린 대전. 연휴라 그런지 웨이팅이 어마어마하네요. 샌드위치정거장이랑 시루만 판매하는곳은 바로 들어갈 수 있어요. 역시나 맛도있고 친절한 성심당👍🏻,성심당 가려고 들린 대전. 연휴라 그런지 웨이팅이 어마어마하네요. 샌드위치정거장이랑 시루만 판매하는곳은 바로 들어갈 수 있어요. 역시나 맛도있고 친절한 성심당,"['성심당', '대전', '연휴', '그렇다', '웨이팅', '어마어마하다', '샌드위치', '정거장', '시루', '판매', '바로', '있다', '역시', '있다', '친절하다', '성심당']",Positive,0.9712218046188354
성심당 본점,대전 중구 대종로480번길 15,연극죽여주는이야기,정말 손님이 어마무시 하네요 맛도 양도 가격도 좋아서 한시간 이샹 기다려서 산 후기네요 그래도 사서 다행~,정말 손님이 어마무시 하네요 맛도 양도 가격도 좋아서 한시간 이샹 기다려서 산 후기네요 그래도 사서 다행,"['정말', '손님', '어마', '무시', '양도', '가격', '좋다', '시간', '이샹', '후기', '사서', '다행']",Positive,0.8897377848625183
성심당 본점,대전 중구 대종로480번길 15,은쨩life,말차튀소가 핫하길래 구매해보고 리코타잠봉샌드위치도 처음보는거길래 구매했는데 리코타잠봉샌드위치가 9600원이라서 정말 놀랬다. 근데 겉 빵이 딱딱해서 치아 약한 사람들은 못먹을거같다. 그래도 잠봉도 안짜고 레몬크림에 당근라페도 있어서 식감 다양하게 느낄수있었다.말차튀소는 입문자용한테 정말 딱이고 러버들은 실망하는 맛크림이 생각보다 달지만 한번쯤 먹을 수 있는 말차튀소말차맛이 너무 약하긴했다!,말차튀소가 핫하길래 구매해보고 리코타잠봉샌드위치도 처음보는거길래 구매했는데 리코타잠봉샌드위치가 9600원이라서 정말 놀랬다. 근데 겉 빵이 딱딱해서 치아 약한 사람들은 못먹을거같다. 그래도 잠봉도 안짜고 레몬크림에 당근라페도 있어서 식감 다양하게 느낄수있었다.말차튀소는 입문자용한테 정말 딱이고 러버들은 실망하는 맛크림이 생각보다 달지만 한번쯤 먹을 수 있는 말차튀소말차맛이 너무 약하긴했다!,"['말차', '소가', '구매', '리코', '잠봉', '샌드위치', '처음', '구매', '리코', '잠봉', '샌드위치', '정말', '놀래다', '딱딱하다', '치아', '약하다', '사람', '같다', '잠봉', '레몬', '크림', '당근', '있다', '식감', '다양하다', '말차', '입문', '정말', '딱이다', '러버', '실망하다', '크림', '생각', '한번', '있다', '말차', '말차', '약하다']",Positive,0.6795816421508789
성심당 본점,대전 중구 대종로480번길 15,미식이97,빵지순례 하러 대전의 성심당 본점 왔어요연휴라 그런가 사람들이 많아서 줄서는게 너무 힘드네요그래도 맛있는 빵 믾이 사서 좋아여,빵지순례 하러 대전의 성심당 본점 왔어요연휴라 그런가 사람들이 많아서 줄서는게 너무 힘드네요그래도 맛있는 빵 믾이 사서 좋아여,"['순례', '대전', '성심당', '본점', '연휴', '런가', '사람', '많다', '힘드다', '맛있다', '사서', '좋다']",Positive,0.9612466096878052
성심당 본점,대전 중구 대종로480번길 15,다섄,성심당 본점 바로 옆에 있는 샌드위치 정거장에 갔아요! 웨이팅 없어서 바로 들어갈 수 있어요~ 사진은 애플브리치즈랑 카프레제 샌드위치인데 야끼소바빵도 맛있고 포카차 2종도 존맛!! 성심당 샌드위치 다 맛있어서 샌드위치만 왕창 사도 두손 가득할 수 있어요 ㅎㅎ,성심당 본점 바로 옆에 있는 샌드위치 정거장에 갔아요! 웨이팅 없어서 바로 들어갈 수 있어요 사진은 애플브리치즈랑 카프레제 샌드위치인데 야끼소바빵도 맛있고 포카차 2종도 존맛!! 성심당 샌드위치 다 맛있어서 샌드위치만 왕창 사도 두손 가득할 수 있어요 ㅎㅎ,"['성심당', '본점', '바로', '있다', '샌드위치', '정거장', '웨이', '없다', '바로', '있다', '사진', '애플', '브리', '치즈', '카프레', '샌드위치', '야끼소바', '맛있다', '포카차', '종도', '존맛', '성심당', '샌드위치', '맛있다', '샌드위치', '왕창', '사도', '가득하다', '있다']",Positive,0.968051552772522
성심당 본점,대전 중구 대종로480번길 15,Happy0616,역시나 줄은 엄청 길고 오랜만에 갔는데 새로운 빵들이 보여서 사봤는데 미니 맘모스였나? 그게 생각보다 맛있고 녹차 크로와상은 생각보다 녹차맛은 연하고 먹기가 힘들어요 ㅋㅋ,역시나 줄은 엄청 길고 오랜만에 갔는데 새로운 빵들이 보여서 사봤는데 미니 맘모스였나? 그게 생각보다 맛있고 녹차 크로와상은 생각보다 녹차맛은 연하고 먹기가 힘들어요 ㅋㅋ,"['역시', '길다', '새롭다', '미니', '맘모스', '그게', '생각', '맛있다', '녹차', '크로와상', '생각', '녹차', '연하다', '먹기', '힘들다']",Negative,0.587605357170105
성심당 본점,대전 중구 대종로480번길 15,뇽안94,"대전에 가는 이유, 그거슨 성심당.......하루 당일치기로 대전을 다녀오면서 제일 먼저 목적지로 정한 곳 성심당 ❀⸜(˶´ ˘ `˶)⸝❀ 두번째 방문이었는데 사람들은 더 많아졌고, 웨이팅은 그만큼 더 길어졌어요. 지난번엔 30분 정도 기다렸다가 입장이 가능했는데 이번 방문에는 거의 50분 가까이 기다렸던 거 같아요. 하지만 웨이팅 정리해주시는 분들 계셔서 혼잡스럽지는 않았습니다.다만, 가게 안에 결제할 때 줄이 너무 복잡하고 이건 좀 개선이 필요할 거 같아요. 계산 줄 따로 없다고 앞으로 오라는데 뒤에 사람 앞으로 가면서 오히려 부딪히고 가게가 더 정리가 안되는 느낌이었습니다. 이 부분은 지난번에도 아쉬웠는데 사람이 많다보니 오늘 더 정신없더라고요.... 이 부분은 생각해보시는 게 좋을 거 같아욤..","대전에 가는 이유, 그거슨 성심당.......하루 당일치기로 대전을 다녀오면서 제일 먼저 목적지로 정한 곳 성심당 두번째 방문이었는데 사람들은 더 많아졌고, 웨이팅은 그만큼 더 길어졌어요. 지난번엔 30분 정도 기다렸다가 입장이 가능했는데 이번 방문에는 거의 50분 가까이 기다렸던 거 같아요. 하지만 웨이팅 정리해주시는 분들 계셔서 혼잡스럽지는 않았습니다.다만, 가게 안에 결제할 때 줄이 너무 복잡하고 이건 좀 개선이 필요할 거 같아요. 계산 줄 따로 없다고 앞으로 오라는데 뒤에 사람 앞으로 가면서 오히려 부딪히고 가게가 더 정리가 안되는 느낌이었습니다. 이 부분은 지난번에도 아쉬웠는데 사람이 많다보니 오늘 더 정신없더라고요.... 이 부분은 생각해보시는 게 좋을 거 같아욤..","['대전', '이유', '그거슨', '성심당', '하루', '당일치기', '대전', '제일', '먼저', '목적지', '성심당', '두번째', '방문', '사람', '웨이팅', '지난번', '정도', '입장', '가능하다', '이번', '방문', '거의', '가까이', '같다', '웨이', '정리', '계시다', '혼잡', '다만', '가게', '결제', '복잡하다', '이건', '개선', '필요하다', '같다', '계산', '없다', '사람', '가면', '오히려', '가게', '정리', '안되다', '부분', '지난번', '아쉽다', '사람', '많다', '오늘', '정신', '없다', '부분', '생각', '좋다', '같아욤']",Positive,0.6591714024543762
성심당 본점,대전 중구 대종로480번길 15,다람쥐냥냥,"저번에 이거 사고싶었는데 크림종류 많이 사서 안 사고 옴.친구도 성심당 간다길래 나도! 하고 갔더니 얘도 이거 사러 왔다고 함ㅋㅋㅋ 말차 좋아하는데, 약간 말차요거트? 상큼함초코가 너무 큼직하고 꾸덕하면서 달아서 내 입엔 무화과가 더 좋았음ㅠㅠ 말차는 말차롤 강추! 찐한 맛은 아니고 은은한데 순수롤 좋아하는 사람이라면 아주 당연하게 맛있음><11시 좀 넘어서 그냥 들어갔는데 나올 때 보니 줄 서 있음","저번에 이거 사고싶었는데 크림종류 많이 사서 안 사고 옴.친구도 성심당 간다길래 나도! 하고 갔더니 얘도 이거 사러 왔다고 함ㅋㅋㅋ 말차 좋아하는데, 약간 말차요거트? 상큼함초코가 너무 큼직하고 꾸덕하면서 달아서 내 입엔 무화과가 더 좋았음ㅠㅠ 말차는 말차롤 강추! 찐한 맛은 아니고 은은한데 순수롤 좋아하는 사람이라면 아주 당연하게 맛있음11시 좀 넘어서 그냥 들어갔는데 나올 때 보니 줄 서 있음","['저번', '크림', '종류', '사서', '사고', '친구', '성심당', '말차', '좋아하다', '약간', '말차', '요거트', '상큼', '초코', '큼직하다', '무화과', '좋다', '말차', '말차', '강추', '아니다', '은은하다', '순수', '좋아하다', '사람', '라면', '아주', '당연하다', '맛있다', '그냥', '있다']",Positive,0.9142701625823975
성심당 본점,대전 중구 대종로480번길 15,MoonShot9,"성심당 빵 종류가 진짜 다양하고 하나하나 다 맛있어요! 🍞 🥯 🥐 🥖 대전에 오래 살았고 성심당도, 빵도 좋아해서 사진에 나온 수많은 빵들을 왠만하면 다 한번씩 먹어본 대전시민 피셜 입니다 (뿌듯!) ㅎㅎ 전통빵은 전통빵 대로, 성심당에서 개발한 새로운 빵들은 새로운 빵대로, 샌드위치류도 다 맛있고 무엇보다 가성비가 너무 좋아요. 저렴하게 맛있는 빵 먹을 수 있는 성심당! 노잼도시 대전을 유잼도시, 가보고 싶은 도시로 만들어준 대전의 문화 성심당ㅎㅎ 예전부터 좋아하던 빵들도 명맥을 유지하고 있고 항상 맛있는 신제품들이 푱푱 튀어나와서 구경하는 재미 먹는 재미가 있어요. 변함없이 맛있는, 좋아하는 빵들은 클로즈업 해서 찍어봤습니다! (팁) 저 후렌치파이 우유랑 먹으면 궁전갑니다🍞 🥯 🥐","성심당 빵 종류가 진짜 다양하고 하나하나 다 맛있어요! 대전에 오래 살았고 성심당도, 빵도 좋아해서 사진에 나온 수많은 빵들을 왠만하면 다 한번씩 먹어본 대전시민 피셜 입니다 뿌듯! ㅎㅎ 전통빵은 전통빵 대로, 성심당에서 개발한 새로운 빵들은 새로운 빵대로, 샌드위치류도 다 맛있고 무엇보다 가성비가 너무 좋아요. 저렴하게 맛있는 빵 먹을 수 있는 성심당! 노잼도시 대전을 유잼도시, 가보고 싶은 도시로 만들어준 대전의 문화 성심당ㅎㅎ 예전부터 좋아하던 빵들도 명맥을 유지하고 있고 항상 맛있는 신제품들이 푱푱 튀어나와서 구경하는 재미 먹는 재미가 있어요. 변함없이 맛있는, 좋아하는 빵들은 클로즈업 해서 찍어봤습니다! 팁 저 후렌치파이 우유랑 먹으면 궁전갑니다","['성심당', '종류', '진짜', '다양하다', '하나', '하나', '맛있다', '대전', '성심당', '좋아하다', '사진', '수많다', '왠만하다', '한번', '대전', '시민', '피셜', '이다', '뿌듯', '전통', '전통', '대로', '성심당', '개발', '새롭다', '새롭다', '샌드위치', '맛있다', '무엇', '가성', '좋다', '저렴하다', '맛있다', '있다', '성심당', '노잼', '도시', '대전', '유잼', '도시', '도시', '대전', '문화', '성심당', '예전', '좋아하다', '명맥', '유지', '있다', '항상', '맛있다', '신제품', '푱푱', '구경', '재미', '재미', '있다', '변하다', '맛있다', '좋아하다', '클로즈업', '후렌치', '파이', '우유', '궁전']",Positive,0.9698951840400696
성심당 본점,대전 중구 대종로480번길 15,사악천사77,성심당 한번도 안가봤다는 친구한테 선물ㅋ성심당은 맛도 있지만 가성비 때문에 가는거라직접 방문해서 느끼는건데ㅋ 초코튀소 사려했는데 없어ㅠ왜 맨날 없는거냐.. 가격을 올리더라도 더 만들어줘라ㅠㅠ,성심당 한번도 안가봤다는 친구한테 선물ㅋ성심당은 맛도 있지만 가성비 때문에 가는거라직접 방문해서 느끼는건데ㅋ 초코튀소 사려했는데 없어ㅠ왜 맨날 없는거냐.. 가격을 올리더라도 더 만들어줘라ㅠㅠ,"['성심당', '한번', '친구', '선물', '성심당', '있다', '가성', '때문', '직접', '방문', '초코', '사려', '없다', '없다', '가격']",Positive,0.6990969777107239
