store_name,address,nickname,content,cleaned_content,tokenized_words,sentiment,sentiment_score
경주월드,경북 경주시 보문로 544,Rndldi,약간의 기대만 하고 갔는데 생각 이상으로 재미있었습니다. 오히려 재밋게 놀다보니 힘들었어요.드라켄은 두번 탓습니다,약간의 기대만 하고 갔는데 생각 이상으로 재미있었습니다. 오히려 재밋게 놀다보니 힘들었어요.드라켄은 두번 탓습니다,"['약간', '기대', '생각', '이상', '재미있다', '오히려', '재밋', '힘들다', '드라켄', '탓습니']",Positive,0.9593192338943481
경주월드,경북 경주시 보문로 544,30zzi,재미있개 놀다 왔어요 츄천합니다 볼거 많고 재밌어요!!!,재미있개 놀다 왔어요 츄천합니다 볼거 많고 재밌어요!!!,"['재미있다', '천하다', '많다', '재밌다']",Positive,0.9739765524864197
경주월드,경북 경주시 보문로 544,thd****,수도권 놀이동산보다 기구별 거리가 짧은게 최대의 장점이고 초등저학년들 놀기 딱 좋은곳이예요 군데군데 이용객들을 위한 배려도 돋보이구요~~ 재방문의사 백프로구요 가까이 있으시면 추천 또 추천이여~~^^,수도권 놀이동산보다 기구별 거리가 짧은게 최대의 장점이고 초등저학년들 놀기 딱 좋은곳이예요 군데군데 이용객들을 위한 배려도 돋보이구요 재방문의사 백프로구요 가까이 있으시면 추천 또 추천이여,"['수도권', '놀이동산', '구별', '거리', '짧다', '최대', '장점', '초등', '저학년', '좋다', '군데군데', '이용', '배려', '방문', '의사', '백프로', '가까이', '있다', '추천', '추천']",Positive,0.9722979068756104
경주월드,경북 경주시 보문로 544,seo****,가보니 할로윈 파티도 하고 규모는 작다고 생각했는데 역시 경주월드 즐길거리가 너무 많고 무서운거 완전완전 못 타는 사람인데 급류타기 같은 재밌는것도 있어서 즐겼어요! 경주월드 규모가 훨씬 커지면 위에 있는 테마파크 망하겠다는 생각들정도로 재밌게 놀다왔습니다!,가보니 할로윈 파티도 하고 규모는 작다고 생각했는데 역시 경주월드 즐길거리가 너무 많고 무서운거 완전완전 못 타는 사람인데 급류타기 같은 재밌는것도 있어서 즐겼어요! 경주월드 규모가 훨씬 커지면 위에 있는 테마파크 망하겠다는 생각들정도로 재밌게 놀다왔습니다!,"['할로윈', '파티', '규모', '작다', '생각', '역시', '경주월드', '거리', '많다', '무섭다', '완전', '완전', '사람', '급류', '같다', '재밌다', '있다', '경주월드', '규모', '있다', '테마', '파크', '망하다', '생각', '정도', '재밌다']",Positive,0.9720723032951355
경주월드,경북 경주시 보문로 544,순수만월,익스트림한건 경주월드에여 진짜 무섭고 재미난거 많고 대기줄 틈틈이 의자가 많아서 대기가 그렇게 힘들지는 않았어요 새로나온 타임라이더도 탔는데 예뻣습니다,익스트림한건 경주월드에여 진짜 무섭고 재미난거 많고 대기줄 틈틈이 의자가 많아서 대기가 그렇게 힘들지는 않았어요 새로나온 타임라이더도 탔는데 예뻣습니다,"['익스트림', '경주월드', '진짜', '무섭다', '재미', '많다', '틈틈이', '의자', '많다', '대기', '힘들다', '새롭다', '타임', '라이더', '예뻣습니']",Positive,0.9718658924102783
경주월드,경북 경주시 보문로 544,nightmare5389,재밌네요 주말에 왔는데 적당히 사람이 있었어요,재밌네요 주말에 왔는데 적당히 사람이 있었어요,"['재밌다', '주말', '적당하다', '사람', '있다']",Positive,0.9366713166236877
경주월드,경북 경주시 보문로 544,c58****,아이와 재미나게 잘놀고왔어요♡,아이와 재미나게 잘놀고왔어요,"['아이', '재미나']",Positive,0.9743691682815552
경주월드,경북 경주시 보문로 544,울림101,"너무 즐겁게 다녀왔습니다, 많이 기다리지 않고 바로바로 탔어요. 타임라이더는 두바퀴 도는데 생각보다 스릴있었어요. 타임라이더랑 파에톤은 멀미나니까 꼭 멀미약 드시고 타시길... ㅎㅎ","너무 즐겁게 다녀왔습니다, 많이 기다리지 않고 바로바로 탔어요. 타임라이더는 두바퀴 도는데 생각보다 스릴있었어요. 타임라이더랑 파에톤은 멀미나니까 꼭 멀미약 드시고 타시길... ㅎㅎ","['즐겁다', '타임', '라이더', '바퀴', '생각', '스릴', '있다', '타임', '라이더', '파에톤', '멀다', '미나', '멀미']",Positive,0.9734190702438354
경주월드,경북 경주시 보문로 544,Peterpanholic,아이들이 좋아할만한 놀이기구가 많음매년 새로운 놀이기구가 생기는 것도 좋아요초등 고학년부터 잼있을 것들이 많음,아이들이 좋아할만한 놀이기구가 많음매년 새로운 놀이기구가 생기는 것도 좋아요초등 고학년부터 잼있을 것들이 많음,"['아이', '좋아하다', '놀이기구', '많다', '매년', '새롭다', '놀이기구', '좋다', '초등', '고학년', '많다']",Positive,0.9723215699195862
경주월드,경북 경주시 보문로 544,우단,평일에가니 웬만한거 다 타고왔네요. 11시쯤 도착해서 약 6시까지 넘 잘 놀았음. 놀이기구가 하나같이 미쳐있는데 넘  맘에 들고 시설 이렇게 깨끗한 놀이공원 처음보는거같아요 거리만 가깝다면 또 가고싶네요,평일에가니 웬만한거 다 타고왔네요. 11시쯤 도착해서 약 6시까지 넘 잘 놀았음. 놀이기구가 하나같이 미쳐있는데 넘 맘에 들고 시설 이렇게 깨끗한 놀이공원 처음보는거같아요 거리만 가깝다면 또 가고싶네요,"['평일', '웬만하다', '타고', '도착', '놀이기구', '미치다', '시설', '깨끗하다', '놀이', '공원', '처음', '같다', '거리', '가깝다']",Positive,0.9744085073471069
경주월드,경북 경주시 보문로 544,Nyambbung,워터파크 가는 거 보아해서 혼자 즐기고 왔는데 파도풀 너너무 재미있었어요! 모자 꼭 쓰셔야 하구.. 걸어다니다 보니 먹거리가 다양해서 조았어요 ㅎㅎ 💓그런데 혼자 가서 다양한 음식 다 먹어보진 못해서 아쉬웠어요ㅠㅠ 지방에 있는 물놀이 시설 중엔 나주 다음으로 큰 듯용!! 근데 파도풀은 어느데를 견주어도 경주월드 캘리포니아 비치가 제일 재미있었어요!!그리고 라이프가드 오빠야들 너무 잘생기고 멋있어서 혼자 갔는데도 즐거웠어요 ㅎㅎ,워터파크 가는 거 보아해서 혼자 즐기고 왔는데 파도풀 너너무 재미있었어요! 모자 꼭 쓰셔야 하구.. 걸어다니다 보니 먹거리가 다양해서 조았어요 ㅎㅎ 그런데 혼자 가서 다양한 음식 다 먹어보진 못해서 아쉬웠어요ㅠㅠ 지방에 있는 물놀이 시설 중엔 나주 다음으로 큰 듯용!! 근데 파도풀은 어느데를 견주어도 경주월드 캘리포니아 비치가 제일 재미있었어요!!그리고 라이프가드 오빠야들 너무 잘생기고 멋있어서 혼자 갔는데도 즐거웠어요 ㅎㅎ,"['워터파크', '보아', '혼자', '파도풀', '재미있다', '모자', '먹거리', '다양하다', '좋다', '혼자', '다양하다', '음식', '아쉽다', '지방', '있다', '물놀이', '시설', '나주', '다음', '듯용', '파도풀', '견주어', '경주월드', '캘리포니아', '비치', '제일', '재미있다', '라이프가드', '오빠', '잘생기다', '멋있다', '혼자', '즐겁다']",Positive,0.9680662751197815
경주월드,경북 경주시 보문로 544,캡틴아메리카노우,비오는날 눈치작전 실패ㅠ 놀이기구 기다리는게 너무 힘들지만 경주월드는 그래도 중간에 의자가 조금 있어서 좋아요.,비오는날 눈치작전 실패ㅠ 놀이기구 기다리는게 너무 힘들지만 경주월드는 그래도 중간에 의자가 조금 있어서 좋아요.,"['눈치', '작전', '실패', '놀이기구', '힘들다', '경주월드', '중간', '의자', '조금', '있다', '좋다']",Positive,0.9195508360862732
경주월드,경북 경주시 보문로 544,yuni3564,아이와 즐겁게 놀다왔어요,아이와 즐겁게 놀다왔어요,"['아이', '즐겁다']",Positive,0.9741443991661072
경주월드,경북 경주시 보문로 544,깜냥깜냥90,할로윈기간에 맞게 잘 꾸밈,할로윈기간에 맞게 잘 꾸밈,"['할로윈', '기간', '꾸밈']",Positive,0.9673624038696289
경주월드,경북 경주시 보문로 544,예빵이31,굿굿 아주 재밌었음 니다잉,굿굿 아주 재밌었음 니다잉,"['굿굿', '아주', '재밌다', '니다잉']",Positive,0.9739615321159363
경주월드,경북 경주시 보문로 544,472098,경주에 산다면 개장시간에 와서 폐장 시간에 나갈 거 같아요. 나이 먹으니 롤러코스터 말고는 스릴이 안느껴지네요. 바이킹 여성직원분은 어릴 때 부터 본 거 같아 고연차 같은데 프로같고 친절하세요,경주에 산다면 개장시간에 와서 폐장 시간에 나갈 거 같아요. 나이 먹으니 롤러코스터 말고는 스릴이 안느껴지네요. 바이킹 여성직원분은 어릴 때 부터 본 거 같아 고연차 같은데 프로같고 친절하세요,"['경주', '산다', '개장', '시간', '폐장', '시간', '같다', '나이', '롤러코스터', '스릴', '바이킹', '직원', '부터', '같다', '연차', '같다', '프로', '같다', '친절하다']",Positive,0.942767322063446
경주월드,경북 경주시 보문로 544,마마맛있는,"경주월드 재밌습니다. 드라켄, 스콜&하티 놀이기구 빠르고 재밌습니다.  다만 운행 시간이 짧네요ㅠ 안내판이 오래되고 색이 바래서 눈에 잘 안보이네요. 보수가 필요해 보입니다.","경주월드 재밌습니다. 드라켄, 스콜하티 놀이기구 빠르고 재밌습니다. 다만 운행 시간이 짧네요ㅠ 안내판이 오래되고 색이 바래서 눈에 잘 안보이네요. 보수가 필요해 보입니다.","['경주월드', '재밌다', '드라켄', '스콜', '하티', '놀이기구', '빠르다', '재밌다', '다만', '운행', '시간', '짧다', '안내', '판이', '오래되다', '래서', '보수', '필요하다']",Positive,0.9597869515419006
경주월드,경북 경주시 보문로 544,rom****,일요일 12시에 갔는데 사람이 적절하게 있음 롤코 1시간씩 기다렷움 스콜엔하티>파에톤> 드라켄 크라크 순서로 재밌음 관람차는 줄 너무 길어서 못 탔어영,일요일 12시에 갔는데 사람이 적절하게 있음 롤코 1시간씩 기다렷움 스콜엔하티파에톤 드라켄 크라크 순서로 재밌음 관람차는 줄 너무 길어서 못 탔어영,"['일요일', '사람', '적절하다', '있다', '롤코', '기다렷움', '스콜', '하티', '파에톤', '드라켄', '라크', '순서', '재밌다', '관람차']",Positive,0.9578045010566711
경주월드,경북 경주시 보문로 544,딸기맛약21,추석연휴 경주월드  사람 진짜많아요.모든 어트렉션 3시간 대기 기본..ㅋ10시20분 입장해서 3개타고 집으로..,추석연휴 경주월드 사람 진짜많아요.모든 어트렉션 3시간 대기 기본..ㅋ10시20분 입장해서 3개타고 집으로..,"['추석', '연휴', '경주월드', '사람', '진짜', '많다', '모든', '어트렉션', '대기', '기본', '입장', '타고']",Positive,0.8185923099517822
경주월드,경북 경주시 보문로 544,sb****,경북에 놀이공원이 대구이월드 경주월드가 있는대 아이가 경주월드가 더 재미있어 합니다 다음에 또 와보고 싶다고 합니다 수고하세요,경북에 놀이공원이 대구이월드 경주월드가 있는대 아이가 경주월드가 더 재미있어 합니다 다음에 또 와보고 싶다고 합니다 수고하세요,"['경북', '놀이', '공원', '대구', '이월드', '경주월드', '있다', '아이', '경주월드', '재미있다', '다음', '보고', '수고']",Positive,0.9641291499137878
경주월드,경북 경주시 보문로 544,블랙Con슈머,여름 휴가때 한번 와본후......멋모르고 왔다가 심정지놀이기구 레어템의 집약체....이름을 다 나열하기도 힘들지만...타기도 다 힘듦.....처음부터 눈 질끔감고 거친 쉼호흡하면 하차....너무 무서움....사람은 많지 않아 대기가 길지 않지만..그렇다고 3~40분정도.....서울에 비하면 짧지만...롯데월드에서 기다리는 시각에 기구 타는 시간을 나누면 경주오는시간 감안하고 가성비 갑임.몰려다니는 행렬에서 빠지만하면 바로 탈수 있을것같음.,여름 휴가때 한번 와본후......멋모르고 왔다가 심정지놀이기구 레어템의 집약체....이름을 다 나열하기도 힘들지만...타기도 다 힘듦.....처음부터 눈 질끔감고 거친 쉼호흡하면 하차....너무 무서움....사람은 많지 않아 대기가 길지 않지만..그렇다고 340분정도.....서울에 비하면 짧지만...롯데월드에서 기다리는 시각에 기구 타는 시간을 나누면 경주오는시간 감안하고 가성비 갑임.몰려다니는 행렬에서 빠지만하면 바로 탈수 있을것같음.,"['여름', '휴가', '한번', '심정지', '놀이기구', '레어템', '집약', '이름', '나열하다', '힘들다', '기도', '힘들다', '처음', '감고', '호흡', '하차', '무서움', '사람', '많다', '대기', '길다', '서울', '짧다', '롯데', '월드', '시각', '기구', '시간', '시간', '감안', '가성', '갑임', '행렬', '만하', '바로', '탈수', '있다', '같다']",Positive,0.8965251445770264
경주월드,경북 경주시 보문로 544,leys10,급 경주월드 사람이 은근 많은듯,급 경주월드 사람이 은근 많은듯,"['경주월드', '사람', '은근', '많다']",Positive,0.906147301197052
경주월드,경북 경주시 보문로 544,콩알콩콩,에버랜드는 다리가 너무 아프고롯데월드는 사람 많아서놀이동산을 멀리했다가 여행지를 경주로 정해서온 김에 경주월드 방문했어요!사람이 많아서 걱정했는데대부분 1시간 이내로 탈 수 있어서넘 좋았숩니다 최고최고,에버랜드는 다리가 너무 아프고롯데월드는 사람 많아서놀이동산을 멀리했다가 여행지를 경주로 정해서온 김에 경주월드 방문했어요!사람이 많아서 걱정했는데대부분 1시간 이내로 탈 수 있어서넘 좋았숩니다 최고최고,"['에버랜드', '다리', '아프다', '롯데', '월드', '사람', '많다', '놀이동산', '멀리', '여행지', '경주로', '정해', '서온', '경주월드', '방문', '사람', '많다', '걱정', '대부분', '이내', '있다', '좋았숩니', '최고', '최고']",Positive,0.9719005823135376
경주월드,경북 경주시 보문로 544,mimi1564,"오픈런하려고 20분전에 도착했는데도 줄이 꽤 길었어요.무서운걸. 좋아하시는분은 추천멀미하시는분은 비추해요놀이기구 스탈이 스릴 놀이기구,. 멀미유발하는 놀이기구, 물에 젖는 놀이기구입니다.","오픈런하려고 20분전에 도착했는데도 줄이 꽤 길었어요.무서운걸. 좋아하시는분은 추천멀미하시는분은 비추해요놀이기구 스탈이 스릴 놀이기구,. 멀미유발하는 놀이기구, 물에 젖는 놀이기구입니다.","['오픈', '려고', '도착', '길다', '무섭다', '좋아하다', '추천', '멀미', '놀이기구', '스탈', '스릴', '놀이기구', '멀미', '유발', '놀이기구', '놀이기구', '이다']",Negative,0.7983842492103577
경주월드,경북 경주시 보문로 544,무발무순,단체로 온 (학생) 사람들이 많았습니다.한30분 내로 이용했습니다.좋았습니다.,단체로 온 학생 사람들이 많았습니다.한30분 내로 이용했습니다.좋았습니다.,"['단체', '학생', '사람', '많다', '이용', '좋다']",Positive,0.9734827280044556
경주월드,경북 경주시 보문로 544,매일설레는일상,웨이팅 지옥이였어용...^^ 기구하나타고 멀미해도 다음꺼 타러가면 하나타는데 최소 1시간 30분씩이라 어지럽든말든 아무런 지장이없더라구요,웨이팅 지옥이였어용... 기구하나타고 멀미해도 다음꺼 타러가면 하나타는데 최소 1시간 30분씩이라 어지럽든말든 아무런 지장이없더라구요,"['웨이', '지옥', '기구', '하나', '타고', '멀미', '다음', '하나', '최소', '어지럽다', '아무렇다', '지장', '없다']",Negative,0.8458595871925354
경주월드,경북 경주시 보문로 544,여행하는 민호씨,"스릴있고 재미있는 어트랙션 도입에 망설임없는 국내 대표 놀이동산이죠. 기대하고 갔는데도 역시나 실망스럽지 않았습니다. 소리를 너무 질러서 다음날 목이 쉬어버렸어요. 드라켄과 스콜앤하티가 원흉같습니다.추천 어트랙션- 드라켄ㆍ스콜앤하티ㆍ파에톤 (필수)- 크라크, 토네이도, 킹바이킹, 섬머린스플래쉬넓진 않은데 구성이 확실히 알찬 느낌이었어요. 성인들 도파민 충족은 물론 아이들을 위한 패밀리어트랙션들도 잘 갖춰져 있었습니다. 수상 어트랙션의 경우 타시면 무조건 젖는다고 생각하셔야 해요. 우비도 현장 판매합니다.그외 즐길거리1) 섬머린스플래시 물벼락 맞기2) 드라켄 지나갈 때 물벼락 맞기!!어트랙션도 좋고 간식거리도 다 좋았지만 식사류는 부실한 것 같아요. 끼니 해결하기에는 속이 허했네요. ㅠ","스릴있고 재미있는 어트랙션 도입에 망설임없는 국내 대표 놀이동산이죠. 기대하고 갔는데도 역시나 실망스럽지 않았습니다. 소리를 너무 질러서 다음날 목이 쉬어버렸어요. 드라켄과 스콜앤하티가 원흉같습니다.추천 어트랙션 드라켄스콜앤하티파에톤 필수 크라크, 토네이도, 킹바이킹, 섬머린스플래쉬넓진 않은데 구성이 확실히 알찬 느낌이었어요. 성인들 도파민 충족은 물론 아이들을 위한 패밀리어트랙션들도 잘 갖춰져 있었습니다. 수상 어트랙션의 경우 타시면 무조건 젖는다고 생각하셔야 해요. 우비도 현장 판매합니다.그외 즐길거리1 섬머린스플래시 물벼락 맞기2 드라켄 지나갈 때 물벼락 맞기!!어트랙션도 좋고 간식거리도 다 좋았지만 식사류는 부실한 것 같아요. 끼니 해결하기에는 속이 허했네요. ㅠ","['스릴', '있다', '재미있다', '트랙', '도입', '없다', '국내', '대표', '놀이동산', '기대하다', '역시', '실망', '소리', '다음', '드라켄', '스콜', '하티', '원흉', '같다', '추천', '트랙', '스콜', '하티', '파에톤', '필수', '라크', '토네이도', '바이킹', '섬머', '린스', '플래쉬', '넓다', '구성', '확실하다', '알차다', '도파민', '충족', '아이', '패밀리', '트랙', '있다', '수상', '어트랙션', '경우', '무조건', '생각', '우비', '현장', '판매', '길거리', '섬머', '린스', '플래시', '물벼락', '드라켄', '물벼락', '어트랙션', '좋다', '간식', '거리', '좋다', '식사', '부실하다', '같다', '끼니', '해결']",Positive,0.9524481296539307
경주월드,경북 경주시 보문로 544,머야쁘이,와진짜 다신안갈꺼예요 드라켄타는데3시간걸렸어여 사람은계속입장시키고입장한사람은. 밥을먹어도  1시간이상기다리고 놀이기구 3시간기다리고하는데. 돈만벌어가는악덕업주 입장제한을해야입장해서 있는사람들도즐길건대 돈만챙기고 입장한사람은  타지도못하고ㅠ. 6시간동안 놀이기구1개타고 밥먹고 끝이네. 힘들고짜증나서 놀이기구마감까지안있고그냥나왔네요. 그렇게좁은곳에 입장제한 ㅠ.,와진짜 다신안갈꺼예요 드라켄타는데3시간걸렸어여 사람은계속입장시키고입장한사람은. 밥을먹어도 1시간이상기다리고 놀이기구 3시간기다리고하는데. 돈만벌어가는악덕업주 입장제한을해야입장해서 있는사람들도즐길건대 돈만챙기고 입장한사람은 타지도못하고ㅠ. 6시간동안 놀이기구1개타고 밥먹고 끝이네. 힘들고짜증나서 놀이기구마감까지안있고그냥나왔네요. 그렇게좁은곳에 입장제한 ㅠ.,"['진짜', '켄타', '사람', '계속', '입장', '입장', '사람', '놀이기구', '악덕', '업주', '입장', '을해', '입장', '있다', '사람', '입장', '사람', '지도', '놀이기구', '타고', '힘들다', '짜증나다', '놀이기구', '마감', '있다', '그냥', '좁다', '입장', '제한']",Negative,0.9216954112052917
경주월드,경북 경주시 보문로 544,골드50,사람이너무많아 놈이 기구는 많이 못탔지만 아이들과 교복으로 갈아입고 즐거운 시간 보냈습니다,사람이너무많아 놈이 기구는 많이 못탔지만 아이들과 교복으로 갈아입고 즐거운 시간 보냈습니다,"['사람', '많다', '기구', '아이', '교복', '즐겁다', '시간']",Positive,0.9684162139892578
경주월드,경북 경주시 보문로 544,jjunplay,놀이기구 이용자들을 극한(?!)으로 몰아가는 고문 기구들…그 자체입니다…(!),놀이기구 이용자들을 극한?!으로 몰아가는 고문 기구들그 자체입니다!,"['놀이기구', '이용자', '극한', '고문', '기구', '자체', '이다']",Negative,0.9390774369239807
경주월드,경북 경주시 보문로 544,yunhyalub,경주하면역사 박물관등. 문화재도많지만!!와우!!경주월드 밖에서본것과.천지차이!!놀이기구 짱쨈!!!물놀이기구들은..진짜.  탈만하네요~~꼭. 우비를입어야하는..입어도 쫄딱 젖는사람은발생하네요~조카들이 완전 대만족..만족스러웟답니다.쫄보들도 탈수있는..놀이기구였답니다.,경주하면역사 박물관등. 문화재도많지만!!와우!!경주월드 밖에서본것과.천지차이!!놀이기구 짱쨈!!!물놀이기구들은..진짜. 탈만하네요꼭. 우비를입어야하는..입어도 쫄딱 젖는사람은발생하네요조카들이 완전 대만족..만족스러웟답니다.쫄보들도 탈수있는..놀이기구였답니다.,"['경주', '역사', '박물', '관등', '문화재', '많다', '와우', '경주월드', '천지', '차이', '놀이기구', '물놀이', '기구', '진짜', '우비', '야하다', '쫄딱', '사람', '발생', '조카', '완전', '만족', '만족스럽다', '웟답니', '쫄보', '탈수', '있다', '놀이기구']",Positive,0.9735198020935059
경주월드,경북 경주시 보문로 544,어셈블리어,사람 적을때 싸게 잘 놀다왔습니다 진짜 다 탈수있었어요,사람 적을때 싸게 잘 놀다왔습니다 진짜 다 탈수있었어요,"['사람', '진짜', '탈수', '있다']",Positive,0.969144880771637
경주월드,경북 경주시 보문로 544,찬찬찬브로,경주여행중에 다녀왔어요규모에 비해 있을거 다 있고 알찬 놀이공원이에요특히 다른 대규모 놀이공원보다 짜릿한 기구들이 많아 더 재미있었어요~♡,경주여행중에 다녀왔어요규모에 비해 있을거 다 있고 알찬 놀이공원이에요특히 다른 대규모 놀이공원보다 짜릿한 기구들이 많아 더 재미있었어요,"['여행', '규모', '있다', '있다', '알차다', '놀이', '공원', '다른', '대규모', '놀이', '공원', '짜릿하다', '기구', '많다', '재미있다']",Positive,0.9736539125442505
경주월드,경북 경주시 보문로 544,aki****,날짜를 잘못 마춰서 수학여행 온 애들이 많았지만아이는 좋아하네요크라크만 주구장창 타네요,날짜를 잘못 마춰서 수학여행 온 애들이 많았지만아이는 좋아하네요크라크만 주구장창 타네요,"['날짜', '잘못', '수학여행', '많다', '아이', '좋아하다', '요크', '라크', '장창', '타네']",Negative,0.5422285795211792
