store_name,address,nickname,content,cleaned_content,tokenized_words,sentiment,sentiment_score
광명동굴,경기 광명시 가학로85번길 142,시샘달 열하루,"딸내미, 친구 아이들과 함께다녀왔어요날씨가 좋았고 주말(토요일)오전10시 정도였는데도 관람하고 나오는 분들이 계셨어요몇번 다녀온 곳인데도 오랜만에 가서 그런지 또 새롭게 관람하고 주변 경관도 구경했어요아이들은 공룡체험과 광명동굴 입장권 구입했고친구와 저는 동굴 입장권만 구입해서 다녀왔어요더운 여름에는 외부에서 아이들을 기다려야해서 조금 힘들었어요○좋은점1.체험이 있어서 아이와 함께가기 좋아요2.주변 자연관리가 잘되어있어서 사진도 잘나오고 좋아요3.간식거리가 있어서 좋아요4.주차장이 잘되어 있어요(안내도 잘되어서 좋네요)5.아이들이 뛰어놀기 좋게 넓어요○아쉬운점1.더운날씨에 야외에 있기엔 더워요날씨를 고려해서 그늘이 많았으면 좋겠지만^^2.화장실이 한곳에만 있어서 좀 걸어야해요","딸내미, 친구 아이들과 함께다녀왔어요날씨가 좋았고 주말토요일오전10시 정도였는데도 관람하고 나오는 분들이 계셨어요몇번 다녀온 곳인데도 오랜만에 가서 그런지 또 새롭게 관람하고 주변 경관도 구경했어요아이들은 공룡체험과 광명동굴 입장권 구입했고친구와 저는 동굴 입장권만 구입해서 다녀왔어요더운 여름에는 외부에서 아이들을 기다려야해서 조금 힘들었어요좋은점1.체험이 있어서 아이와 함께가기 좋아요2.주변 자연관리가 잘되어있어서 사진도 잘나오고 좋아요3.간식거리가 있어서 좋아요4.주차장이 잘되어 있어요안내도 잘되어서 좋네요5.아이들이 뛰어놀기 좋게 넓어요아쉬운점1.더운날씨에 야외에 있기엔 더워요날씨를 고려해서 그늘이 많았으면 좋겠지만2.화장실이 한곳에만 있어서 좀 걸어야해요","['딸내미', '친구', '아이', '날씨', '좋다', '주말', '토요일', '오전', '정도', '관람', '계시다', '몇번', '그렇다', '새롭다', '관람', '주변', '경관', '구경', '아이', '공룡', '체험', '광명', '동굴', '입장권', '구입', '친구', '동굴', '입장권', '구입', '덥다', '여름', '외부', '아이', '야하다', '조금', '힘들다', '좋다', '체험', '있다', '아이', '가기', '좋다', '주변', '자연', '관리', '사진', '좋다', '간식', '거리', '있다', '좋다', '주차장', '있다', '안내', '좋다', '아이', '좋다', '넓다', '아쉽다', '덥다', '날씨', '야외', '있다', '덥다', '날씨', '고려', '그늘', '많다', '좋다', '화장실', '있다', '야하다']",Positive,0.9520736932754517
광명동굴,경기 광명시 가학로85번길 142,mis****,굿,굿,[],Positive,0.9277362823486328
광명동굴,경기 광명시 가학로85번길 142,kor****,굿,굿,[],Positive,0.9277362823486328
광명동굴,경기 광명시 가학로85번길 142,밀크베베,"주말 10시전에 도착했는데 사람 꽤 있네요. 주차비 3,000원 선납입니다. 동굴관람권은 자녀2명이라 다둥이 20%할인 받았어요(증빙서류 확인)VR은 4명 17,000원 결제하였는데 가격대비 못하다는 생각이 크게 들었어요. 더운여름 주말에는 오픈런 하시는게 편하게 관람&주차 할 수 있을거에요. 동굴이라 엄청 시원하고 볼거리가 많았어요. 물고기도 있어요~1시간 정도 관람하고 나와서 곧바로 나갔는데 이때 들어오는 차량들이 어마어마하게 많더라구요. 조금만 늦게 도착했으면 빠져나오는데 시간 꽤 걸렸을 것 같아요.  주말은 일찍 가세요!광명동굴은 여름에 관람하기 너무나도 좋은 곳인 것 같습니다. 구경 잘 하고 갑니다~~","주말 10시전에 도착했는데 사람 꽤 있네요. 주차비 3,000원 선납입니다. 동굴관람권은 자녀2명이라 다둥이 20할인 받았어요증빙서류 확인VR은 4명 17,000원 결제하였는데 가격대비 못하다는 생각이 크게 들었어요. 더운여름 주말에는 오픈런 하시는게 편하게 관람주차 할 수 있을거에요. 동굴이라 엄청 시원하고 볼거리가 많았어요. 물고기도 있어요1시간 정도 관람하고 나와서 곧바로 나갔는데 이때 들어오는 차량들이 어마어마하게 많더라구요. 조금만 늦게 도착했으면 빠져나오는데 시간 꽤 걸렸을 것 같아요. 주말은 일찍 가세요!광명동굴은 여름에 관람하기 너무나도 좋은 곳인 것 같습니다. 구경 잘 하고 갑니다","['주말', '도착', '사람', '있다', '차비', '선납', '이다', '동굴', '관람', '자녀', '둥이', '할인', '증빙', '서류', '확인', '결제', '가격', '대비', '생각', '크게', '덥다', '여름', '주말', '오픈', '편하다', '관람', '주차', '있다', '동굴', '시원하다', '볼거리', '많다', '물고기', '있다', '정도', '관람', '곧바로', '차량', '어마어마하다', '많다', '조금', '도착', '시간', '같다', '주말', '일찍', '가세', '광명', '동굴', '여름', '관람', '좋다', '같다', '구경']",Positive,0.9357500672340393
광명동굴,경기 광명시 가학로85번길 142,namesms,광명동굴이많이 추울 줄 알았는데 따뜻하고 볼거리가 많았어요,광명동굴이많이 추울 줄 알았는데 따뜻하고 볼거리가 많았어요,"['광명', '동굴', '따뜻하다', '볼거리', '많다']",Positive,0.9740273356437683
광명동굴,경기 광명시 가학로85번길 142,272723,"주차장이 넓은 편이고, 동굴과 매표소가 언덕배기에 있어서 관광 시작 전부테 짧은 등산 느낌으로 올라가야 하니 꼭 편한 신발을 신고가세요. 동굴은 들어가자마자 시원하니 바람막이 있으면 좋고, 습해서 관광 중 떨어지는 물 맞을 수 있으니 참고하세요. 동굴 내부 2km정도 관광 가능하고 가파른 계단영역도 있으니 편안신발 두번강조. 2km를 다양한 테마로 구성해놓았어요. 작은 아쿠아리움, 플랜트, 미디어파사드쇼, 조명으로 꾸며놓은 공간, 역사소개 공간 등이 있었고, 와인 판매하는 곳도 있더라고요. 로봇물고기, 용이나 골룸, 초신성 같이 좀 쌩뚱맞은 부분도 있지만 콘텐츠를 다양하게 채워나서 지루하지 않습니다. 주변 까페 등에서 입장료 50% 할인쿠폰  받을 수도 있으니 한번 찾아보고 가세요!","주차장이 넓은 편이고, 동굴과 매표소가 언덕배기에 있어서 관광 시작 전부테 짧은 등산 느낌으로 올라가야 하니 꼭 편한 신발을 신고가세요. 동굴은 들어가자마자 시원하니 바람막이 있으면 좋고, 습해서 관광 중 떨어지는 물 맞을 수 있으니 참고하세요. 동굴 내부 2km정도 관광 가능하고 가파른 계단영역도 있으니 편안신발 두번강조. 2km를 다양한 테마로 구성해놓았어요. 작은 아쿠아리움, 플랜트, 미디어파사드쇼, 조명으로 꾸며놓은 공간, 역사소개 공간 등이 있었고, 와인 판매하는 곳도 있더라고요. 로봇물고기, 용이나 골룸, 초신성 같이 좀 쌩뚱맞은 부분도 있지만 콘텐츠를 다양하게 채워나서 지루하지 않습니다. 주변 까페 등에서 입장료 50 할인쿠폰 받을 수도 있으니 한번 찾아보고 가세요!","['주차장', '넓다', '편이', '동굴', '매표소', '언덕', '배기', '있다', '관광', '시작', '전부', '짧다', '등산', '느낌', '하니', '편하다', '신발', '동굴', '시원하다', '바람막이', '있다', '좋다', '습하다', '관광', '있다', '참고', '동굴', '내부', '정도', '관광', '가능하다', '가파른', '계단', '영역', '있다', '편안', '신발', '강조', '다양하다', '테마', '구성', '작다', '아쿠아리움', '플랜트', '미디어', '파사드', '조명', '공간', '역사', '소개', '공간', '있다', '와인', '판매', '곳도', '있다', '로봇', '물고기', '용이', '골룸', '초신성', '쌩뚱맞', '부분', '있다', '콘텐츠', '다양하다', '지루하다', '주변', '까페', '입장료', '할인', '쿠폰', '수도', '있다', '한번', '가세']",Positive,0.9366110563278198
광명동굴,경기 광명시 가학로85번길 142,밥먹어요 이과장입니다,엄마랑 모시고 갔는데 생각보다는 춥지 않음 오히려 계단타니 더움 ㅎㅎ 한번은 가볼만함,엄마랑 모시고 갔는데 생각보다는 춥지 않음 오히려 계단타니 더움 ㅎㅎ 한번은 가볼만함,"['엄마', '모시', '생각', '오히려', '계단', '더움', '한번']",Positive,0.9630309343338013
광명동굴,경기 광명시 가학로85번길 142,윽주니,광명동굴을 처음 방문했는데요여기가 드라마 촬영지인지 몰랐다가 넘 이쁘고여름에 방문하니깐 진짜 시원했어요그리고 물고기도 있고 볼거리도 많아서아기들이랑 같이 가서 체험해도 좋을거 같아요❤️저는 부모님이랑 같이 방문했습니다,광명동굴을 처음 방문했는데요여기가 드라마 촬영지인지 몰랐다가 넘 이쁘고여름에 방문하니깐 진짜 시원했어요그리고 물고기도 있고 볼거리도 많아서아기들이랑 같이 가서 체험해도 좋을거 같아요저는 부모님이랑 같이 방문했습니다,"['광명', '동굴', '처음', '방문', '여기', '드라마', '촬영', '지인', '이쁘다', '여름', '방문', '진짜', '시원하다', '물고기', '있다', '볼거리', '많다', '아기', '체험', '좋다', '같다', '부모님', '방문']",Positive,0.9740711450576782
광명동굴,경기 광명시 가학로85번길 142,파파야8374,"시원하고 화려해진 광명동굴 탕방여자들 3명이 밥 먹기 전에 광명동굴을 방문 했습니다.  가는날 비가 살짝 내려  많이 시원했습니다.혹시나 동굴이 추울까봐 겉옷을 챙기고, 언덕을  걸어가는 길이 너무 싱그러웠습니다.참 주차비 별도록 3천원을 납부 하셔야 합니다.입장권 가격이 예전에 왔을때 보다 많이 비싸다는 느낌이 있었는데 입장 하고 나니 전혀 비싸다는 느낌이 아니었습니다.볼거리도 많고 사진 찍기도 좋았습니다. 여러가지 컨셉으로 동굴을 탐방 할 수 있도록 이정표도 잘 되어 있고,  중간중간 안내원이 계서서 편합니다. 1시간 정도 탐방하고 사진 찍다보니 밖으로 나갈 시간이 되었습니다. 여름에 가면 자연의 시원함을 느낄 수 있어서 좋은거 같습니다.가까이 있지만 오랫만에 방문한 광명동굴 한번 방문","시원하고 화려해진 광명동굴 탕방여자들 3명이 밥 먹기 전에 광명동굴을 방문 했습니다. 가는날 비가 살짝 내려 많이 시원했습니다.혹시나 동굴이 추울까봐 겉옷을 챙기고, 언덕을 걸어가는 길이 너무 싱그러웠습니다.참 주차비 별도록 3천원을 납부 하셔야 합니다.입장권 가격이 예전에 왔을때 보다 많이 비싸다는 느낌이 있었는데 입장 하고 나니 전혀 비싸다는 느낌이 아니었습니다.볼거리도 많고 사진 찍기도 좋았습니다. 여러가지 컨셉으로 동굴을 탐방 할 수 있도록 이정표도 잘 되어 있고, 중간중간 안내원이 계서서 편합니다. 1시간 정도 탐방하고 사진 찍다보니 밖으로 나갈 시간이 되었습니다. 여름에 가면 자연의 시원함을 느낄 수 있어서 좋은거 같습니다.가까이 있지만 오랫만에 방문한 광명동굴 한번 방문","['시원하다', '화려하다', '광명', '동굴', '탕방', '여자', '먹기', '광명', '동굴', '방문', '살짝', '시원하다', '혹시', '동굴', '겉옷', '언덕', '길이', '싱그럽다', '차비', '도록', '납부', '입장권', '가격', '예전', '비싸다', '느낌', '있다', '입장', '나니', '전혀', '비싸다', '느낌', '아니다', '볼거리', '많다', '사진', '찍기', '좋다', '여러가지', '컨셉', '동굴', '탐방', '있다', '이정표', '있다', '중간', '중간', '안내', '계서', '편하다', '정도', '탐방', '사진', '시간', '여름', '가면', '자연', '시원하다', '있다', '좋다', '같다', '가까이', '있다', '방문', '광명', '동굴', '한번', '방문']",Positive,0.9621771574020386
광명동굴,경기 광명시 가학로85번길 142,설렘2113,즐거운 가족과의 시간,즐거운 가족과의 시간,"['즐겁다', '가족', '시간']",Positive,0.9711994528770447
광명동굴,경기 광명시 가학로85번길 142,엘리엔젤,엄청난 봉사자들(?)이 탐방로를 지도해줘서 좋았는데 사실상 불빛 말고는 많이 볼거리가 부족했다는 생각이 들어요. 구성을 좀더 짜임새 있게 하지 않으면 두 번의 방문은 힘들거 같네요. 요즘은 어딜가도 반짝거리게 잘해뒀기 때문에 굳이 여기를? 이란 생각이 들었어요,엄청난 봉사자들?이 탐방로를 지도해줘서 좋았는데 사실상 불빛 말고는 많이 볼거리가 부족했다는 생각이 들어요. 구성을 좀더 짜임새 있게 하지 않으면 두 번의 방문은 힘들거 같네요. 요즘은 어딜가도 반짝거리게 잘해뒀기 때문에 굳이 여기를? 이란 생각이 들었어요,"['엄청나다', '봉사자', '탐방', '지도', '좋다', '사실', '불빛', '볼거리', '부족하다', '생각', '구성', '좀더', '짜임새', '있다', '번의', '방문', '힘들다', '같다', '요즘', '가도', '때문', '굳이', '여기', '이란', '생각']",Negative,0.6782740950584412
광명동굴,경기 광명시 가학로85번길 142,이천뿌꾸,볼거리도많고 와인시음도 해볼 수있고바닥도 잘깔아놔서 거동불편한 분들도 갈수있어요!가파른 구간은 패스가능안내직원들도 많아 우왕좌왕할일없어요!,볼거리도많고 와인시음도 해볼 수있고바닥도 잘깔아놔서 거동불편한 분들도 갈수있어요!가파른 구간은 패스가능안내직원들도 많아 우왕좌왕할일없어요!,"['볼거리', '많다', '와인', '있다', '바닥', '거동', '불편하다', '가파른', '구간', '패스', '가능', '안내', '직원', '많다', '우왕좌왕', '없다']",Positive,0.9666350483894348
광명동굴,경기 광명시 가학로85번길 142,진이두루,엄청 깊은 동굴. 역사가 담긴 광명동굴인데볼거리도 많고 역사도 알수있는 공간도 있어서 흥미로웠음아이들이랑 구경하기에도 좋고 무엇보다 이 오지게 더운 여름에 가니 동굴 안이 너무 시원했음....... ㅠㅠ 최고,엄청 깊은 동굴. 역사가 담긴 광명동굴인데볼거리도 많고 역사도 알수있는 공간도 있어서 흥미로웠음아이들이랑 구경하기에도 좋고 무엇보다 이 오지게 더운 여름에 가니 동굴 안이 너무 시원했음....... ㅠㅠ 최고,"['깊다', '동굴', '역사', '광명', '동굴', '볼거리', '많다', '역사', '공간', '있다', '흥미롭다', '아이', '구경', '좋다', '무엇', '오지', '덥다', '여름', '동굴', '안이', '시원하다', '최고']",Positive,0.9743422269821167
광명동굴,경기 광명시 가학로85번길 142,tekern,여름엔 동굴!!일단 시원합니다!볼거리가 다양해요!역사의 아픔이 있는 곳이라서...(일제시대)교육적으로도 아이들에게 역사를 알려줄수 있어서 의미있습니다! 입구 왼쪽에 ‘평화의 소녀상‘도 있어요😭꼭 가보세요😄😄사람이 너무 많아서 무서웠어요 ㅠㅠ미디어공연이 있는데 사람 너무 많아서사고 날까봐 무서웠어요 ㅠㅠ관리 잘 부탁 드립니다 🥹🥹,여름엔 동굴!!일단 시원합니다!볼거리가 다양해요!역사의 아픔이 있는 곳이라서...일제시대교육적으로도 아이들에게 역사를 알려줄수 있어서 의미있습니다! 입구 왼쪽에 평화의 소녀상도 있어요꼭 가보세요사람이 너무 많아서 무서웠어요 ㅠㅠ미디어공연이 있는데 사람 너무 많아서사고 날까봐 무서웠어요 ㅠㅠ관리 잘 부탁 드립니다,"['여름', '동굴', '일단', '시원하다', '볼거리', '다양하다', '역사', '아픔', '있다', '일제시대', '교육', '아이', '역사', '있다', '의미', '있다', '입구', '왼쪽', '평화', '소녀', '상도', '있다', '사람', '많다', '무섭다', '미디어', '공연', '있다', '사람', '많다', '사고', '무섭다', '관리', '부탁']",Positive,0.9715264439582825
광명동굴,경기 광명시 가학로85번길 142,ㅎㅎ 2,좋아요~~,좋아요,['좋다'],Positive,0.9396566152572632
광명동굴,경기 광명시 가학로85번길 142,xxmingxx,"#광명동굴, 경기도동굴, 나들이코스 아기띠를 하고 아이와 또 어르신들과 함께 온 가족들이 많았는데요. 요즘 SNS 인증사진을 찍을 만한 포토존이 많았는데 생각보다 조금 힘들었어요... 엄청 올라갔다 내려갔다 계단 등산... 40분~50분 코스가 맞더라고요. 다리가 불편하신 어르신들을 위한 코스가 따로 있는거 같아서 많이 힘드시면 안내하시는 분들이 많아서 문의후에 안내 부탁하시면 될거 같아요. 더운날 시원하고 특별한 장소에 아이랑 함께가서 좋았던거 같아요. 지금 공룡탐험 체험전도 진행하고 있어서 함께 다녀왔습니다.*주차안내요원이 있어서 안내에 따라 주차하시면 되요입구쪽에 키즈카페도 있다고 했는데 시간이 안되서 다음에 방문해보겠습니다! 광명동굴 주말 나들이 추천드려요","광명동굴, 경기도동굴, 나들이코스 아기띠를 하고 아이와 또 어르신들과 함께 온 가족들이 많았는데요. 요즘 SNS 인증사진을 찍을 만한 포토존이 많았는데 생각보다 조금 힘들었어요... 엄청 올라갔다 내려갔다 계단 등산... 40분50분 코스가 맞더라고요. 다리가 불편하신 어르신들을 위한 코스가 따로 있는거 같아서 많이 힘드시면 안내하시는 분들이 많아서 문의후에 안내 부탁하시면 될거 같아요. 더운날 시원하고 특별한 장소에 아이랑 함께가서 좋았던거 같아요. 지금 공룡탐험 체험전도 진행하고 있어서 함께 다녀왔습니다.주차안내요원이 있어서 안내에 따라 주차하시면 되요입구쪽에 키즈카페도 있다고 했는데 시간이 안되서 다음에 방문해보겠습니다! 광명동굴 주말 나들이 추천드려요","['광명', '동굴', '경기도', '동굴', '나들이', '코스', '아기', '아이', '어르신', '가족', '많다', '요즘', '인증', '사진', '포토', '많다', '생각', '조금', '힘들다', '계단', '등산', '코스', '다리', '불편하다', '어르신', '코스', '있다', '같다', '힘들다', '안내', '많다', '문의', '안내', '부탁', '같다', '덥다', '시원하다', '특별하다', '장소', '아이', '좋다', '같다', '지금', '공룡', '탐험', '체험', '전도', '진행', '있다', '차안', '요원', '있다', '안내', '주차', '입구', '키즈', '카페', '있다', '시간', '안되다', '다음', '방문', '광명', '동굴', '주말', '나들이', '추천']",Positive,0.9574844241142273
광명동굴,경기 광명시 가학로85번길 142,blueskyhj84,"정말 오랜만에 재방문했는데. 볼거리가 더 많아졌네요. 지금날씨에 들리기 딱 좋은것 같아요. 작은 아이는 동굴체험 처음이여서 걱정했는데 아름다운 조명들, 조경에 감탄사를 연발하며 즐거운 관람했어요.","정말 오랜만에 재방문했는데. 볼거리가 더 많아졌네요. 지금날씨에 들리기 딱 좋은것 같아요. 작은 아이는 동굴체험 처음이여서 걱정했는데 아름다운 조명들, 조경에 감탄사를 연발하며 즐거운 관람했어요.","['정말', '방문', '볼거리', '지금', '날씨', '좋다', '같다', '작다', '아이', '동굴', '체험', '처음', '걱정', '아름답다', '조명', '조경', '감탄사', '연발', '즐겁다', '관람']",Positive,0.9740317463874817
광명동굴,경기 광명시 가학로85번길 142,코스믹라떼7,"광명동굴하면 동굴 관광만 생각할 수 있으나. 둘레길 산책도 권하고 싶다.광명동굴 동문쪽으로 오르면. 꼬마열차도 타 볼수 있고. 아이샤힐링숲이 걷기만 해도 힐링된다.자연야생풀과 꽃들이 만발하고. 나무가 우거져 시원하게 걸어볼수 있는. 최적의 둘레길코스다.아침산책길은 사색하기 좋고. 한 낮 산책은 자연의 싱그러움이 좋다.산새소리가 좋아.산책 후에 광명동굴 관람하면 금상청화다.여름휴가지로도 각광 받는 광명동굴은 군데군데 볼거리가 많다.만약 광명동굴 계획있다면.둘레길산책->공룡탐험->VR체험관->광명동굴 순으로 계획하면 좋아요.무더위에 움직일때마다 땀이나는데. 이 찝찝함을 마지막 광명동굴안에서 모두 해소시켜준다.한여름이 더 추운 광명동굴!광명동굴 관람후에는 20분거리의 소하동 ""돼지집""추천한다!",광명동굴하면 동굴 관광만 생각할 수 있으나. 둘레길 산책도 권하고 싶다.광명동굴 동문쪽으로 오르면. 꼬마열차도 타 볼수 있고. 아이샤힐링숲이 걷기만 해도 힐링된다.자연야생풀과 꽃들이 만발하고. 나무가 우거져 시원하게 걸어볼수 있는. 최적의 둘레길코스다.아침산책길은 사색하기 좋고. 한 낮 산책은 자연의 싱그러움이 좋다.산새소리가 좋아.산책 후에 광명동굴 관람하면 금상청화다.여름휴가지로도 각광 받는 광명동굴은 군데군데 볼거리가 많다.만약 광명동굴 계획있다면.둘레길산책공룡탐험VR체험관광명동굴 순으로 계획하면 좋아요.무더위에 움직일때마다 땀이나는데. 이 찝찝함을 마지막 광명동굴안에서 모두 해소시켜준다.한여름이 더 추운 광명동굴!광명동굴 관람후에는 20분거리의 소하동 돼지집추천한다!,"['광명', '동굴', '동굴', '관광', '생각', '있다', '둘레길', '산책', '광명', '동굴', '꼬마', '열차', '있다', '아이샤', '힐링', '걷기', '해도', '힐링', '자연', '생풀', '꽃들이', '만발', '나무', '시원하다', '있다', '최적', '둘레길', '코스', '아침', '산책길', '사색', '좋다', '산책', '자연', '싱그럽다', '좋다', '산새', '소리', '좋다', '산책', '광명', '동굴', '관람', '청화', '여름', '휴가', '지로', '각광', '광명', '동굴', '군데군데', '볼거리', '많다', '만약', '광명', '동굴', '계획', '있다', '둘레길', '산책', '공룡', '탐험', '체험', '관광', '동굴', '계획', '좋다', '무더위', '찝찝하다', '마지막', '광명동', '굳다', '모두', '해소', '한여름', '광명', '동굴', '광명', '동굴', '관람', '소하동', '돼지', '추천']",Positive,0.9366301894187927
