store_name,address,nickname,content,cleaned_content,tokenized_words,sentiment,sentiment_score
광명동굴,경기 광명시 가학로85번길 142,동동이4214,데이트하기 너무 좋고 후덥지근한 여름에 시원하게 동굴 탐험 추천 드립니다 !!공룡탐험관은...조금 비추 드립니다...,데이트하기 너무 좋고 후덥지근한 여름에 시원하게 동굴 탐험 추천 드립니다 !!공룡탐험관은...조금 비추 드립니다...,"['데이트', '좋다', '덥다', '지근', '여름', '시원하다', '동굴', '탐험', '추천', '공룡', '탐험', '조금']",Positive,0.8722808361053467
광명동굴,경기 광명시 가학로85번길 142,욕망가득나그네,"두번째 방문인데도 괜찮네요!여름에 시원하다 못해 반팔로 가면 추워요!아이가 보석찾기 체험 다시 하고 싶다고 갔는데, 공룡탐험으로 바뀌어서 아쉬워 했어요.","두번째 방문인데도 괜찮네요!여름에 시원하다 못해 반팔로 가면 추워요!아이가 보석찾기 체험 다시 하고 싶다고 갔는데, 공룡탐험으로 바뀌어서 아쉬워 했어요.","['두번째', '방문', '괜찮다', '여름', '시원하다', '팔로', '가면', '춥다', '아이', '보석', '찾기', '체험', '다시', '공룡', '탐험', '아쉽다']",Positive,0.9626412391662598
광명동굴,경기 광명시 가학로85번길 142,travelingtogether,한여름에도 추워요~ 바람막이 꼭 갖고가세요~ 피서하기에 좋아요~,한여름에도 추워요 바람막이 꼭 갖고가세요 피서하기에 좋아요,"['한여름', '춥다', '바람막이', '좋다']",Positive,0.9448140263557434
광명동굴,경기 광명시 가학로85번길 142,cos****,동굴 시원하고 볼거리도 많고 좋았어요  아래까지 안내려가면 걷기도 좋아서 아니랑 부모님이랑도 가기 좋을거같아요 걷기 힘들지 않았어요 ~!,동굴 시원하고 볼거리도 많고 좋았어요 아래까지 안내려가면 걷기도 좋아서 아니랑 부모님이랑도 가기 좋을거같아요 걷기 힘들지 않았어요 !,"['동굴', '시원하다', '볼거리', '많다', '좋다', '아래', '걷기', '좋다', '아니다', '부모님', '가기', '좋다', '같다', '걷기', '힘들다']",Positive,0.9732244610786438
광명동굴,경기 광명시 가학로85번길 142,라뮈,"공룡전시관 진짜 가격 조정하셔야할듯..아이가 어릴때부터 공룡을 너무조아해서 왠만한 공룡박물관 전시관 체험관 많이다녀봤는데 이가격에 이퀄리티는 처음이라 당황.. 입장료 3처넌내고 들어가도 돈아까울것같은…? 관람로가 긴것도아님… 이게끝이야? 에이설마!!했는데 진짜끝이였음… 이곳을 만이천원이나받다니 놀라고갑니다. 할인쿠폰있었는데 통합권은 할인도안됨 어른2유아1 =53,000원.. ^^","공룡전시관 진짜 가격 조정하셔야할듯..아이가 어릴때부터 공룡을 너무조아해서 왠만한 공룡박물관 전시관 체험관 많이다녀봤는데 이가격에 이퀄리티는 처음이라 당황.. 입장료 3처넌내고 들어가도 돈아까울것같은? 관람로가 긴것도아님 이게끝이야? 에이설마!!했는데 진짜끝이였음 이곳을 만이천원이나받다니 놀라고갑니다. 할인쿠폰있었는데 통합권은 할인도안됨 어른2유아1 53,000원..","['공룡', '전시관', '진짜', '가격', '조정', '야하다', '아이', '공룡', '왠만하다', '공룡', '박물관', '전시관', '체험', '가격', '퀄리티', '처음', '당황', '입장료', '처넌', '아깝다', '같다', '관람', '도아', '게끝', '에이', '설마', '진짜', '만이천원', '할인', '쿠폰', '있다', '통합', '할인', '안되다', '어른', '유아']",Negative,0.8701762557029724
광명동굴,경기 광명시 가학로85번길 142,벼리입니당,아이와 가기 좋아요 주차는 조금 불편한거 같아요,아이와 가기 좋아요 주차는 조금 불편한거 같아요,"['아이', '가기', '좋다', '주차', '조금', '불편하다', '같다']",Positive,0.9573431015014648
광명동굴,경기 광명시 가학로85번길 142,Su0504,아이와 광명동굴을 왔는데 시원하고 구경할게 많아서 좋았어요.그런데 공룡탐험전을 인당 12000원씩내고 들어갔는데 공룡 움직이는것만있고 바로 출구..할말을 잃었네요.구경2~3분정도밖에 안걸리는데그가격이라니..이해가안갔어요ㅠ구경할게 많은줄알았는데 당황스럽네요..오시는분들은 광명동굴만보시는걸 추천드려요ㅡㅅㅡ;;,아이와 광명동굴을 왔는데 시원하고 구경할게 많아서 좋았어요.그런데 공룡탐험전을 인당 12000원씩내고 들어갔는데 공룡 움직이는것만있고 바로 출구..할말을 잃었네요.구경23분정도밖에 안걸리는데그가격이라니..이해가안갔어요ㅠ구경할게 많은줄알았는데 당황스럽네요..오시는분들은 광명동굴만보시는걸 추천드려요ㅡㅅㅡ,"['아이', '광명', '동굴', '시원하다', '구경', '많다', '좋다', '공룡', '탐험', '공룡', '있다', '바로', '출구', '구경', '가격', '이해', '가안', '구경', '많다', '당황', '스럽다', '오시', '광명', '동굴', '추천']",Negative,0.8299347758293152
광명동굴,경기 광명시 가학로85번길 142,오예51,볼 만 하네요ㅋㅋ 동굴이라 시원하고 데크깔아서 걷기도 편해요,볼 만 하네요ㅋㅋ 동굴이라 시원하고 데크깔아서 걷기도 편해요,"['동굴', '시원하다', '데크', '걷기', '편하다']",Positive,0.9691164493560791
광명동굴,경기 광명시 가학로85번길 142,미니102,사진이 잘나와요😆,사진이 잘나와요,['사진'],Positive,0.9463982582092285
광명동굴,경기 광명시 가학로85번길 142,해쌀2,주말엔 상생장터도 열리고..아이가 좋아하네요.,주말엔 상생장터도 열리고..아이가 좋아하네요.,"['주말', '상생', '장터', '아이', '좋아하다']",Positive,0.9732632040977478
광명동굴,경기 광명시 가학로85번길 142,20211883,볼거리가 많고  좋았어요,볼거리가 많고 좋았어요,"['볼거리', '많다', '좋다']",Positive,0.9729076027870178
광명동굴,경기 광명시 가학로85번길 142,할매49,친절합니다,친절합니다,['친절하다'],Positive,0.9636236429214478
광명동굴,경기 광명시 가학로85번길 142,트위티5655,볼거리가 참 많은 곳이였어요. 이 더운 날씨에 초히려 춥다고 난리네요  너무 볼거리 많은 경험 이였습니다.,볼거리가 참 많은 곳이였어요. 이 더운 날씨에 초히려 춥다고 난리네요 너무 볼거리 많은 경험 이였습니다.,"['볼거리', '많다', '덥다', '날씨', '춥다', '난리', '볼거리', '많다', '경험']",Positive,0.971339225769043
광명동굴,경기 광명시 가학로85번길 142,바지런1432,"광명역에서 가까워서 택시타고 왔어요.역에서 택시 대기줄이 엄청 길었는데, 기사님이 우리를 태우고 광명동굴가자고 하자마자 아무런 대꾸도 하지않으시고, 들으셨어요?하고 다시 물었지만, 전혀 말씀을 안하셨지만, 한숨만 내쉬면서 주먹으로 핸들을 때리는게 불안감이 조성되더군요. 광명 처음 왔는데, 이미지가 너무 안 좋았는데, 동굴 관람 후에는 기분이 나아졌어요.마지막 소녀상 까지 기념으로 찍어 왔어요.","광명역에서 가까워서 택시타고 왔어요.역에서 택시 대기줄이 엄청 길었는데, 기사님이 우리를 태우고 광명동굴가자고 하자마자 아무런 대꾸도 하지않으시고, 들으셨어요?하고 다시 물었지만, 전혀 말씀을 안하셨지만, 한숨만 내쉬면서 주먹으로 핸들을 때리는게 불안감이 조성되더군요. 광명 처음 왔는데, 이미지가 너무 안 좋았는데, 동굴 관람 후에는 기분이 나아졌어요.마지막 소녀상 까지 기념으로 찍어 왔어요.","['광명역', '가깝다', '택시', '타고', '택시', '길다', '기사', '우리', '광명', '동굴', '자고', '하자', '마자', '아무렇다', '대꾸', '다시', '전혀', '말씀', '한숨', '주먹', '핸들', '불안감', '조성', '광명', '처음', '이미지', '좋다', '동굴', '관람', '기분', '마지막', '소녀', '기념']",Positive,0.8502359986305237
광명동굴,경기 광명시 가학로85번길 142,일정2022,수도권에서 여름에 가볼만한 곳 광명동굴 입니다.예전에 광산이었는데 동굴테마파크로 잘해놔서 아이들과 와도 좋아요.,수도권에서 여름에 가볼만한 곳 광명동굴 입니다.예전에 광산이었는데 동굴테마파크로 잘해놔서 아이들과 와도 좋아요.,"['수도권', '여름', '광명', '동굴', '이다', '예전', '광산', '동굴', '테마', '파크', '아이', '좋다']",Positive,0.9737695455551147
광명동굴,경기 광명시 가학로85번길 142,마프으을,매년 이맘때 쯤 시원한 이곳으로 피신오는데사람이 정말 많아서 주차도 힘들고 동굴에서도 막혔지만그래도 시원하고아이들에게 좋은 경험 되었어요,매년 이맘때 쯤 시원한 이곳으로 피신오는데사람이 정말 많아서 주차도 힘들고 동굴에서도 막혔지만그래도 시원하고아이들에게 좋은 경험 되었어요,"['매년', '시원하다', '피신', '사람', '정말', '많다', '주차', '힘들다', '동굴', '시원하다', '아이', '좋다', '경험']",Positive,0.9733849167823792
광명동굴,경기 광명시 가학로85번길 142,새로운것을 좋아하는,예뻐요. 사진도 잘 나와요. 안에엄청 시원해서 좋았어요. 추위타는 분들은 겉옷 챙기면 좋을거같아요.시간대 맞춰 미디어파사드 공연도있어요. 또 가고싶어요.,예뻐요. 사진도 잘 나와요. 안에엄청 시원해서 좋았어요. 추위타는 분들은 겉옷 챙기면 좋을거같아요.시간대 맞춰 미디어파사드 공연도있어요. 또 가고싶어요.,"['예쁘다', '사진', '시원하다', '좋다', '추위', '겉옷', '좋다', '같다', '시간대', '미디어', '파사드', '공연', '있다']",Positive,0.9738995432853699
광명동굴,경기 광명시 가학로85번길 142,qodbsk0216,너무 더운 날씨였지만 아이랑 즐기기 좋았습니다!,너무 더운 날씨였지만 아이랑 즐기기 좋았습니다!,"['덥다', '날씨', '아이', '좋다']",Positive,0.9736983776092529
광명동굴,경기 광명시 가학로85번길 142,알럽당근,별기대 없이 들렀는데 너무 좋았어요~관리도 잘되어있고 야외 벤치까지 또 가서 힐링 하고 싶어요~,별기대 없이 들렀는데 너무 좋았어요관리도 잘되어있고 야외 벤치까지 또 가서 힐링 하고 싶어요,"['기대', '좋다', '관리', '야외', '벤치', '힐링']",Positive,0.9741737246513367
광명동굴,경기 광명시 가학로85번길 142,사부작샤부작,"아이랑 즐거운시간 보냈어요, 재밌었어요👍","아이랑 즐거운시간 보냈어요, 재밌었어요","['아이', '즐겁다', '시간', '재밌다']",Positive,0.9731709361076355
광명동굴,경기 광명시 가학로85번길 142,현사범,와인  시음 할수 있는줄 알았는데 판매만 해요,와인 시음 할수 있는줄 알았는데 판매만 해요,"['와인', '있다', '판매']",Negative,0.7627126574516296
광명동굴,경기 광명시 가학로85번길 142,맛있는 봄눈,더운여름 시원하게 즐길수 있어요구경할게많고 잘꾸며놨어요,더운여름 시원하게 즐길수 있어요구경할게많고 잘꾸며놨어요,"['덥다', '여름', '시원하다', '있다', '구경', '많다']",Positive,0.9733195304870605
광명동굴,경기 광명시 가학로85번길 142,우민나,입장 제한 없이 밀어 넣기만 해서 너무 힘들었어요.,입장 제한 없이 밀어 넣기만 해서 너무 힘들었어요.,"['입장', '제한', '넣기', '힘들다']",Negative,0.7250185608863831
광명동굴,경기 광명시 가학로85번길 142,빵수니2024,광명동굴 탐험관아이와 기대하고 갔는데 입장료 너~무ㅇㅏ까워요너무 작아요 이게 끝이라고?할정도네요 15분도 안걸리는거같아요,광명동굴 탐험관아이와 기대하고 갔는데 입장료 너무ㅇㅏ까워요너무 작아요 이게 끝이라고?할정도네요 15분도 안걸리는거같아요,"['광명', '동굴', '탐험', '관아', '기대하다', '입장료', '작다', '정도', '같다']",Negative,0.7951124906539917
광명동굴,경기 광명시 가학로85번길 142,미나리 향기,볼거리  많아요.아이들이 좋아해요,볼거리 많아요.아이들이 좋아해요,"['볼거리', '많다', '아이', '좋아하다']",Positive,0.9743178486824036
광명동굴,경기 광명시 가학로85번길 142,al****,광명동굴은 항상 매년 여름에 오는거 같아요. 저번에는 광물보석탐험전이 있어서 체험했을때는 정말 괜찮았던 기억이 있어서 이번 공룡탐험전도 입장권 구입해 체험했는데요. 공룡은 매우 실망스럽습니다. 가격대비 볼것이 정말 없어요. 공룡전시 해놓은게 끝입니다. 모든사람들이 나갈때 이게 다야? 이러면서 가더라구요 저희가족도 마찬가지구요. 동굴만 구매해서 보는걸 추천드립니다.,광명동굴은 항상 매년 여름에 오는거 같아요. 저번에는 광물보석탐험전이 있어서 체험했을때는 정말 괜찮았던 기억이 있어서 이번 공룡탐험전도 입장권 구입해 체험했는데요. 공룡은 매우 실망스럽습니다. 가격대비 볼것이 정말 없어요. 공룡전시 해놓은게 끝입니다. 모든사람들이 나갈때 이게 다야? 이러면서 가더라구요 저희가족도 마찬가지구요. 동굴만 구매해서 보는걸 추천드립니다.,"['광명', '동굴', '항상', '매년', '여름', '같다', '저번', '광물', '보석', '탐험', '전이', '있다', '체험', '정말', '괜찮다', '기억', '있다', '이번', '공룡', '탐험', '전도', '입장권', '구입', '체험', '공룡', '매우', '실망', '스럽다', '가격', '대비', '정말', '없다', '공룡', '전시', '이다', '사람', '다야', '가족', '마찬가지', '동굴', '구매', '추천']",Negative,0.9335873126983643
광명동굴,경기 광명시 가학로85번길 142,1당100,무더위에 시원한게 두루두루 볼거리 많아요~,무더위에 시원한게 두루두루 볼거리 많아요,"['무더위', '시원하다', '두루', '두루', '볼거리', '많다']",Positive,0.9727692008018494
광명동굴,경기 광명시 가학로85번길 142,The156헤어,일단 광명시민이 아니라 입장료가 비싼편~~~빛의광장LED미디어쇼가 제일 기억에 남고 아이와 한번쯤 가볼만한 곳인듯 해요,일단 광명시민이 아니라 입장료가 비싼편빛의광장LED미디어쇼가 제일 기억에 남고 아이와 한번쯤 가볼만한 곳인듯 해요,"['일단', '광명', '시민', '아니다', '입장료', '비싸다', '편빛', '광장', '미디어', '제일', '기억', '남고', '아이', '한번']",Positive,0.9700751900672913
광명동굴,경기 광명시 가학로85번길 142,여행은 즐거워요,광명동굴에 친구들과 나들이 갔다.금. 은. 동. 구리 등 광물을 채취했던 역사와현재는 관광코스로 개발되어 식물들과 물고기들이 있어어린 자녀들에게 지루하지도 않고 교육도 되겠다는 생각이 들었다.와인 저장소로 운영된다고 한다.와인도 판매하고 맛보기 행사도 했다는데  우리 갔을때는 하지 않아서 아쉬웠다.광명동굴은 교육적인 장소라고 생각되고 어린학생 있는 부모들은 꼭 가보기를 권한다.온도가 낮으니 긴옷을 준비하면 좋아요,광명동굴에 친구들과 나들이 갔다.금. 은. 동. 구리 등 광물을 채취했던 역사와현재는 관광코스로 개발되어 식물들과 물고기들이 있어어린 자녀들에게 지루하지도 않고 교육도 되겠다는 생각이 들었다.와인 저장소로 운영된다고 한다.와인도 판매하고 맛보기 행사도 했다는데 우리 갔을때는 하지 않아서 아쉬웠다.광명동굴은 교육적인 장소라고 생각되고 어린학생 있는 부모들은 꼭 가보기를 권한다.온도가 낮으니 긴옷을 준비하면 좋아요,"['광명', '동굴', '친구', '나들이', '구리', '광물', '채취', '역사', '현재', '관광', '코스', '개발', '식물', '물고기', '있다', '자녀', '지루하다', '교육', '생각', '와인', '저장', '소로', '운영', '와인', '판매', '맛보기', '행사', '우리', '아쉽다', '광명', '동굴', '교육', '장소', '생각', '학생', '있다', '부모', '온도', '낮다', '준비', '좋다']",Positive,0.9694384336471558
광명동굴,경기 광명시 가학로85번길 142,shske159,입구 앞 신호등 주차요원 아저씨 무지하게 신경질적이시네요ㅋㅋㅋㅋ 앉아서 반말로 횡단보도! 횡단보도! 아저씨가 말하기 전부터 횡단보도로 건넜습니다 차량통제나 똑바로 하시고 아저씨한테 반말 들을 만큼 적은 나이 아닙니다ㅋㅋㅋ 반말하지 마시라 했지만 주변에 사람들만 없었어도 가서 한마디 더했을꺼에요^^,입구 앞 신호등 주차요원 아저씨 무지하게 신경질적이시네요ㅋㅋㅋㅋ 앉아서 반말로 횡단보도! 횡단보도! 아저씨가 말하기 전부터 횡단보도로 건넜습니다 차량통제나 똑바로 하시고 아저씨한테 반말 들을 만큼 적은 나이 아닙니다ㅋㅋㅋ 반말하지 마시라 했지만 주변에 사람들만 없었어도 가서 한마디 더했을꺼에요,"['입구', '신호등', '주차', '요원', '아저씨', '무지하다', '신경질', '반말', '횡단보도', '횡단보도', '아저씨', '횡단보도', '차량', '통제', '똑바로', '아저씨', '반말', '만큼', '나이', '아니다', '반말', '주변', '사람', '없다', '한마디', '더하다']",Negative,0.67804354429245
광명동굴,경기 광명시 가학로85번길 142,Highquality,궁금해서 한번 들러봤는데 괜찮네요입장료는 인당 만원이였고코스가 짧지는 않았어요 역사 ? 공부도 아주 조금 하구 ㅋㅋ살면서 한번은 볼만한 광경 이였읍니다.,궁금해서 한번 들러봤는데 괜찮네요입장료는 인당 만원이였고코스가 짧지는 않았어요 역사 ? 공부도 아주 조금 하구 ㅋㅋ살면서 한번은 볼만한 광경 이였읍니다.,"['궁금하다', '한번', '괜찮다', '입장료', '만원', '코스', '짧다', '역사', '공부', '아주', '조금', '한번', '광경']",Positive,0.9702876210212708
광명동굴,경기 광명시 가학로85번길 142,didi113,타지인 방문해서 같이 갔는데 다들 생각보다 좋고 볼거리도 많다고 했어요저는 벌써 5번은 넘게 간거 같은데 변화는 많이 렂ㅅ지만 갈때마다 시원해서 걷기 좋은거 같아요,타지인 방문해서 같이 갔는데 다들 생각보다 좋고 볼거리도 많다고 했어요저는 벌써 5번은 넘게 간거 같은데 변화는 많이 렂ㅅ지만 갈때마다 시원해서 걷기 좋은거 같아요,"['타지', '방문', '생각', '좋다', '볼거리', '많다', '벌써', '번은', '같다', '변화', '시원하다', '걷기', '좋다', '같다']",Positive,0.9724713563919067
광명동굴,경기 광명시 가학로85번길 142,뽀물이뽀물이,공룡체험관은 다소 아쉽습니다^^,공룡체험관은 다소 아쉽습니다,"['공룡', '체험', '다소', '아쉽다']",Negative,0.5884214639663696
광명동굴,경기 광명시 가학로85번길 142,로사7711,넘 시원하고 좋았던 기억💕,넘 시원하고 좋았던 기억,"['시원하다', '좋다', '기억']",Positive,0.9743682146072388
광명동굴,경기 광명시 가학로85번길 142,kyiggang,지금 광명 동굴 공룡탐험전이 열리고 있어요.,지금 광명 동굴 공룡탐험전이 열리고 있어요.,"['지금', '광명', '동굴', '공룡', '탐험', '전이', '있다']",Positive,0.9134810566902161
광명동굴,경기 광명시 가학로85번길 142,크롱크롱5,입장료 만원이 이렇게 아깝기는 처음이네요. 주제도 뭣도 없이 조명만 꾸며놓은 중국식 전시… 광명이 중국인들 사는 곳이라 그런거라면 어쩔수 없지만 참 볼것도 없고 재미도 없는 곳이었습니다.,입장료 만원이 이렇게 아깝기는 처음이네요. 주제도 뭣도 없이 조명만 꾸며놓은 중국식 전시 광명이 중국인들 사는 곳이라 그런거라면 어쩔수 없지만 참 볼것도 없고 재미도 없는 곳이었습니다.,"['입장료', '만원', '아깝다', '처음', '주제', '조명', '중국', '전시', '광명', '중국', '그렇다', '없다', '없다', '재미', '없다']",Negative,0.9634189009666443
광명동굴,경기 광명시 가학로85번길 142,thy****,동굴시설을 멋지게 만들었습니다,동굴시설을 멋지게 만들었습니다,"['동굴', '시설', '멋지다']",Positive,0.9663955569267273
광명동굴,경기 광명시 가학로85번길 142,얍호신난다,시원하고 아주 잘 다녀왔습니다~,시원하고 아주 잘 다녀왔습니다,"['시원하다', '아주']",Positive,0.9727998971939087
광명동굴,경기 광명시 가학로85번길 142,mhr****,광명동굴 더운 여름 다녀오기 좋아요~그런데 같이 본 공룡탐험전은 가격대비 너무 볼게없어서그랬네요. 할인도 없고 가격이 비싼것같아요.,광명동굴 더운 여름 다녀오기 좋아요그런데 같이 본 공룡탐험전은 가격대비 너무 볼게없어서그랬네요. 할인도 없고 가격이 비싼것같아요.,"['광명', '동굴', '덥다', '여름', '좋다', '공룡', '탐험', '가격', '대비', '없다', '그렇다', '할인', '없다', '가격', '비싸다', '같다']",Negative,0.9403108358383179
광명동굴,경기 광명시 가학로85번길 142,제온36,근처 빵집에서 할인권받아 비교적 합리적 가격에 다녀왔습니다. 여름에 피서로 제격이에요.,근처 빵집에서 할인권받아 비교적 합리적 가격에 다녀왔습니다. 여름에 피서로 제격이에요.,"['근처', '빵집', '할인', '비교', '합리', '가격', '여름', '서로', '제격']",Positive,0.9706853032112122
광명동굴,경기 광명시 가학로85번길 142,kib****,멋있어요.,멋있어요.,['멋있다'],Positive,0.971744179725647
광명동굴,경기 광명시 가학로85번길 142,쥴리쓰,기대이상이에요💜 볼거리도 많고 너무 잘 갖추어졌어요,기대이상이에요 볼거리도 많고 너무 잘 갖추어졌어요,"['이상', '볼거리', '많다']",Positive,0.9752610921859741
광명동굴,경기 광명시 가학로85번길 142,밍뽀93,광명동굴 주차는 광명시민만 무료고 나머지는 내야해요.간김에 아이가 공룡탐험도 가고싶대서 현장예매했는데아이 어른 동일하게 12000원씩 총 48000원 결제했어요.이건 다자녀 할인도 안되요.가격이 좀 있어서 뭔가 알차게 잘 되어있겠지 했는데..결론적으론 실망입니다. 영상도 왜 나눠서 나오는지 3영상을 돌리는데 하나 보고 5분 기다렸다 다음꺼 보고 그래야합니다. 왜그런건지 아직도 이해가 안되네요..,광명동굴 주차는 광명시민만 무료고 나머지는 내야해요.간김에 아이가 공룡탐험도 가고싶대서 현장예매했는데아이 어른 동일하게 12000원씩 총 48000원 결제했어요.이건 다자녀 할인도 안되요.가격이 좀 있어서 뭔가 알차게 잘 되어있겠지 했는데..결론적으론 실망입니다. 영상도 왜 나눠서 나오는지 3영상을 돌리는데 하나 보고 5분 기다렸다 다음꺼 보고 그래야합니다. 왜그런건지 아직도 이해가 안되네요..,"['광명', '동굴', '주차', '광명', '시민', '무료', '나머지', '내야', '간김', '아이', '공룡', '탐험', '대서', '현장', '예매', '아이', '어른', '동일하다', '결제', '이건', '다자', '할인', '안되다', '가격', '있다', '뭔가', '알차다', '결론', '실망', '이다', '영상', '영상', '하나', '보고', '다음', '보고', '그렇다', '야하다', '이해', '안되다']",Negative,0.917280375957489
광명동굴,경기 광명시 가학로85번길 142,iamyou,서울 가까운 곳의 이색체험..!볼거리도 많고 주차도 쉬움.. 동굴이라 올라갈때 비탈길이 좀 있지만 내부에 들어오면 더위가 사악 사라짐.,서울 가까운 곳의 이색체험..!볼거리도 많고 주차도 쉬움.. 동굴이라 올라갈때 비탈길이 좀 있지만 내부에 들어오면 더위가 사악 사라짐.,"['서울', '가깝다', '이색', '체험', '볼거리', '많다', '주차', '쉬움', '동굴', '비탈길', '있다', '내부', '더위', '사악']",Positive,0.9719107151031494
광명동굴,경기 광명시 가학로85번길 142,w90****,동굴내아기자기하게볼꺼리가있네요,동굴내아기자기하게볼꺼리가있네요,"['동굴', '아기자기하다']",Positive,0.9348992705345154
광명동굴,경기 광명시 가학로85번길 142,j97****,한번은 갈만해요,한번은 갈만해요,"['한번', '만해']",Positive,0.9550244212150574
