store_name,address,nickname,content,cleaned_content,tokenized_words,sentiment,sentiment_score
서울스카이,서울 송파구 올림픽로 300 117~123층,꿍디쓰,"노을이 질때쯤 갔는데 넘 이뻤어요. 첫 방문때 야경으로 봤는데 훨씬 더 이뻤어요. 이번에는 낮 방문을 했고, 스탬프 미션이라던지, 무료로 한복 입고 사진 찍을 수 있는 체험이라던지 피아노라던지 다양해졌더라구요 ㅎㅎ 재밌었습니다.","노을이 질때쯤 갔는데 넘 이뻤어요. 첫 방문때 야경으로 봤는데 훨씬 더 이뻤어요. 이번에는 낮 방문을 했고, 스탬프 미션이라던지, 무료로 한복 입고 사진 찍을 수 있는 체험이라던지 피아노라던지 다양해졌더라구요 ㅎㅎ 재밌었습니다.","['노을', '질때', '이쁘다', '방문', '야경', '이쁘다', '이번', '방문', '스탬프', '미션', '무료', '한복', '사진', '있다', '체험', '피아노', '재밌다']",Positive,0.9721168279647827
서울스카이,서울 송파구 올림픽로 300 117~123층,열정팩토리,"직원분들이 친절하시고 이번에 오랜만에 서울여행하면서 이곳저곳 찾아보다가 한국에서 제일 높은 건물인데다가 높은 위치에서 아름다운 서울의 풍경들을 구경할 수 있는 서울스카이를 갔다 왔었어요ㅎㅎ 무엇보다 지하철 잠실역, 롯데월드, 롯데몰 등 여러 가지 즐길 거리 요소들이 다양한 곳에 위치하고 있었을 뿐만 아니라 네이버 예약으로 입장권을 저렴하게 구매할 수 있어 좋았고 미리 아침에 오픈런 했었던 만큼 사람들이 붐비지 않고 구경하기 좋았습니다ㅎㅎ 그리고 서울스카이 각 층마다 여러 가지 전시 예술 작품들을 비롯하여 관람객들 입장에서 즐길 거리들이 알차고 다양하게 구성되어 있어 있는 만큼  즐기기 너무나 재밌었습니다!! 만약 서울여행하면서 어디를 갈지 고민인 분들이 있다면 가족, 연인, 친구끼리 서울스카이 추천드려요ㅎㅎ","직원분들이 친절하시고 이번에 오랜만에 서울여행하면서 이곳저곳 찾아보다가 한국에서 제일 높은 건물인데다가 높은 위치에서 아름다운 서울의 풍경들을 구경할 수 있는 서울스카이를 갔다 왔었어요ㅎㅎ 무엇보다 지하철 잠실역, 롯데월드, 롯데몰 등 여러 가지 즐길 거리 요소들이 다양한 곳에 위치하고 있었을 뿐만 아니라 네이버 예약으로 입장권을 저렴하게 구매할 수 있어 좋았고 미리 아침에 오픈런 했었던 만큼 사람들이 붐비지 않고 구경하기 좋았습니다ㅎㅎ 그리고 서울스카이 각 층마다 여러 가지 전시 예술 작품들을 비롯하여 관람객들 입장에서 즐길 거리들이 알차고 다양하게 구성되어 있어 있는 만큼 즐기기 너무나 재밌었습니다!! 만약 서울여행하면서 어디를 갈지 고민인 분들이 있다면 가족, 연인, 친구끼리 서울스카이 추천드려요ㅎㅎ","['직원', '친절하다', '이번', '여행', '한국', '제일', '높다', '건물', '다가', '높다', '위치', '아름답다', '서울', '풍경', '구경', '있다', '스카이', '무엇', '지하철', '잠실역', '롯데', '월드', '롯데', '여러', '가지', '거리', '요소', '다양하다', '위치', '있다', '아니다', '네이버', '예약', '입장권', '저렴하다', '구매', '있다', '좋다', '미리', '아침', '오픈', '만큼', '사람', '구경', '좋다', '서울', '스카이', '여러', '가지', '전시', '예술', '작품', '비롯', '관람객', '입장', '거리', '알차다', '다양하다', '구성', '있다', '있다', '만큼', '재밌다', '만약', '여행', '어디', '고민', '있다', '가족', '연인', '친구', '끼리', '서울', '스카이', '추천']",Positive,0.9663533568382263
서울스카이,서울 송파구 올림픽로 300 117~123층,별사자별,입구부터 화려한 천장에 스카이에 올라가면 다양한 서울 뷰를 볼 수 있어서 시간가는 줄 모르고 즐겼어요 미키랑 콜라보해서 사진찍는 포토스팟도 있어서 좋았어요 평일에 가니 대기 없이 사람없이 여유롭게 서울풍경을.보고 왔어요,입구부터 화려한 천장에 스카이에 올라가면 다양한 서울 뷰를 볼 수 있어서 시간가는 줄 모르고 즐겼어요 미키랑 콜라보해서 사진찍는 포토스팟도 있어서 좋았어요 평일에 가니 대기 없이 사람없이 여유롭게 서울풍경을.보고 왔어요,"['입구', '화려하다', '천장', '스카이', '다양하다', '서울', '있다', '시간', '미키', '콜라보', '사진', '포토', '스팟', '있다', '좋다', '평일', '대기', '사람', '풍경', '보고']",Positive,0.974435031414032
서울스카이,서울 송파구 올림픽로 300 117~123층,토토르네,"네이버에서 미리 예약해 할인받고 방문했어여혼자 와서 좀 뻘쭘했지만 직원분의 친절한 안내 덕분에 입장까지 어렵지 않았습니다.도착하니 마침 해가 막 지기 시작하는 시간이었는데, 주황빛으로 물들어가는 모습이 정말 장관이었습니다.하필 구름이 꽉껴서 일몰을 못보면 어쩌나 걱정했는데다행히 구름 너머로 해가 졌어요.야외테라스도 있어서 춥지만 경치는 끝내줬어요야경이 너무 예뻐서 사진 찍는 손이 계속 바빴죵ㅎ전망대가 처음 생길때부터 몇번 봤는데 처음보다 뭔가 많이 갖춰지고 준비된거같아 돈이 아깝지 않았어요^^","네이버에서 미리 예약해 할인받고 방문했어여혼자 와서 좀 뻘쭘했지만 직원분의 친절한 안내 덕분에 입장까지 어렵지 않았습니다.도착하니 마침 해가 막 지기 시작하는 시간이었는데, 주황빛으로 물들어가는 모습이 정말 장관이었습니다.하필 구름이 꽉껴서 일몰을 못보면 어쩌나 걱정했는데다행히 구름 너머로 해가 졌어요.야외테라스도 있어서 춥지만 경치는 끝내줬어요야경이 너무 예뻐서 사진 찍는 손이 계속 바빴죵ㅎ전망대가 처음 생길때부터 몇번 봤는데 처음보다 뭔가 많이 갖춰지고 준비된거같아 돈이 아깝지 않았어요","['네이버', '미리', '예약', '할인', '방문', '혼자', '뻘쭘했', '직원', '친절하다', '안내', '덕분', '입장', '어렵다', '도착', '마침', '지기', '시작', '시간', '주황', '모습', '정말', '장관', '하필', '구름', '일몰', '걱정', '다행하다', '구름', '너머', '야외', '테라스', '있다', '경치', '끝내주다', '야경', '예쁘다', '사진', '계속', '바빴죵', '전망대', '처음', '몇번', '처음', '뭔가', '준비', '된거', '같다', '아깝다']",Positive,0.9657171964645386
서울스카이,서울 송파구 올림픽로 300 117~123층,쭈미8202,근처 살면서도 한번가봐야지 하고선 날씨핑계 이런저런이유로 못가보다가 날이 좋아서 한번 가보자 하고 ㅋ엄마랑 갔다왔어요♡ 평일이라 여유가 있었고 금방올라가고 잠깐의 영상이 끝나면한강뷰가 펼쳐지는데 너무 멋있더라구요 올라가서 내려다본 서울의모습은 참 아름다웠어요 ♡♡♡볼건 솔직히 그게 전부지만 그거 하나보러 올라갈만 합니다 멋져요^^단 날이 너무좋아도 올라가면 구름으로 계속 바뀌네요 ㅋㅋ 지금 디즈니 콜라보하는것도 이뻐구요외국인들이 많아 뿌듯하더라구요평일에 가세요 사진 이쁘게 찍으시려면^^,근처 살면서도 한번가봐야지 하고선 날씨핑계 이런저런이유로 못가보다가 날이 좋아서 한번 가보자 하고 ㅋ엄마랑 갔다왔어요 평일이라 여유가 있었고 금방올라가고 잠깐의 영상이 끝나면한강뷰가 펼쳐지는데 너무 멋있더라구요 올라가서 내려다본 서울의모습은 참 아름다웠어요 볼건 솔직히 그게 전부지만 그거 하나보러 올라갈만 합니다 멋져요단 날이 너무좋아도 올라가면 구름으로 계속 바뀌네요 ㅋㅋ 지금 디즈니 콜라보하는것도 이뻐구요외국인들이 많아 뿌듯하더라구요평일에 가세요 사진 이쁘게 찍으시려면,"['근처', '한번', '날씨', '핑계', '이유', '좋다', '한번', '엄마', '평일', '여유', '있다', '금방', '잠깐', '영상', '한강', '멋있다', '서울', '모습', '아름답다', '솔직하다', '그게', '전부', '그거', '하나', '멋지다', '좋다', '구름', '계속', '지금', '디즈니', '콜라보', '이쁘다', '외국인', '많다', '뿌듯하다', '평일', '가세', '사진', '이쁘다']",Positive,0.9701932668685913
서울스카이,서울 송파구 올림픽로 300 117~123층,토낑이57,"17일 월요일 저녁 9시쯤?입장했는데직원들이 빠른 입장 도와줬어요특히 입구에 큐알 티켓 확인하는 여성분이런 분이 입구에서 밝은 인사와 따뜻한 응대 덕분에 하루가 더 밝아졌어요. 친절함이 정말 인상적이었고, 또 방문하고 싶어졌습니다 😊감사합니다","17일 월요일 저녁 9시쯤?입장했는데직원들이 빠른 입장 도와줬어요특히 입구에 큐알 티켓 확인하는 여성분이런 분이 입구에서 밝은 인사와 따뜻한 응대 덕분에 하루가 더 밝아졌어요. 친절함이 정말 인상적이었고, 또 방문하고 싶어졌습니다 감사합니다","['월요일', '저녁', '입장', '직원', '빠르다', '입장', '입구', '큐알', '티켓', '확인', '여성', '이렇다', '입구', '인사', '따뜻하다', '응대', '덕분', '하루', '친절하다', '정말', '인상', '방문']",Positive,0.9737719297409058
서울스카이,서울 송파구 올림픽로 300 117~123층,순수버들,매번 지방여행을 가면 타워는 꼭 가보는데..예전에 남산타워 이후로 이번 설 여행에 온 롯데스카이롯데는 또 다른 느낌이었습니다.서울야경이 너무 이뻤고 멋졌습니다.가족들과 함께라 더 좋았네요~ 빠르게 111층에 도착할때 압력차로 귀가 좀 멍~ 했지만 너무 100층되는 곳을 1분컷으로 올라가서 신기한체험이었습니다.예전에 도쿄타워갔을때 생각이 났어요^^,매번 지방여행을 가면 타워는 꼭 가보는데..예전에 남산타워 이후로 이번 설 여행에 온 롯데스카이롯데는 또 다른 느낌이었습니다.서울야경이 너무 이뻤고 멋졌습니다.가족들과 함께라 더 좋았네요 빠르게 111층에 도착할때 압력차로 귀가 좀 멍 했지만 너무 100층되는 곳을 1분컷으로 올라가서 신기한체험이었습니다.예전에 도쿄타워갔을때 생각이 났어요,"['매번', '지방', '여행', '가면', '타워', '예전', '남산타워', '이후', '이번', '여행', '롯데', '스카이', '롯데', '다른', '야경', '이쁘다', '멋지다', '가족', '좋다', '빠르다', '도착', '압력', '차로', '귀가', '신기하다', '체험', '예전', '도쿄타워', '생각']",Positive,0.9727035164833069
서울스카이,서울 송파구 올림픽로 300 117~123층,leekkong2,늦오후-저녁쯤 도착했더니 야경이 반겨줌 ✨이 시간대는 사람도 많이 없어서 편하게 관람했다 미키콜라보라 너무너무 사랑스러웠고 스탬프 찍는 것도 재밌었다 기프트샵 안 들릴수가 없고 결국 지갑열게 만듬,늦오후저녁쯤 도착했더니 야경이 반겨줌 이 시간대는 사람도 많이 없어서 편하게 관람했다 미키콜라보라 너무너무 사랑스러웠고 스탬프 찍는 것도 재밌었다 기프트샵 안 들릴수가 없고 결국 지갑열게 만듬,"['오후', '저녁', '도착', '야경', '시간대', '사람', '없다', '편하다', '관람', '미키', '콜라보', '사랑스럽다', '스탬프', '재밌다', '기프트샵', '없다', '지갑', '만듬']",Positive,0.9730179905891418
서울스카이,서울 송파구 올림픽로 300 117~123층,쥬디6867,비 안오는 날 날은 잘 잡았는데 추석연휴라서 사람이 진짜 많았어요.대기도 길고포토존에서 사진은 줄이 너무 길어서포기했지만높은 곳 올라가니 뻥 뚫리는 기분이라좋긴 하더라구요^^ 1분만에 117층까지 슈웅~~경험해보세요♡♡♡^^*,비 안오는 날 날은 잘 잡았는데 추석연휴라서 사람이 진짜 많았어요.대기도 길고포토존에서 사진은 줄이 너무 길어서포기했지만높은 곳 올라가니 뻥 뚫리는 기분이라좋긴 하더라구요 1분만에 117층까지 슈웅경험해보세요,"['추석', '연휴', '사람', '진짜', '많다', '대기', '길다', '포토', '사진', '포기', '높다', '기분', '좋다', '슈웅', '경험']",Positive,0.9694285988807678
서울스카이,서울 송파구 올림픽로 300 117~123층,커맨더홍,약간 비싼거라 생각되지만 우리나라 최고 스카이뷰 맛집으로 위안을 받았습니다 이른 시간이라 관광객은 적었지만.전망대 구경하고 있으니까 서서히 관광객이 붐비기 시작합니다주말에도 일찍가면 여유가 있으니 참고하세요,약간 비싼거라 생각되지만 우리나라 최고 스카이뷰 맛집으로 위안을 받았습니다 이른 시간이라 관광객은 적었지만.전망대 구경하고 있으니까 서서히 관광객이 붐비기 시작합니다주말에도 일찍가면 여유가 있으니 참고하세요,"['약간', '비싸다', '생각', '우리나라', '최고', '스카이', '맛집', '위안', '시간', '관광객', '전망대', '구경', '있다', '서서히', '관광객', '시작', '주말', '일찍', '가면', '여유', '있다', '참고']",Positive,0.9613304734230042
서울스카이,서울 송파구 올림픽로 300 117~123층,연어가세상에서제일질리는음식,캐치테이블로 저녁 25만원짜리 코스 예약해서 이용했어요.단체 매표소 창구에서 바로 입장이 가능하기에 주말에는 어어ㅓㅇ엄청긴 줄을 기다릴 필요가 없네요. 따로 프라이빗한 공간을 통해서 꼭대기에 올려주시는데 와... 돈맛이 좋구나.. 더 살아야겟구나.. 라고 느꼈던 순간이네요.예약한 시간보다 1시간 반정도 일찍 도착해서 전망대 구경후 40분정도 일찍 레스토랑 입장했습니다. 창가 2인석에 앉았구요. 음식은 정말 맛있었어요. 음식이며 뷰이며 분위기며 머하나 빠지는게 없네요. 25에 이정도면 충분히 즐기고 지불할 만한 값어치를 합니다. 전혀 아깝지가 않았어요.안배부를줄 알았는데 엄청 배불리 먹었어요.약혼자와 좋은 시간 보내다 갑니다!다음에는 할머니랑 올게요,캐치테이블로 저녁 25만원짜리 코스 예약해서 이용했어요.단체 매표소 창구에서 바로 입장이 가능하기에 주말에는 어어ㅓㅇ엄청긴 줄을 기다릴 필요가 없네요. 따로 프라이빗한 공간을 통해서 꼭대기에 올려주시는데 와... 돈맛이 좋구나.. 더 살아야겟구나.. 라고 느꼈던 순간이네요.예약한 시간보다 1시간 반정도 일찍 도착해서 전망대 구경후 40분정도 일찍 레스토랑 입장했습니다. 창가 2인석에 앉았구요. 음식은 정말 맛있었어요. 음식이며 뷰이며 분위기며 머하나 빠지는게 없네요. 25에 이정도면 충분히 즐기고 지불할 만한 값어치를 합니다. 전혀 아깝지가 않았어요.안배부를줄 알았는데 엄청 배불리 먹었어요.약혼자와 좋은 시간 보내다 갑니다!다음에는 할머니랑 올게요,"['캐치', '테이블', '저녁', '코스', '예약', '이용', '단체', '매표소', '창구', '바로', '입장', '가능하다', '주말', '어어', '필요', '없다', '프라이', '공간', '통해', '꼭대기', '돈맛', '좋다', '순간', '예약', '시간', '반정', '일찍', '도착', '전망대', '경후', '일찍', '레스토랑', '입장', '창가', '인석', '음식', '정말', '맛있다', '음식', '분위기', '하나', '없다', '정도', '충분하다', '지불', '값어치', '전혀', '아깝다', '배부르다', '불리', '약혼자', '좋다', '시간', '다음', '할머니']",Positive,0.9640188813209534
서울스카이,서울 송파구 올림픽로 300 117~123층,내돈내산 리얼리뷰,엘베타고 슝~올라가서 구경 잘했어요360도 다양한 각도에서 서울구경을~~편의시설도 잘되어 있고 뷰가 정말 좋아요👍👍👍,엘베타고 슝올라가서 구경 잘했어요360도 다양한 각도에서 서울구경을편의시설도 잘되어 있고 뷰가 정말 좋아요,"['엘베', '타고', '구경', '다양하다', '각도', '구경', '편의', '시설', '있다', '정말', '좋다']",Positive,0.9743505716323853
서울스카이,서울 송파구 올림픽로 300 117~123층,류류요,전망대가있는건 알았지만 갈 생각은 하지않았던..비싸다고 생각했었지만 생각보다 볼거리는 많았어요디즈니와 한국풍 협업이 예쁩니다엽서 1장당 3000원,전망대가있는건 알았지만 갈 생각은 하지않았던..비싸다고 생각했었지만 생각보다 볼거리는 많았어요디즈니와 한국풍 협업이 예쁩니다엽서 1장당 3000원,"['전망대', '있다', '생각', '비싸다', '생각', '생각', '볼거리', '많다', '디즈니', '한국', '협업', '예쁘다', '엽서']",Positive,0.9658327698707581
서울스카이,서울 송파구 올림픽로 300 117~123층,윰윰4285,해가 지려고 준비하는 오후 5시 정도 입장하니 해가 서서히 넘어가며 보이는 노을이 장관이었습니다야경까지 멋있게 감상 할 수 있었어요! 일요일이라 사람도 아주 많지 않고 맨 위층까지 올라가서 멋있는 뷰를 보고 왔습니다야외 테라스도 있고 기념 사진도 남길 수 있어서 추천합니다!! 넉넉히 2시간 정도 잡으면 맘껏 둘러볼 수 있어요유아휴게실도 잘되어 있고 편의시설이 잘 갖춰져 있어 좋습니다,해가 지려고 준비하는 오후 5시 정도 입장하니 해가 서서히 넘어가며 보이는 노을이 장관이었습니다야경까지 멋있게 감상 할 수 있었어요! 일요일이라 사람도 아주 많지 않고 맨 위층까지 올라가서 멋있는 뷰를 보고 왔습니다야외 테라스도 있고 기념 사진도 남길 수 있어서 추천합니다!! 넉넉히 2시간 정도 잡으면 맘껏 둘러볼 수 있어요유아휴게실도 잘되어 있고 편의시설이 잘 갖춰져 있어 좋습니다,"['려고', '준비', '오후', '정도', '입장', '서서히', '노을', '장관', '야경', '멋있다', '감상', '있다', '일요일', '사람', '아주', '많다', '위층', '멋있다', '보고', '야외', '테라스', '있다', '기념', '사진', '있다', '추천', '넉넉하다', '정도', '맘껏', '있다', '유아', '휴게실', '있다', '편의', '시설', '있다', '좋다']",Positive,0.9704414010047913
서울스카이,서울 송파구 올림픽로 300 117~123층,쪼물왕자,3만원 제값주고 올라가도 안아까운 경치입니다! 저는 네이버예매로 2만원으로 올라가니깐 더욱더 만족도가 높아요. 가족들과 좋은시간보내고 500m 상공에서 아이스크림하나 사먹고 사진 찍고 내려왔습니다☆,3만원 제값주고 올라가도 안아까운 경치입니다! 저는 네이버예매로 2만원으로 올라가니깐 더욱더 만족도가 높아요. 가족들과 좋은시간보내고 500m 상공에서 아이스크림하나 사먹고 사진 찍고 내려왔습니다,"['아깝다', '경치', '이다', '네이버', '예매', '더욱더', '만족도', '높다', '가족', '좋다', '시간', '상공', '아이스크림', '하나', '사진']",Positive,0.9652912616729736
서울스카이,서울 송파구 올림픽로 300 117~123층,여니사랑32,비소식도 있고흐린날씨라서 걱정했어요구름때문에 흐리게 보일까봐~ 낮도 좋지만 야경 진짜 추천👍그런데 걱정한것보다 흐려도 가시거리가 잘 나오고 시티뷰가 정말 좋았어요서울에서 지나다니던 곳인데117~120층에서의 360도뷰는 정말가서 직접 보지 않으면 경험할 수 없고양쪽에  위치한 야외 테라스에서 보는 전망 아찔합니다 시원한 바람을 직접 경험해보세요전망대는 꼭 가보시길 바래요~🤗저렴히 2만원대 갚어치하네요~시간 넉넉히 생각하시고은근 볼거리가 많아서 2시간을 훌쩍 넘겼어요🤗,비소식도 있고흐린날씨라서 걱정했어요구름때문에 흐리게 보일까봐 낮도 좋지만 야경 진짜 추천그런데 걱정한것보다 흐려도 가시거리가 잘 나오고 시티뷰가 정말 좋았어요서울에서 지나다니던 곳인데117120층에서의 360도뷰는 정말가서 직접 보지 않으면 경험할 수 없고양쪽에 위치한 야외 테라스에서 보는 전망 아찔합니다 시원한 바람을 직접 경험해보세요전망대는 꼭 가보시길 바래요저렴히 2만원대 갚어치하네요시간 넉넉히 생각하시고은근 볼거리가 많아서 2시간을 훌쩍 넘겼어요,"['비소', '있다', '날씨', '걱정', '구름', '때문', '낮다', '좋다', '야경', '진짜', '추천', '걱정', '가시거리', '시티', '정말', '좋다', '서울', '도뷰', '정말', '직접', '보지', '경험', '없다', '양쪽', '위치', '야외', '테라스', '전망', '아찔하다', '시원하다', '바람', '직접', '경험', '전망대', '저렴하다', '시간', '넉넉하다', '생각', '은근', '볼거리', '많다', '훌쩍']",Positive,0.9694963693618774
서울스카이,서울 송파구 올림픽로 300 117~123층,hyu****,인트로부터 두근두근하며 들어갔는데 너무 좋았습니다~ 노을지는 시간에 들어가서 야경까지 보고 나왔습니다! 너무너무 만족스러운 시간이였어요😉,인트로부터 두근두근하며 들어갔는데 너무 좋았습니다 노을지는 시간에 들어가서 야경까지 보고 나왔습니다! 너무너무 만족스러운 시간이였어요,"['인트로', '좋다', '노을', '시간', '야경', '보고', '만족스럽다', '시간']",Positive,0.9733840227127075
서울스카이,서울 송파구 올림픽로 300 117~123층,꿈꾸는 My 하우스,"롯데월드 서울타워전망대 다녀왔습니다. 다행이 날씨가 좋아서 깨끗한 야경을 보았습니다. 후지워터액자 1개 20,000원 구입했습니다.","롯데월드 서울타워전망대 다녀왔습니다. 다행이 날씨가 좋아서 깨끗한 야경을 보았습니다. 후지워터액자 1개 20,000원 구입했습니다.","['롯데', '월드', '서울', '타워', '전망대', '다행', '날씨', '좋다', '깨끗하다', '야경', '후지', '워터', '액자', '구입']",Positive,0.8497503399848938
서울스카이,서울 송파구 올림픽로 300 117~123층,오기자,서울 전체 야경을 한 눈에 볼 수있어요 디즈니와 롯데가 콜라보해서 스탬프 투어하는 재미가 쏠쏠해요,서울 전체 야경을 한 눈에 볼 수있어요 디즈니와 롯데가 콜라보해서 스탬프 투어하는 재미가 쏠쏠해요,"['서울', '전체', '야경', '있다', '디즈니', '롯데', '콜라보', '스탬프', '투어', '재미', '쏠쏠하다']",Positive,0.9734334945678711
서울스카이,서울 송파구 올림픽로 300 117~123층,오드리0704,연휴라 사람이 많을거 같아 11시 조금 넘어 도착했어요. 현장구매줄은 엄청 길었지만 저희는 네이버예약으로 빠르게 들어갈 수 있었어요. 엘베 탑승인원이 한정되어 있다보니 조금 기다리긴 했는데 저희는 별로 안기다린거더라구요. 121층까지 봤고 123층은 라운지(식당)이라 이용안했어요. 비가와서 시야가 좁게 보였지만 나름 사진도 많이 찍고 잘 보고 온거 같아요. 2시쯤 나오니 2시간이상대기더리구요. 비가 안왔으면 사람이 더 많았을거 같아요. 기념품샵은 위에도 있고 출구로 나오면 또 있어요. 롯데월드몰에서 쇼핑하고 맛난 음식도 먹고 왔어요.,연휴라 사람이 많을거 같아 11시 조금 넘어 도착했어요. 현장구매줄은 엄청 길었지만 저희는 네이버예약으로 빠르게 들어갈 수 있었어요. 엘베 탑승인원이 한정되어 있다보니 조금 기다리긴 했는데 저희는 별로 안기다린거더라구요. 121층까지 봤고 123층은 라운지식당이라 이용안했어요. 비가와서 시야가 좁게 보였지만 나름 사진도 많이 찍고 잘 보고 온거 같아요. 2시쯤 나오니 2시간이상대기더리구요. 비가 안왔으면 사람이 더 많았을거 같아요. 기념품샵은 위에도 있고 출구로 나오면 또 있어요. 롯데월드몰에서 쇼핑하고 맛난 음식도 먹고 왔어요.,"['연휴', '사람', '많다', '같다', '조금', '도착', '현장', '길다', '저희', '네이버', '예약', '빠르다', '있다', '엘베', '탑승', '인원', '한정', '있다', '조금', '저희', '별로', '라운지', '식당', '이용', '시야', '좁다', '나름', '사진', '보고', '같다', '나오니', '사람', '많다', '같다', '기념품', '있다', '출구', '있다', '롯데', '월드', '쇼핑', '음식']",Positive,0.9396039247512817
