store_name,address,nickname,content,cleaned_content,tokenized_words,sentiment,sentiment_score
스카이라인루지 통영,경남 통영시 발개로 178,수호천사Nurse,너무 재밌고 스트레스 잘 풀고 왔습니다~!,너무 재밌고 스트레스 잘 풀고 왔습니다!,"['재밌다', '스트레스']",Positive,0.9718995690345764
스카이라인루지 통영,경남 통영시 발개로 178,tta****,세번째 방문주말이라 사람들이 많았지만대기줄이 금방금방 줄어들어 지루하지 않았습니다,세번째 방문주말이라 사람들이 많았지만대기줄이 금방금방 줄어들어 지루하지 않았습니다,"['세번', '방문', '주말', '사람', '많다', '금방', '금방', '지루하다']",Positive,0.9599062204360962
스카이라인루지 통영,경남 통영시 발개로 178,cro****,눈치게임 성공해서 기다림 없이 즐길수 있었어요직원분들도 친절하시고 좋으세요,눈치게임 성공해서 기다림 없이 즐길수 있었어요직원분들도 친절하시고 좋으세요,"['눈치', '게임', '성공하다', '기다림', '있다', '직원', '친절하다', '좋다']",Positive,0.973115861415863
스카이라인루지 통영,경남 통영시 발개로 178,훌훌15,5시 쯤가니까 겁나 널널해서 타기 좋음 ㄹㄹ,5시 쯤가니까 겁나 널널해서 타기 좋음 ㄹㄹ,"['널널', '좋다']",Positive,0.9584479928016663
스카이라인루지 통영,경남 통영시 발개로 178,야뵵,굿,굿,[],Positive,0.9277362823486328
스카이라인루지 통영,경남 통영시 발개로 178,히힛67,4코스 한 번씩 타면 잼나요,4코스 한 번씩 타면 잼나요,['코스'],Positive,0.9713460803031921
스카이라인루지 통영,경남 통영시 발개로 178,zqkqhdiz,일년에 한두번은 꼭 루지타러 통영을 오는데오늘은 날씨도 너무 좋아서 완전 만족하고 가요~,일년에 한두번은 꼭 루지타러 통영을 오는데오늘은 날씨도 너무 좋아서 완전 만족하고 가요,"['번은', '루지', '통영', '오늘', '날씨', '좋다', '완전', '만족하다', '가요']",Positive,0.9714022278785706
스카이라인루지 통영,경남 통영시 발개로 178,군기반장62,"초등학생은 주니어 코스가 따로 있네요아이,어른 각자 재미있게 즐기고 갑니다^^","초등학생은 주니어 코스가 따로 있네요아이,어른 각자 재미있게 즐기고 갑니다","['초등학생', '주니어', '코스', '있다', '아이', '어른', '각자', '재미있다']",Positive,0.9456372261047363
스카이라인루지 통영,경남 통영시 발개로 178,초인맨68,재미있게   잘 놀았어요,재미있게 잘 놀았어요,['재미있다'],Positive,0.9729689955711365
스카이라인루지 통영,경남 통영시 발개로 178,김지은51,아이 데리고 루지 처음 타봤는데 아이들이 너무 즐거워해서 아주 뿌듯했어요!,아이 데리고 루지 처음 타봤는데 아이들이 너무 즐거워해서 아주 뿌듯했어요!,"['아이', '데리', '루지', '처음', '아이', '즐겁다', '아주', '뿌듯하다']",Positive,0.9726576209068298
스카이라인루지 통영,경남 통영시 발개로 178,아라고른25,너무 재미있어요저희  아들은 한번만 탄다더니 나중엔 세번이 아쉽다고 하네요 ㅎㅎ,너무 재미있어요저희 아들은 한번만 탄다더니 나중엔 세번이 아쉽다고 하네요 ㅎㅎ,"['재미있다', '저희', '아들', '한번', '나중', '세번', '아쉽다']",Positive,0.9720003604888916
스카이라인루지 통영,경남 통영시 발개로 178,표쿵,진~~짜 재밌습니다ㅋㅋㅋ,진짜 재밌습니다ㅋㅋㅋ,"['진짜', '재밌다']",Positive,0.9723018407821655
스카이라인루지 통영,경남 통영시 발개로 178,빛날마미,통영에서는 무조건 루지릉 타야합니다 무조건 다회권! 미리 예매해서 가세요,통영에서는 무조건 루지릉 타야합니다 무조건 다회권! 미리 예매해서 가세요,"['통영', '무조건', '루지', '무조건', '미리', '예매', '가세']",Positive,0.866723895072937
스카이라인루지 통영,경남 통영시 발개로 178,쪼만무,당일사용이가능해서 아주좋았습니다,당일사용이가능해서 아주좋았습니다,"['사용', '가능하다', '아주', '좋다']",Positive,0.9737052321434021
스카이라인루지 통영,경남 통영시 발개로 178,뭘봐요95,가족들과 어린이날 잘 놀다 왔습니다.,가족들과 어린이날 잘 놀다 왔습니다.,"['가족', '어린이날']",Positive,0.9645993113517761
스카이라인루지 통영,경남 통영시 발개로 178,한방이맘48,재미있었어요  근데  타고  난후에  허리랑  엉덩이가  너무 아파요,재미있었어요 근데 타고 난후에 허리랑 엉덩이가 너무 아파요,"['재미있다', '타고', '난후', '허리', '엉덩이', '아프다']",Positive,0.9397416114807129
스카이라인루지 통영,경남 통영시 발개로 178,슈퍼스타1375,재미있는 시간 보냈어요. 아이들이 있다면 꼭 방문해 보세요,재미있는 시간 보냈어요. 아이들이 있다면 꼭 방문해 보세요,"['재미있다', '시간', '아이', '있다', '방문']",Positive,0.9730744361877441
스카이라인루지 통영,경남 통영시 발개로 178,kh****,비오는날 탔는데   나름의 재미!!!!!!,비오는날 탔는데 나름의 재미!!!!!!,"['나름', '재미']",Positive,0.9704563021659851
스카이라인루지 통영,경남 통영시 발개로 178,sdoanign,"우와 첫 루지체험 인데,너무 재미 났어요~~~","우와 첫 루지체험 인데,너무 재미 났어요","['루지', '체험', '재미']",Positive,0.9696752429008484
스카이라인루지 통영,경남 통영시 발개로 178,핑봄이,금요일에가서 그런지 생각보다 사람이 별로없어서 대기줄이 길지 않아서 좋았어요~ 추워서 생각보다 손이 얼것같았는데도 재미지네요 ㅎㅎ 3번정도 타는게 딱 적당한것같아요!,금요일에가서 그런지 생각보다 사람이 별로없어서 대기줄이 길지 않아서 좋았어요 추워서 생각보다 손이 얼것같았는데도 재미지네요 ㅎㅎ 3번정도 타는게 딱 적당한것같아요!,"['금요일', '그렇다', '생각', '사람', '별로', '없다', '길다', '좋다', '춥다', '생각', '같다', '재미', '지네', '정도', '적당하다', '같다']",Positive,0.9725643992424011
스카이라인루지 통영,경남 통영시 발개로 178,jiy****,5회권끊을껄 아쉬웠어여~아들은 너무 너무 신나게 타고 120 좀 넘는 아이는 혼자타기 무섭다고 해서 직원분한테 사정이야기 하고 아이동반으로 탔어요~마지막에 저희 둘째랑 비슷한 아이가 살짝 이탈해서 동반으로 하길 잘 했다 싶더라구요~ 이탈해도 안전하긴 했는데 전 불안해하는 부모라 팔힘도 좀 세지고 키도 더 커지면 다시 와서 따로 타고 싶네욯,5회권끊을껄 아쉬웠어여아들은 너무 너무 신나게 타고 120 좀 넘는 아이는 혼자타기 무섭다고 해서 직원분한테 사정이야기 하고 아이동반으로 탔어요마지막에 저희 둘째랑 비슷한 아이가 살짝 이탈해서 동반으로 하길 잘 했다 싶더라구요 이탈해도 안전하긴 했는데 전 불안해하는 부모라 팔힘도 좀 세지고 키도 더 커지면 다시 와서 따로 타고 싶네욯,"['아쉽다', '아들', '신나다', '타고', '아이', '혼자', '무섭다', '직원', '사정', '이야기', '아이', '동반', '마지막', '저희', '둘째', '비슷하다', '아이', '살짝', '이탈', '동반', '이탈', '안전하다', '불안하다', '부모', '세지', '키도', '다시', '타고', '싶네욯']",Positive,0.9348838329315186
스카이라인루지 통영,경남 통영시 발개로 178,navia70,"홈페이지에서 장갑 포함 5회권, 3만 5천 원대로 구매했습니다.이후에 케이블카 이용 후 영수증으로5회권, 3만 3천으로 구매해 다시 이용했습니다.홈페이지보다 2천 원 가량 더 저렴한데, 장갑이 손바닥에 빨판 있는 일회용 목장갑 느낌입니다.겨울이라 장갑 있으실 테니 케이블카 이용 후 루지 가는 일정 추전합니다.장갑 없으면 진동으로 손가락 관절이 아프더라고요.코스는 4가지로 레전드와 그레비티에만 조그마한 급 경사 하나 있고 나머지는 비슷비슷합니다.리프트 타는 재미 쏠쏠하고조작법도 쉽고 해서 아이들 타기 좋습니다^^","홈페이지에서 장갑 포함 5회권, 3만 5천 원대로 구매했습니다.이후에 케이블카 이용 후 영수증으로5회권, 3만 3천으로 구매해 다시 이용했습니다.홈페이지보다 2천 원 가량 더 저렴한데, 장갑이 손바닥에 빨판 있는 일회용 목장갑 느낌입니다.겨울이라 장갑 있으실 테니 케이블카 이용 후 루지 가는 일정 추전합니다.장갑 없으면 진동으로 손가락 관절이 아프더라고요.코스는 4가지로 레전드와 그레비티에만 조그마한 급 경사 하나 있고 나머지는 비슷비슷합니다.리프트 타는 재미 쏠쏠하고조작법도 쉽고 해서 아이들 타기 좋습니다","['홈페이지', '장갑', '포함', '원대', '구매', '이후', '케이블카', '이용', '영수증', '구매', '다시', '이용', '홈페이지', '가량', '저렴하다', '장갑', '손바닥', '빨판', '있다', '일회용', '장갑', '느낌', '이다', '겨울', '장갑', '있다', '케이블카', '이용', '루지', '일정', '장갑', '없다', '진동', '손가락', '관절', '아프다', '코스', '가지', '레전드', '레비', '조그마하다', '경사', '하나', '있다', '나머지', '비슷', '비슷하다', '리프트', '재미', '쏠쏠하다', '법도', '아이', '좋다']",Positive,0.8909137845039368
스카이라인루지 통영,경남 통영시 발개로 178,coo****,자연속에서 달리는 느낌 상쾌합니다,자연속에서 달리는 느낌 상쾌합니다,"['연속', '느낌', '상쾌하다']",Positive,0.973403811454773
스카이라인루지 통영,경남 통영시 발개로 178,00****,정말 특별한 경험 이었습니다리프드로 올라갈때는 좀 무섭지만 잼있었습니다아이도 좋아했구요,정말 특별한 경험 이었습니다리프드로 올라갈때는 좀 무섭지만 잼있었습니다아이도 좋아했구요,"['정말', '특별하다', '경험', '리프', '무섭다', '아이', '좋아하다']",Positive,0.9726975560188293
스카이라인루지 통영,경남 통영시 발개로 178,꽃작업 flowerwork,엄청 재밌었어요 짱짱맨!!!,엄청 재밌었어요 짱짱맨!!!,"['재밌다', '짱짱맨']",Positive,0.9748103022575378
스카이라인루지 통영,경남 통영시 발개로 178,fillboy,아이들과 함께 좋은시간 보내기 좋아요,아이들과 함께 좋은시간 보내기 좋아요,"['아이', '좋다', '시간', '좋다']",Positive,0.9718485474586487
스카이라인루지 통영,경남 통영시 발개로 178,kim****,엄마랑 루지타러 왔다가 넘 추워서 각4천원씩 주고 산 장갑.. 비싸지만 살 수밖에 없었던 추위....ㅎㅎ 루지타러 오시거든 장갑 꼭 챙겨오세요~~~~~@.@ 넘 재밌어요!,엄마랑 루지타러 왔다가 넘 추워서 각4천원씩 주고 산 장갑.. 비싸지만 살 수밖에 없었던 추위....ㅎㅎ 루지타러 오시거든 장갑 꼭 챙겨오세요. 넘 재밌어요!,"['엄마', '루지', '춥다', '장갑', '비싸다', '없다', '추위', '루지', '장갑', '재밌다']",Positive,0.9728792905807495
스카이라인루지 통영,경남 통영시 발개로 178,맛있으면냐오,겨울엔 장갑필수...손 얼어 죽을뻔했어요 바람이 너무 불어서 여름에 타면 재밋을거같아요추운거 빼곤 재밋는 놀이기구입니다,겨울엔 장갑필수...손 얼어 죽을뻔했어요 바람이 너무 불어서 여름에 타면 재밋을거같아요추운거 빼곤 재밋는 놀이기구입니다,"['겨울', '장갑', '필수', '뻔하다', '바람', '불어', '여름', '재밋', '같다', '요추', '재밋는', '놀이기구', '이다']",Positive,0.9578790068626404
스카이라인루지 통영,경남 통영시 발개로 178,ANB24,인생 첫 루지4번 탈수있는거 결제했는데 두번째까진 흥미 못느끼다가 막판에 좀 재밌었네요평일엔 사람도 없어서 금방금방 타는듯,인생 첫 루지4번 탈수있는거 결제했는데 두번째까진 흥미 못느끼다가 막판에 좀 재밌었네요평일엔 사람도 없어서 금방금방 타는듯,"['인생', '루지', '탈수', '있다', '결제', '두번째', '흥미', '막판', '재밌다', '평일', '사람', '없다', '금방', '금방']",Positive,0.9549039602279663
스카이라인루지 통영,경남 통영시 발개로 178,달콤새콤85,아이도 어른도 너무 재미있어요매표소 직원분 진짜 친절하셔서 또 오고 싶어요무조건 4회이상 추천합니다,아이도 어른도 너무 재미있어요매표소 직원분 진짜 친절하셔서 또 오고 싶어요무조건 4회이상 추천합니다,"['아이', '어른', '재미있다', '매표소', '직원', '진짜', '친절하다', '무조건', '추천']",Positive,0.9751583933830261
스카이라인루지 통영,경남 통영시 발개로 178,정애은,재미있어요.,재미있어요.,['재미있다'],Positive,0.9722965359687805
스카이라인루지 통영,경남 통영시 발개로 178,토지93,재미있어요,재미있어요,['재미있다'],Positive,0.9728890061378479
스카이라인루지 통영,경남 통영시 발개로 178,찐빵a,통영하면 빠질수 없는 놀이기구 ㅋㅋ 루지탔어요..아이들도 처음으로 혼자타니 재미있어하더니 손에 너무 힘이 들어가서 팔 아파하더라구요;;,통영하면 빠질수 없는 놀이기구 ㅋㅋ 루지탔어요..아이들도 처음으로 혼자타니 재미있어하더니 손에 너무 힘이 들어가서 팔 아파하더라구요,"['통영', '없다', '놀이기구', '루지', '아이', '처음', '혼자', '재미있다', '아프다']",Positive,0.9619638919830322
스카이라인루지 통영,경남 통영시 발개로 178,jsr****,재미 있어요,재미 있어요,"['재미', '있다']",Positive,0.9727632999420166
스카이라인루지 통영,경남 통영시 발개로 178,배대성,좋았어요!,좋았어요!,['좋다'],Positive,0.9712448716163635
스카이라인루지 통영,경남 통영시 발개로 178,인천사는 케이씨,너무 신나고 잼있어요 무섭워 안탄다던 아이가 한번타더니 일등으로 내려와요,너무 신나고 잼있어요 무섭워 안탄다던 아이가 한번타더니 일등으로 내려와요,"['신나다', '무섭다', '아이', '한번', '일등']",Positive,0.9735861420631409
스카이라인루지 통영,경남 통영시 발개로 178,tea****,아이가 너무 좋아해요통영가면 무조건 가는 곳임,아이가 너무 좋아해요통영가면 무조건 가는 곳임,"['아이', '좋아하다', '통영', '가면', '무조건', '곳임']",Positive,0.9736443161964417
스카이라인루지 통영,경남 통영시 발개로 178,줄리의 법칙,장갑 필수입니다.오랜만에 탔는데 재밌네요. 5회도 아쉬웠어요.^^,장갑 필수입니다.오랜만에 탔는데 재밌네요. 5회도 아쉬웠어요.,"['장갑', '필수', '이다', '재밌다', '아쉽다']",Positive,0.9688291549682617
스카이라인루지 통영,경남 통영시 발개로 178,말랑홍시님,루지 재밌고 좋아요그런데 루지 교육하시는 분 중에손님 앞에 있는데 대놓고 다른 손님들 비하하시는 분계셔서 좀 그렇더라고요… 그 부분은 좀 고쳐졌으면 좋겠어요,루지 재밌고 좋아요그런데 루지 교육하시는 분 중에손님 앞에 있는데 대놓고 다른 손님들 비하하시는 분계셔서 좀 그렇더라고요 그 부분은 좀 고쳐졌으면 좋겠어요,"['루지', '재밌다', '좋다', '루지', '교육', '손님', '있다', '다른', '손님', '그렇다', '부분', '좋다']",Negative,0.8893987536430359
스카이라인루지 통영,경남 통영시 발개로 178,완소시니,통영에 아이와 가볼만한곳 스카이라인루지 통영 추천해요! 아이들이 너무 즐거워하구요~ 개인적으로 3회권 추천해요^^ 3번타니까 아이들도 만족스러워하더라구요! 다양한 코스가 있어서 재미가 있구요~ 멋진 풍경도 구경하면서 가족나들이하기 딱 좋아요!!^^ 가족들과 좋은 추억 만들수 있어서 좋았어요!!,통영에 아이와 가볼만한곳 스카이라인루지 통영 추천해요! 아이들이 너무 즐거워하구요 개인적으로 3회권 추천해요 3번타니까 아이들도 만족스러워하더라구요! 다양한 코스가 있어서 재미가 있구요 멋진 풍경도 구경하면서 가족나들이하기 딱 좋아요!! 가족들과 좋은 추억 만들수 있어서 좋았어요!!,"['통영', '아이', '스카이라인', '루지', '통영', '추천', '아이', '즐겁다', '개인', '추천', '번타', '아이', '만족스럽다', '다양하다', '코스', '있다', '재미', '있다', '멋지다', '풍경', '구경', '가족', '나들이', '좋다', '가족', '좋다', '추억', '있다', '좋다']",Positive,0.9714988470077515
스카이라인루지 통영,경남 통영시 발개로 178,양파님,아이가 좋아해요,아이가 좋아해요,"['아이', '좋아하다']",Positive,0.9362894892692566
스카이라인루지 통영,경남 통영시 발개로 178,hyeyam50,재미있었습니당 ^^사람도 없고 신나게 타다왔네용,재미있었습니당 사람도 없고 신나게 타다왔네용,"['재미있다', '사람', '없다', '신나다']",Positive,0.971756100654602
스카이라인루지 통영,경남 통영시 발개로 178,navyclub,넘 재밌어요! 추울땐 장갑 필수,넘 재밌어요! 추울땐 장갑 필수,"['재밌다', '장갑', '필수']",Positive,0.9726006984710693
스카이라인루지 통영,경남 통영시 발개로 178,푸른하늘1004,비오는 날에 탔는데 대기 줄이 없어서 바로바로 탈 수 있어 좋았어요,비오는 날에 탔는데 대기 줄이 없어서 바로바로 탈 수 있어 좋았어요,"['대기', '없다', '있다', '좋다']",Positive,0.9727650284767151
스카이라인루지 통영,경남 통영시 발개로 178,현이3282,코스도 다양하고 재미있게 잘 놀다 왔어요3회권이면 충분할 줄 알았는데 너무 재미있어서 아쉽더라구요. 장갑을 판매하기도 하지만 아이 사이즈는 없어서 챙겨가는게 좋아요,코스도 다양하고 재미있게 잘 놀다 왔어요3회권이면 충분할 줄 알았는데 너무 재미있어서 아쉽더라구요. 장갑을 판매하기도 하지만 아이 사이즈는 없어서 챙겨가는게 좋아요,"['코스', '다양하다', '재미있다', '충분하다', '재미있다', '아쉽다', '장갑', '판매', '아이', '사이즈', '없다', '좋다']",Positive,0.9709244966506958
스카이라인루지 통영,경남 통영시 발개로 178,차몽,평일오전이라 사람도 없고 신나게 친구들과 달렸어요. 재밌네요,평일오전이라 사람도 없고 신나게 친구들과 달렸어요. 재밌네요,"['평일', '오전', '사람', '없다', '신나다', '친구', '재밌다']",Positive,0.9711726903915405
스카이라인루지 통영,경남 통영시 발개로 178,old0801,"진짜 너무너무너무 재밋었어요,,,100번도 더 타고 싶음,,,,,통영 여행오면 필수코스!!!!!!!!","진짜 너무너무너무 재밋었어요,,,100번도 더 타고 싶음,,,,,통영 여행오면 필수코스!!!!!!!!","['진짜', '재밋었어', '타고', '통영', '여행', '필수', '코스']",Positive,0.9738587737083435
스카이라인루지 통영,경남 통영시 발개로 178,월계동알파카,"눈치게임 성공해서 쉬지않고 잘 탔어요!날씨도 좋아서 더 즐거웠고, 추운 날에 탄다면 장갑 미리 준비해가는게 좋아요!너무 재밌어서 사진도 하나 뽑아왔습니다또 가고싶어요!","눈치게임 성공해서 쉬지않고 잘 탔어요!날씨도 좋아서 더 즐거웠고, 추운 날에 탄다면 장갑 미리 준비해가는게 좋아요!너무 재밌어서 사진도 하나 뽑아왔습니다또 가고싶어요!","['눈치', '게임', '성공하다', '날씨', '좋다', '즐겁다', '장갑', '미리', '준비', '좋다', '재밌다', '사진', '하나']",Positive,0.9707483053207397
스카이라인루지 통영,경남 통영시 발개로 178,쵸쵸70,운행중에는 영상을 찍을 수 없어 즐거움이 담기지못했지만아이들이랑 함께 탈 수 있어서 더 좋았어요!우리 꼬맹이들 기억에도 강하게 남아서또 타고싶다고 노래를 부르네용,운행중에는 영상을 찍을 수 없어 즐거움이 담기지못했지만아이들이랑 함께 탈 수 있어서 더 좋았어요!우리 꼬맹이들 기억에도 강하게 남아서또 타고싶다고 노래를 부르네용,"['운행', '영상', '없다', '즐거움', '아이', '있다', '좋다', '우리', '꼬맹이', '기억', '강하다', '남아', '노래']",Positive,0.9712342023849487
스카이라인루지 통영,경남 통영시 발개로 178,kyu****,신나요  재밌게 잘탔어요,신나요 재밌게 잘탔어요,"['신나요', '재밌다']",Positive,0.9737542867660522
스카이라인루지 통영,경남 통영시 발개로 178,dldmd,"2박3일 여행에 7살 아기가 루지가 제일 기억에남는데요 ㅋㅋ 8살되어서 또 가기로했습니다.7살이면 보호자와 타야하는줄 알았는데, 키가 120넘으면 같이타기 힘든가봐요. 혼자 탔는데 금방 적응하고 잘 놀았습니다. 사진구매하면 영상편집본이랑 같이 주네요 됴아용","2박3일 여행에 7살 아기가 루지가 제일 기억에남는데요 ㅋㅋ 8살되어서 또 가기로했습니다.7살이면 보호자와 타야하는줄 알았는데, 키가 120넘으면 같이타기 힘든가봐요. 혼자 탔는데 금방 적응하고 잘 놀았습니다. 사진구매하면 영상편집본이랑 같이 주네요 됴아용","['여행', '아기', '루지', '제일', '기억', '가기', '살이', '보호자', '같다', '이타기', '힘드다', '혼자', '금방', '적응하다', '사진', '구매', '영상편집', '주네', '됴아용']",Positive,0.9709562063217163
스카이라인루지 통영,경남 통영시 발개로 178,유돈슈깡,처음 가 봤는데 넘 재밌었어요!아이는 3번 타고도 더 타고 싶다고 했습니다ㅋㄱ,처음 가 봤는데 넘 재밌었어요!아이는 3번 타고도 더 타고 싶다고 했습니다ㅋㄱ,"['처음', '재밌다', '아이', '타고', '타고']",Positive,0.974290132522583
스카이라인루지 통영,경남 통영시 발개로 178,min****,3번 타고 나왔는데..너무 재미 있다구 또 타구싶다구하네요~~어린이날이라 사람은 많았지만  잘~놀았어요,3번 타고 나왔는데..너무 재미 있다구 또 타구싶다구하네요어린이날이라 사람은 많았지만 잘놀았어요,"['타고', '재미', '있다', '어린이날', '사람', '많다']",Positive,0.9743825197219849
스카이라인루지 통영,경남 통영시 발개로 178,새로운 도전의 나날,"연휴기간인데 매표소 직원이 1명만 있어서 발권하는데 1시간 기다리고,  헬맷쓰고 리프트 기다리고 ㅠ 기다리는데지치더라구요연휴기간은 피하는게 좋은것 같네요","연휴기간인데 매표소 직원이 1명만 있어서 발권하는데 1시간 기다리고, 헬맷쓰고 리프트 기다리고 ㅠ 기다리는데지치더라구요연휴기간은 피하는게 좋은것 같네요","['연휴', '기간', '매표소', '직원', '있다', '발권', '헬맷쓰', '리프트', '연휴', '기간', '좋다', '같다']",Negative,0.8689595460891724
스카이라인루지 통영,경남 통영시 발개로 178,마라나타얍70,후회 없는 선택~^^ 진짜 잼있음 아이들도 만족~,후회 없는 선택 진짜 잼있음 아이들도 만족,"['후회', '없다', '선택', '진짜', '아이', '만족']",Positive,0.975276529788971
스카이라인루지 통영,경남 통영시 발개로 178,오드리힙업,"루지,케이블카도 타고 사진,영상까지 얻을수 있어서 좋았어요~아아가 어린대도 재밌어해서 완전 만족햇어요","루지,케이블카도 타고 사진,영상까지 얻을수 있어서 좋았어요아아가 어린대도 재밌어해서 완전 만족햇어요","['루지', '케이블카', '타고', '사진', '영상', '있다', '좋다', '아아', '대도', '재밌다', '완전', '만족']",Positive,0.9731225371360779
스카이라인루지 통영,경남 통영시 발개로 178,링끼짱,디스크가 있는 저는 못타고 아이랑 아빠랑 탔어요너무 즐겁게 타는 모습을 보니 흐뭇하네요사진도 기념으로 챙기고 좋은거같아요,디스크가 있는 저는 못타고 아이랑 아빠랑 탔어요너무 즐겁게 타는 모습을 보니 흐뭇하네요사진도 기념으로 챙기고 좋은거같아요,"['디스크', '있다', '아이', '아빠', '즐겁다', '모습', '흐뭇하다', '사진', '기념', '좋다', '같다']",Positive,0.9662115573883057
스카이라인루지 통영,경남 통영시 발개로 178,sec****,통영루지 최소에요.액티비티 도파민!!레전드 코스가 제일 스펙타클 했습니다,통영루지 최소에요.액티비티 도파민!!레전드 코스가 제일 스펙타클 했습니다,"['통영', '루지', '최소', '티비', '도파민', '레전드', '코스', '제일', '스펙']",Positive,0.967944860458374
