store_name,address,nickname,content,cleaned_content,tokenized_words,sentiment,sentiment_score
경주월드,경북 경주시 보문로 544,우지7385,경주는 경주월드 평일오후  웨이팅없어 좋아요,경주는 경주월드 평일오후 웨이팅없어 좋아요,"['경주', '경주월드', '평일', '오후', '웨이', '없다', '좋다']",Positive,0.9547238945960999
경주월드,경북 경주시 보문로 544,또혀니이,라이브 구매해서 저렴하게 잘 다녀갑니다,라이브 구매해서 저렴하게 잘 다녀갑니다,"['라이브', '구매', '저렴하다']",Positive,0.9599403738975525
경주월드,경북 경주시 보문로 544,lilililii,사람 많을땐 웨이팅 긴편이긴 한데 그래도 넘 재밌었어요 드라켄 기대 많이 했는데 크라크가 더 무서웠던것 같네영!!ㅎㅎ,사람 많을땐 웨이팅 긴편이긴 한데 그래도 넘 재밌었어요 드라켄 기대 많이 했는데 크라크가 더 무서웠던것 같네영!!ㅎㅎ,"['사람', '많다', '웨이', '재밌다', '드라켄', '기대', '라크', '무섭다', '같다']",Positive,0.9726423025131226
경주월드,경북 경주시 보문로 544,휘바,멀어서 그렇지 너무 재미있고 너무 신나게 놀았어요 ㅠ이 나이에 5시간을 쉼없이 놀았네요 ㅠㅠㅠ,멀어서 그렇지 너무 재미있고 너무 신나게 놀았어요 ㅠ이 나이에 5시간을 쉼없이 놀았네요 ㅠㅠㅠ,"['멀다', '그렇다', '재미있다', '신나다', '나이']",Positive,0.9728662371635437
경주월드,경북 경주시 보문로 544,sweet love2,다양한 놀이기구가 있어서 잼있어요~,다양한 놀이기구가 있어서 잼있어요,"['다양하다', '놀이기구', '있다']",Positive,0.9712833166122437
경주월드,경북 경주시 보문로 544,big0604,알짜배기 놀이공원이에요 롯데월드에 뒤지지 않습니다 근데 연휴에 갔더니 사람이 너무 많았어요ㅠ,알짜배기 놀이공원이에요 롯데월드에 뒤지지 않습니다 근데 연휴에 갔더니 사람이 너무 많았어요ㅠ,"['알짜', '배기', '놀이', '공원', '롯데', '월드', '연휴', '사람', '많다']",Positive,0.9224280714988708
경주월드,경북 경주시 보문로 544,꿀유자,어린이날을 맞이하여 경주여행와서 다녀온 경주월드!서울 살아서 롯데월드를 주로 가는데요!그냥 주말 롯데월드보다 어린이날 경주월드가 웨이팅이 훨씬 적더라고요 ㅎㅎ너무 편안하고 재미있게 놀았습니다 💙다음에 또 오고 싶어요 !!,어린이날을 맞이하여 경주여행와서 다녀온 경주월드!서울 살아서 롯데월드를 주로 가는데요!그냥 주말 롯데월드보다 어린이날 경주월드가 웨이팅이 훨씬 적더라고요 ㅎㅎ너무 편안하고 재미있게 놀았습니다 다음에 또 오고 싶어요 !!,"['어린이날', '맞이', '여행', '경주월드', '서울', '롯데', '월드', '주로', '그냥', '주말', '롯데', '월드', '어린이날', '경주월드', '웨이팅', '편안하다', '재미있다', '다음']",Positive,0.9720102548599243
경주월드,경북 경주시 보문로 544,opp****,대기하는곳도 좀시원햇음좋겟어요.평알에 잘 즐겻여요,대기하는곳도 좀시원햇음좋겟어요.평알에 잘 즐겻여요,"['대기', '곳도', '시원', '햇음', '좋다', '평알', '즐겻여']",Positive,0.9748370051383972
경주월드,경북 경주시 보문로 544,꼬양48,재밌게 놀았어요... 놀이기구도 스릴 만점...,재밌게 놀았어요... 놀이기구도 스릴 만점...,"['재밌다', '놀이기구', '스릴', '만점']",Positive,0.9748537540435791
경주월드,경북 경주시 보문로 544,솔찍j,토요일 오후권으로 들어가서 너무 잘놀고 나왔어요!!!!,토요일 오후권으로 들어가서 너무 잘놀고 나왔어요!!!!,"['토요일', '오후']",Positive,0.9731172323226929
경주월드,경북 경주시 보문로 544,크리티컬33,즐겁게 잘 다녀왔습니다,즐겁게 잘 다녀왔습니다,['즐겁다'],Positive,0.9725305438041687
경주월드,경북 경주시 보문로 544,Seon  ae,오랫만에 경주월드 아아까지좋으네요평일  월요일인데두  연인들  가족들나들이  많으네요햇살은 따가운데 바람이 시원해서 좋으네요,오랫만에 경주월드 아아까지좋으네요평일 월요일인데두 연인들 가족들나들이 많으네요햇살은 따가운데 바람이 시원해서 좋으네요,"['경주월드', '아아', '좋다', '평일', '월요일', '가족', '나들이', '많다', '햇살', '따갑다', '바람', '시원하다', '좋다']",Positive,0.9721298813819885
경주월드,경북 경주시 보문로 544,ri****,월요일에 왔더니 사람도 많이 없고 타고 싶은 건 바로바로 탈 수 있었어요! 타임드라이버인가 그 관람차 타고 싶었는데 운행점검 중이네여ㅠ 그래두 넘 재밋게 놀다가여,월요일에 왔더니 사람도 많이 없고 타고 싶은 건 바로바로 탈 수 있었어요! 타임드라이버인가 그 관람차 타고 싶었는데 운행점검 중이네여ㅠ 그래두 넘 재밋게 놀다가여,"['월요일', '사람', '없다', '타고', '있다', '타임', '드라이버', '관람차', '타고', '운행', '점검', '중이', '그렇다', '재밋']",Positive,0.9695088267326355
경주월드,경북 경주시 보문로 544,운하63,사진은 남편 폰에 있어서 못 쓰고 추석 다음날 갔는데 사람들이 너무 많아서 5시간 동안 4개 탑승하고 3시간 줄 서고...나중에 기달린게 아까워서 그냥 서는데....사람 많을 줄 알았으면 안갔을거 같아요....다음번에 시간 잘 맞추고 가야겠지만 한번 안좋은 기억 있어서....너무 오랜 서서 몸살 났는데.....솔직히 우리 5시간에 나와는데 버스가 중간에 없어져서 다행히 1000번 버스 와서 집에 갈 수 있었지만....첫 경험부터 최악이라....솔직히 두번은 못 가겠네요.....우리는 차 없어서 버스 타고 이용 하는데 4시30분에 버스 끓히는거 몰라서......결국 운 좋게 1000번 시버스 탔지만.....진짜....솔직히 두번은 못 가겠네요......,사진은 남편 폰에 있어서 못 쓰고 추석 다음날 갔는데 사람들이 너무 많아서 5시간 동안 4개 탑승하고 3시간 줄 서고...나중에 기달린게 아까워서 그냥 서는데....사람 많을 줄 알았으면 안갔을거 같아요....다음번에 시간 잘 맞추고 가야겠지만 한번 안좋은 기억 있어서....너무 오랜 서서 몸살 났는데.....솔직히 우리 5시간에 나와는데 버스가 중간에 없어져서 다행히 1000번 버스 와서 집에 갈 수 있었지만....첫 경험부터 최악이라....솔직히 두번은 못 가겠네요.....우리는 차 없어서 버스 타고 이용 하는데 4시30분에 버스 끓히는거 몰라서......결국 운 좋게 1000번 시버스 탔지만.....진짜....솔직히 두번은 못 가겠네요......,"['사진', '남편', '있다', '추석', '다음', '사람', '많다', '동안', '탑승', '서고', '나중', '아깝다', '그냥', '사람', '많다', '같다', '다음', '시간', '한번', '안좋다', '기억', '있다', '서서', '몸살', '솔직하다', '우리', '버스', '중간', '다행하다', '버스', '있다', '경험', '최악', '솔직하다', '번은', '우리', '없다', '버스', '타고', '이용', '버스', '좋다', '버스', '진짜', '솔직하다', '번은']",Negative,0.8613250255584717
경주월드,경북 경주시 보문로 544,또니빈,"오랜만에 간 놀이동산에서 정말 뽕뽑고 왔습니다,, 너무 재밌게 잘 놀다왔어요!!! 스릴 넘치는 놀이기구들도 많고, 곳곳에 간식코너들이 많아서 좋았어요!! 주말 방문이라 대기는 어쩔수 없었지만 긴 대기줄을 잊게 만드는 놀이기구덕분에 잘 놀다 갑니다~","오랜만에 간 놀이동산에서 정말 뽕뽑고 왔습니다,, 너무 재밌게 잘 놀다왔어요!!! 스릴 넘치는 놀이기구들도 많고, 곳곳에 간식코너들이 많아서 좋았어요!! 주말 방문이라 대기는 어쩔수 없었지만 긴 대기줄을 잊게 만드는 놀이기구덕분에 잘 놀다 갑니다","['놀이동산', '정말', '재밌다', '스릴', '넘치다', '놀이기구', '많다', '곳곳', '간식', '코너', '많다', '좋다', '주말', '방문', '대기', '없다', '놀이기구', '덕분']",Positive,0.9731149673461914
경주월드,경북 경주시 보문로 544,먹깨비 한소진,시간이 오후권이 맞아서 오후로 예약 후 갔는데 너무 즐거웠어요. 아이들이 아직 어려서 줄이 긴 놀이기구를 탈일이 없어서 대기없이 거의 바로바로 탔어요 👍다음에는 눈썰매도 타러 가기로 했어요 ~~~,시간이 오후권이 맞아서 오후로 예약 후 갔는데 너무 즐거웠어요. 아이들이 아직 어려서 줄이 긴 놀이기구를 탈일이 없어서 대기없이 거의 바로바로 탔어요 다음에는 눈썰매도 타러 가기로 했어요,"['시간', '오후', '오후', '예약', '즐겁다', '아이', '놀이기구', '일이', '없다', '대기', '거의', '다음', '눈썰매', '가기']",Positive,0.9732252359390259
경주월드,경북 경주시 보문로 544,lik****,스릴넘치고. 너무. 재밌었다고 극찬한 아이들이었답니다,스릴넘치고. 너무. 재밌었다고 극찬한 아이들이었답니다,"['스릴', '재밌다', '극찬', '아이']",Positive,0.9705137014389038
경주월드,경북 경주시 보문로 544,skd****,아이랑 가기도 좋고 기구도 많아서 휴일에 가도좋아요 먹거리도 많고 너무 행복한 휴일 이였습니다!!!👍,아이랑 가기도 좋고 기구도 많아서 휴일에 가도좋아요 먹거리도 많고 너무 행복한 휴일 이였습니다!!!,"['아이', '가기', '좋다', '기구', '많다', '휴일', '가도', '좋다', '먹거리', '많다', '행복하다', '휴일']",Positive,0.9737970232963562
경주월드,경북 경주시 보문로 544,힐링하다,작년에는 롯데월드 연간회원권올해는 경주월드 연간회원권 끊었어요! 각 놀이공원마다 장단점이 있는데 경주월드는 놀이기구가 다양해요 그리고 지속적으로 놀이기구를 잘 관리하고 투자하는게 보여요! 이번방문때 서커스 공연도봤는데 너무 재밌더라구요^^ 올해는 경주월드와 함께할께요!,작년에는 롯데월드 연간회원권올해는 경주월드 연간회원권 끊었어요! 각 놀이공원마다 장단점이 있는데 경주월드는 놀이기구가 다양해요 그리고 지속적으로 놀이기구를 잘 관리하고 투자하는게 보여요! 이번방문때 서커스 공연도봤는데 너무 재밌더라구요 올해는 경주월드와 함께할께요!,"['작년', '롯데', '월드', '연간', '회원', '올해', '경주월드', '연간', '회원', '놀이', '공원', '장단점', '있다', '경주월드', '놀이기구', '다양하다', '지속', '놀이기구', '관리', '투자', '이번', '방문', '서커스', '공연', '재밌다', '올해', '경주월드']",Positive,0.9703589081764221
경주월드,경북 경주시 보문로 544,동영201,너무너무 즐거웠어용,너무너무 즐거웠어용,['즐겁다'],Positive,0.9730388522148132
경주월드,경북 경주시 보문로 544,alska2340,좋아요…조아욬ㅋㅋ조아요…조아요,좋아요조아욬ㅋㅋ조아요조아요,"['좋다', '요조']",Positive,0.9728745818138123
경주월드,경북 경주시 보문로 544,뚜비두밥56,사진찍을곳도 많고롯데월드 나 에버랜드 처럼 규모가크진않지만놀이기구 자체의 퀄리티는 괜찮습니다 추천드립니다.,사진찍을곳도 많고롯데월드 나 에버랜드 처럼 규모가크진않지만놀이기구 자체의 퀄리티는 괜찮습니다 추천드립니다.,"['사진', '곳도', '많다', '롯데', '월드', '에버랜드', '처럼', '규모', '놀이기구', '자체', '퀄리티', '괜찮다', '추천']",Positive,0.9569551944732666
경주월드,경북 경주시 보문로 544,날아라맨발,아이들이 즐겁게 놀수있는곳 입니다,아이들이 즐겁게 놀수있는곳 입니다,"['아이', '즐겁다', '놀수', '있다', '이다']",Positive,0.9506868720054626
경주월드,경북 경주시 보문로 544,우끼끼487,너무 재밌고 알차게 보냈습니다 우리나라 중 최고입니다,너무 재밌고 알차게 보냈습니다 우리나라 중 최고입니다,"['재밌다', '알차다', '우리나라', '최고', '이다']",Positive,0.971653938293457
경주월드,경북 경주시 보문로 544,kikucent,드라켄은 한번밖에 못탔지만 더할나위없고-매직 라이드가 너무 재밌어서 두번탔어요^^ 모양도 귀엽고 라이트형제생각나고 시원하고 - 담엔 꼭 오픈런해서 드라켄 3번타고 싱글라이더도 3번타고싶어요.,드라켄은 한번밖에 못탔지만 더할나위없고매직 라이드가 너무 재밌어서 두번탔어요 모양도 귀엽고 라이트형제생각나고 시원하고 담엔 꼭 오픈런해서 드라켄 3번타고 싱글라이더도 3번타고싶어요.,"['드라켄', '한번', '더하다', '나위', '없다', '매직', '라이드', '재밌다', '모양', '귀엽다', '라이트형제', '시원하다', '오픈', '드라켄', '타고', '싱글', '라이더']",Positive,0.972863495349884
경주월드,경북 경주시 보문로 544,얼도,경주월드 쵝오 ㅋ곳곳마다 쓰레기통 배치되어 있는 것도 너무 마음에 듦!! 경주라 밖으로 나가면 다 관광지에 한국색도 강하고 앞으로 일본을 잇는 세계적인 스릴러 놀이공원으로 승승장구 하기를~~!,경주월드 쵝오 ㅋ곳곳마다 쓰레기통 배치되어 있는 것도 너무 마음에 듦!! 경주라 밖으로 나가면 다 관광지에 한국색도 강하고 앞으로 일본을 잇는 세계적인 스릴러 놀이공원으로 승승장구 하기를!,"['경주월드', '쵝오', '곳곳', '쓰레기통', '배치', '있다', '마음', '경주', '관광지', '한국', '색도', '강하다', '일본', '세계', '스릴러', '놀이', '공원', '승승장구']",Positive,0.9740997552871704
경주월드,경북 경주시 보문로 544,ss7****,교복입고 놀았는데 넘 재밌게 놀았어용 :),교복입고 놀았는데 넘 재밌게 놀았어용,"['교복', '재밌다']",Positive,0.9736180305480957
경주월드,경북 경주시 보문로 544,airproducts,역시 스릴 원탑 경주월드 짱,역시 스릴 원탑 경주월드 짱,"['역시', '스릴', '경주월드']",Positive,0.9595746994018555
경주월드,경북 경주시 보문로 544,앎6730,10개정도 탔는데 도파민터짐.너무재밌었어요,10개정도 탔는데 도파민터짐.너무재밌었어요,"['개정', '도파민', '재밌다']",Positive,0.9753879904747009
경주월드,경북 경주시 보문로 544,뽀야3218,대기도 짧고 원하는 기구는 거의 다 타고 왔어요!,대기도 짧고 원하는 기구는 거의 다 타고 왔어요!,"['대기', '짧다', '원하다', '기구', '거의', '타고']",Positive,0.9587255716323853
경주월드,경북 경주시 보문로 544,lsh****,너무 재밌어요😀,너무 재밌어요,['재밌다'],Positive,0.9729701280593872
경주월드,경북 경주시 보문로 544,진블리6,해마다 한두번은 꼭 오는 경주월드!!새로운거 타러 방문해써용 너무너무더웠지만 재밌게 잘놀고갑니다♡,해마다 한두번은 꼭 오는 경주월드!!새로운거 타러 방문해써용 너무너무더웠지만 재밌게 잘놀고갑니다,"['번은', '경주월드', '새롭다', '방문', '무덥다', '재밌다']",Positive,0.9742484092712402
경주월드,경북 경주시 보문로 544,sm****,놀이기구가 장난아니예요,놀이기구가 장난아니예요,"['놀이기구', '장난', '아니다']",Negative,0.689719557762146
경주월드,경북 경주시 보문로 544,하이soso,웨이브캐년 짱잼이예요아이랑 가기 좋아요,웨이브캐년 짱잼이예요아이랑 가기 좋아요,"['웨이브', '캐년', '아이', '가기', '좋다']",Positive,0.9744575619697571
경주월드,경북 경주시 보문로 544,세현1360,십몇년만에 가본 경주월드 재밌는 게 많아지고 사람이 많아요 ㅎㅎ...,십몇년만에 가본 경주월드 재밌는 게 많아지고 사람이 많아요 ㅎㅎ...,"['경주월드', '재밌다', '사람', '많다']",Positive,0.9737638235092163
경주월드,경북 경주시 보문로 544,jekattun3022,아이가 이제 키가 어느정도커서 경주월드 아이랑 함께 처음와봤늨데 아이가 너무 좋아해요 !!,아이가 이제 키가 어느정도커서 경주월드 아이랑 함께 처음와봤늨데 아이가 너무 좋아해요 !!,"['아이', '이제', '정도', '커서', '경주월드', '아이', '처음', '늨데', '아이', '좋아하다']",Positive,0.9718185067176819
경주월드,경북 경주시 보문로 544,정원0,"인생 첫 경주월드,,,! 이름이 세 글자인 놀이기구가 유명하다고 하더라고요? 평일이라 그런지 인기 어트랙션도 쾌적하게 이용했어요. 대기 없이 바로 이용한 것도 있었고, 드라켄은 30분 정도밖에 기다리지 않았습니다. (연속 세 번 탄 게 자랑) 어트랙션들이 가까이 모여 있어 합리적이고 효율적으로 이용할 수 있었어요. 40주년 축하드립니다!","인생 첫 경주월드,,,! 이름이 세 글자인 놀이기구가 유명하다고 하더라고요? 평일이라 그런지 인기 어트랙션도 쾌적하게 이용했어요. 대기 없이 바로 이용한 것도 있었고, 드라켄은 30분 정도밖에 기다리지 않았습니다. 연속 세 번 탄 게 자랑 어트랙션들이 가까이 모여 있어 합리적이고 효율적으로 이용할 수 있었어요. 40주년 축하드립니다!","['인생', '경주월드', '이름', '글자', '놀이기구', '유명하다', '평일', '그렇다', '인기', '어트랙션', '쾌적하다', '이용', '대기', '바로', '이용', '있다', '드라켄', '정도', '연속', '자랑', '트랙', '가까이', '있다', '합리', '효율', '이용', '있다', '주년', '축하']",Positive,0.9718594551086426
경주월드,경북 경주시 보문로 544,매일 아침,"날이 더워서 두어시간 놀게 될 줄 알았는데 아이들이 아이스크림과 빙수를 먹어가면서 5시간 남짓 놀이기구를 15번 이상 타면서 신나게 놀았습니다. 서울 경기권에 있는 놀이 동산에 비해서 대기시간이 짧고, 저렴한데도 다양한 탈거리와 먹거리, 볼거리가 있어서 좋습니다. 직원분들이 너무너무 친절하세요. 3,4 주차장은 무료로 이용가능하고 1,2  주차장은 카카오 T앱이나 키오스크로 결제하면 할인 받으실 수 있습니다. 저희처럼 출구에서 결제하시면 1일 5,000원 부담하셔야 합니다^^;","날이 더워서 두어시간 놀게 될 줄 알았는데 아이들이 아이스크림과 빙수를 먹어가면서 5시간 남짓 놀이기구를 15번 이상 타면서 신나게 놀았습니다. 서울 경기권에 있는 놀이 동산에 비해서 대기시간이 짧고, 저렴한데도 다양한 탈거리와 먹거리, 볼거리가 있어서 좋습니다. 직원분들이 너무너무 친절하세요. 3,4 주차장은 무료로 이용가능하고 1,2 주차장은 카카오 T앱이나 키오스크로 결제하면 할인 받으실 수 있습니다. 저희처럼 출구에서 결제하시면 1일 5,000원 부담하셔야 합니다","['덥다', '시간', '아이', '아이스크림', '빙수', '남짓', '놀이기구', '이상', '신나다', '서울', '경기', '있다', '놀이', '동산', '시간', '짧다', '저렴하다', '다양하다', '거리', '먹거리', '볼거리', '있다', '좋다', '직원', '친절하다', '주차장', '무료', '이용', '가능하다', '주차장', '카카오', '오스', '결제', '할인', '있다', '저희', '출구', '결제', '부담']",Positive,0.9558162689208984
경주월드,경북 경주시 보문로 544,권오건76,처음으로 경주월드 가봤는대 정말 재미있었습니다.,처음으로 경주월드 가봤는대 정말 재미있었습니다.,"['처음', '경주월드', '정말', '재미있다']",Positive,0.9731974601745605
경주월드,경북 경주시 보문로 544,스트라임65,와보고 싶었는데 잘 놀고 갑니다.,와보고 싶었는데 잘 놀고 갑니다.,['보고'],Positive,0.9621784090995789
경주월드,경북 경주시 보문로 544,nado11,스릴있는 놀이기구가 많아서 너무 좋았어요!다음에 또 와서 더 많이 타고싶어요,스릴있는 놀이기구가 많아서 너무 좋았어요!다음에 또 와서 더 많이 타고싶어요,"['스릴', '있다', '놀이기구', '많다', '좋다', '다음']",Positive,0.9751323461532593
경주월드,경북 경주시 보문로 544,깨롱81,경주월드는 재밌지만 드라켄밸리쪽 브라더 도시락 절대 가지마세요 비싼데 맛없고 다른 지점 메뉴랑 달라요 제육제육 시켰는데 상추랑 쌈장 안 나오고 구성 반찬 다 달라요 제육은 뭉쳐진 고기에 달기만 하고 김치는 자르다 말았네요 흑미밥도 아닌 그냥 쌀밥인데 오래된 밥 데운 느낌이에요 오픈하자마자 갔는데 돈까스는 진짜 튀김이 반이상이라 걍 다 버림 물은 1500원인데 물이 제일 맛있어요 상추 안 주냐고 물어보니 원래 그렇다네요 브라더도시락 가맹점 관리 안되니까 절대 절대 가지마세요 일행도 맛없었대요 제육 말고 다른 것도 다 그냥 냉동 냉장 해놓은거 데워주는거예요 제발 가지마세요 돈 아끼세요 근래 먹은 것 중에 최악,경주월드는 재밌지만 드라켄밸리쪽 브라더 도시락 절대 가지마세요 비싼데 맛없고 다른 지점 메뉴랑 달라요 제육제육 시켰는데 상추랑 쌈장 안 나오고 구성 반찬 다 달라요 제육은 뭉쳐진 고기에 달기만 하고 김치는 자르다 말았네요 흑미밥도 아닌 그냥 쌀밥인데 오래된 밥 데운 느낌이에요 오픈하자마자 갔는데 돈까스는 진짜 튀김이 반이상이라 걍 다 버림 물은 1500원인데 물이 제일 맛있어요 상추 안 주냐고 물어보니 원래 그렇다네요 브라더도시락 가맹점 관리 안되니까 절대 절대 가지마세요 일행도 맛없었대요 제육 말고 다른 것도 다 그냥 냉동 냉장 해놓은거 데워주는거예요 제발 가지마세요 돈 아끼세요 근래 먹은 것 중에 최악,"['경주월드', '재밌다', '밸리', '브라더', '도시락', '절대', '가지', '비싸다', '맛없다', '다른', '지점', '메뉴', '달라', '제육', '상추', '쌈장', '구성', '반찬', '달라', '제육', '고기', '달기', '김치', '밉다', '아니다', '그냥', '쌀밥', '오래되다', '느낌', '오픈', '자마자', '돈까스', '진짜', '튀김', '이상', '물이', '제일', '맛있다', '상추', '원래', '그렇다', '브라더', '도시락', '가맹', '관리', '안되다', '절대', '절대', '가지', '일행', '맛없다', '대요', '제육', '다른', '그냥', '냉동', '냉장', '제발', '가지', '근래', '최악']",Negative,0.9118934273719788
경주월드,경북 경주시 보문로 544,LU3391,평일에 가서 기구들 비교적 대기시간짧게 이용가능해서 좋았어요,평일에 가서 기구들 비교적 대기시간짧게 이용가능해서 좋았어요,"['평일', '기구', '비교', '시간', '짧다', '이용', '가능하다', '좋다']",Positive,0.9641314744949341
경주월드,경북 경주시 보문로 544,Hyozdays,네이버 라이브때 싸게 구매해서 친구들과 잘 놀고 왔습니다. 벚꽃도 피고 날도 좋아서 예쁜 사진 많이 남겼어요. 무서운 놀이기구가 많아서 많이 타지는 못 했지만 강심장분들은 좋아할 것 같아요. 옛날에는 드라켄 두 번 연속 탔는데 이젠 못 타겠더라구요.. 빙글빙글 도는 컵 놀이기구에 친구들이 끌고 가서 탔다가 대낮에 별이 보였습니다.,네이버 라이브때 싸게 구매해서 친구들과 잘 놀고 왔습니다. 벚꽃도 피고 날도 좋아서 예쁜 사진 많이 남겼어요. 무서운 놀이기구가 많아서 많이 타지는 못 했지만 강심장분들은 좋아할 것 같아요. 옛날에는 드라켄 두 번 연속 탔는데 이젠 못 타겠더라구요.. 빙글빙글 도는 컵 놀이기구에 친구들이 끌고 가서 탔다가 대낮에 별이 보였습니다.,"['네이버', '라이브', '구매', '친구', '벚꽃', '피고', '좋다', '예쁘다', '사진', '무섭다', '놀이기구', '많다', '타지', '강심장', '좋아하다', '같다', '옛날', '드라켄', '연속', '놀이기구', '친구', '대낮']",Positive,0.9589384198188782
경주월드,경북 경주시 보문로 544,건방진치킨,무섭고 재밌어요~ 40년이나됐다니 놀랍네여,무섭고 재밌어요 40년이나됐다니 놀랍네여,"['무섭다', '재밌다']",Positive,0.9730413556098938
