store_name,address,nickname,content,cleaned_content,tokenized_words,sentiment,sentiment_score
국립현대미술관 서울,서울 종로구 삼청로 30,4 8 8 5,"론 뮤익을 비롯해 한국현대미술 하이라이트, 기울인 몸들, 열린공간7을 보고 왔어요한국현대미술부터 봤는데 유명한 작가분들 작품도 있긴하지만 대체로 좀 난해했구욥넘 간단하고 추상적인게 많아 현대미술쪽이긴 하구나 느꼈네용그 다음으론 기울인 몸들을 봤는데 요건 장애인분들도 잘 볼 수 있게 해놓았었어요이어서 뮤익이형님꺼로 갔는데 사람이 엄청 많아요 ㄷ굉장히 사실적인 묘사도 인상깊었는데 엄청 큰 해골바가지가 멋있었어요공간도 큰데 해골도 진짜 엄청 커요💀여기랑 맨 첫번째 얼굴큰거에 사람 다 몰렸어요😵마지막으로 열린공간7은 단순히 보기만하는게 아닌 참여형으로 여러가지 있었어요지하 1층 공간에선 뭔가 설치되고 있어서 오늘은 앉을 자리가 많지 않았지만 문화가 있는 날을 맞아 무료로 넘 잘 보고 가요🙇‍♂️","론 뮤익을 비롯해 한국현대미술 하이라이트, 기울인 몸들, 열린공간7을 보고 왔어요한국현대미술부터 봤는데 유명한 작가분들 작품도 있긴하지만 대체로 좀 난해했구욥넘 간단하고 추상적인게 많아 현대미술쪽이긴 하구나 느꼈네용그 다음으론 기울인 몸들을 봤는데 요건 장애인분들도 잘 볼 수 있게 해놓았었어요이어서 뮤익이형님꺼로 갔는데 사람이 엄청 많아요 ㄷ굉장히 사실적인 묘사도 인상깊었는데 엄청 큰 해골바가지가 멋있었어요공간도 큰데 해골도 진짜 엄청 커요여기랑 맨 첫번째 얼굴큰거에 사람 다 몰렸어요마지막으로 열린공간7은 단순히 보기만하는게 아닌 참여형으로 여러가지 있었어요지하 1층 공간에선 뭔가 설치되고 있어서 오늘은 앉을 자리가 많지 않았지만 문화가 있는 날을 맞아 무료로 넘 잘 보고 가요","['뮤익', '비롯', '한국', '현대', '미술', '하이라이트', '공간', '보고', '국현', '미술', '유명하다', '작가', '작품', '있다', '대체로', '난해하다', '간단하다', '추상', '많다', '미술', '다음', '요건', '장애인', '있다', '어요', '뮤익', '형님', '사람', '많다', '굉장하다', '사실', '묘사', '인상', '깊다', '해골', '바가지', '멋있다', '공간', '해골', '진짜', '여기', '얼굴', '사람', '마지막', '공간', '단순하다', '보기', '아니다', '참여', '여러가지', '있다', '지하', '공간', '뭔가', '설치', '있다', '오늘', '자리', '많다', '문화', '있다', '무료', '보고', '가요']",Positive,0.9627679586410522
국립현대미술관 서울,서울 종로구 삼청로 30,꼬맹이1273,한국현대미술 하이라이트라는 전시 제목에 걸맞는 교과서적인 전시였음. 관광 온 외국인들에게 한국 미술을 소개하는 느낌. 추천하자면 과천 현대미술관의 근현대미술전시가 작품 수도 많고 큐레이션도 더 훌륭함.,한국현대미술 하이라이트라는 전시 제목에 걸맞는 교과서적인 전시였음. 관광 온 외국인들에게 한국 미술을 소개하는 느낌. 추천하자면 과천 현대미술관의 근현대미술전시가 작품 수도 많고 큐레이션도 더 훌륭함.,"['한국', '현대', '미술', '하이라이트', '전시', '제목', '교과서', '전시', '관광', '외국인', '한국', '미술', '소개', '느낌', '추천', '과천', '미술관', '미술', '전시', '작품', '수도', '많다', '레이', '훌륭하다']",Positive,0.9599592685699463
국립현대미술관 서울,서울 종로구 삼청로 30,stellia,마지막주 수요일 '문화의 날'이여서 모든관 무료 입장즐거운 관람하고 왔어요~,마지막주 수요일 문화의 날이여서 모든관 무료 입장즐거운 관람하고 왔어요,"['마지막', '수요일', '문화', '무료', '입장', '즐겁다', '관람']",Positive,0.9666622281074524
국립현대미술관 서울,서울 종로구 삼청로 30,비도그,"우리나라 최고의 예술작품들을 소장하고 전시하는 곳🌟. 문화 향수의 공간이자 휴식처. 여기 자주 안 올 이유가 없음. 특히 지금은 2013년 국립현대미술관 서울관 개관 이래 처음으로 선보이는 상설전 '한국현대미술 하이라이트'전이 진행 중임.✨️이 전시는 미술관 소장품 중 1960년대~2010년대 한국 현대미술 대표작 90여 점을 선보임. 김환기, 이우환, 강익중 등의 귀한 작품들을 가까이에서 봄. 입장료 거의 헐값!✨️경복궁 바로 동쪽, 삼청동 바로 아래, 이보다 산책하기 더 좋은 곳 없음. 짧은 점심시간 때문에 과장님을👠 모시고 올 기회가 없었음. 직장상사 모시고♡ 혹은 친구와♡ 연인과♡ 가족과♡ 문화나들이 추천🪄","우리나라 최고의 예술작품들을 소장하고 전시하는 곳. 문화 향수의 공간이자 휴식처. 여기 자주 안 올 이유가 없음. 특히 지금은 2013년 국립현대미술관 서울관 개관 이래 처음으로 선보이는 상설전 한국현대미술 하이라이트전이 진행 중임.이 전시는 미술관 소장품 중 1960년대2010년대 한국 현대미술 대표작 90여 점을 선보임. 김환기, 이우환, 강익중 등의 귀한 작품들을 가까이에서 봄. 입장료 거의 헐값!경복궁 바로 동쪽, 삼청동 바로 아래, 이보다 산책하기 더 좋은 곳 없음. 짧은 점심시간 때문에 과장님을 모시고 올 기회가 없었음. 직장상사 모시고 혹은 친구와 연인과 가족과 문화나들이 추천","['우리나라', '최고', '예술', '작품', '소장', '전시', '문화', '향수', '공간', '이자', '휴식', '여기', '자주', '이유', '없다', '지금', '국립', '현대', '미술관', '서울', '개관', '이렇다', '처음', '설전', '한국', '현대', '미술', '하이라이트', '전이', '진행', '중임', '전시', '미술관', '소장품', '한국', '현대', '미술', '대표', '김환기', '이우환', '강익중', '귀하다', '작품', '가까이', '입장료', '거의', '헐값', '경복궁', '바로', '동쪽', '삼청동', '바로', '아래', '이보', '산책', '좋다', '없다', '짧다', '점심시간', '때문', '과장', '모시', '기회', '없다', '직장', '상사', '모시', '친구', '연인', '가족', '문화', '나들이', '추천']",Positive,0.9601787328720093
국립현대미술관 서울,서울 종로구 삼청로 30,smartswarm,"과천 국립현대미술관  리뷰내용이다과천 국립현대미술관 영수증 문제로주소지 사업자 “국립현대미술관 서울” 에서 리뷰 작성 가능해졌다국립현대미술관(서울) 리뷰 작성을 할수 있어국립현대미술관(과천) 소개하고싶어서 작성한다과천 국립현대미술관은 전시장 문을 넘기 전부터 볼거리가 많다. 미술관 입구 잔디밭의 ‘노래하는 사람’은 정해진 시간에 입을 크게 벌려 노래를 한다. 지나는 이들에게 환영 인사를 건네듯 노래를 부르고, 아이들은 그 노래에 맞춰 뛰어논다. 야외 조각 정원과 미술관 건물로 들어가는 길 곳곳에도 여러 작품이 있는데, 자연을 배경 삼아 세워져 있어서 같은 작품이라도 계절별, 날씨별로 조금씩 다르게 느껴지는 특징이있다","과천 국립현대미술관 리뷰내용이다과천 국립현대미술관 영수증 문제로주소지 사업자 국립현대미술관 서울 에서 리뷰 작성 가능해졌다국립현대미술관서울 리뷰 작성을 할수 있어국립현대미술관과천 소개하고싶어서 작성한다과천 국립현대미술관은 전시장 문을 넘기 전부터 볼거리가 많다. 미술관 입구 잔디밭의 노래하는 사람은 정해진 시간에 입을 크게 벌려 노래를 한다. 지나는 이들에게 환영 인사를 건네듯 노래를 부르고, 아이들은 그 노래에 맞춰 뛰어논다. 야외 조각 정원과 미술관 건물로 들어가는 길 곳곳에도 여러 작품이 있는데, 자연을 배경 삼아 세워져 있어서 같은 작품이라도 계절별, 날씨별로 조금씩 다르게 느껴지는 특징이있다","['과천', '국립', '현대', '미술관', '리뷰', '내용', '과천', '국립', '현대', '미술관', '영수증', '문제', '주소지', '사업자', '국립', '현대', '미술관', '서울', '리뷰', '작성', '가능하다', '국립', '현대', '미술관', '서울', '리뷰', '작성', '있다', '국립', '미술관', '과천', '소개', '다과', '국립', '미술관', '전시장', '볼거리', '많다', '미술관', '입구', '잔디밭', '노래', '사람', '정해진', '시간', '크게', '노래', '환영', '인사', '노래', '아이', '노래', '야외', '조각', '정원', '미술관', '건물', '곳곳', '여러', '작품', '있다', '자연', '배경', '있다', '같다', '작품', '계절', '날씨', '별로', '다르다', '특징', '있다']",Positive,0.7071542143821716
국립현대미술관 서울,서울 종로구 삼청로 30,Moment Catcher,초기부터 후기작까지 관람하기 너무 좋았습니다~~~^^관람을 마치고 도록을 볼 수 있도록 층계좌석을 만들어 놓은 것도 👍,초기부터 후기작까지 관람하기 너무 좋았습니다관람을 마치고 도록을 볼 수 있도록 층계좌석을 만들어 놓은 것도,"['초기', '후기', '관람', '좋다', '관람', '마치', '도록', '있다', '층계', '좌석']",Positive,0.9708897471427917
국립현대미술관 서울,서울 종로구 삼청로 30,clairmari,김창열전 보러왔다가 👀현대 상설전도 궁금해서 같이 전시관람👀대작들을 한곳에서 볼 수 있는 전시!👍🏻,김창열전 보러왔다가 현대 상설전도 궁금해서 같이 전시관람대작들을 한곳에서 볼 수 있는 전시!,"['김창열', '현대', '설전', '궁금하다', '관람', '대작', '있다', '전시']",Positive,0.9141396284103394
국립현대미술관 서울,서울 종로구 삼청로 30,하르방스,서울 종로 가볼만한 곳이예요. 국립 미술관답게 전시 퀄리티가 상당히 좋습니다. 볼거리가 많아요. 관람료가 아깝지 않았습니다. 추천해요.,서울 종로 가볼만한 곳이예요. 국립 미술관답게 전시 퀄리티가 상당히 좋습니다. 볼거리가 많아요. 관람료가 아깝지 않았습니다. 추천해요.,"['서울', '종로', '국립', '미술관', '전시', '퀄리티', '상당하다', '좋다', '볼거리', '많다', '관람', '아깝다', '추천']",Positive,0.9740314483642578
국립현대미술관 서울,서울 종로구 삼청로 30,염둥이11,전체관람으로 봤는데 너무 좋았어요 힐링,전체관람으로 봤는데 너무 좋았어요 힐링,"['전체', '관람', '좋다', '힐링']",Positive,0.975098192691803
국립현대미술관 서울,서울 종로구 삼청로 30,꼬맹이1273,"(과천국립현대미술관)아름다운 정원도 있고 멋진 작품들을 여유롭게 감상할 수 있는 곳. 상설 전시가 유료로 전환되었고 3000원으로 모든 전시를 볼 수 있게 바뀜. 이번 한국근현대미술전시는 기대 이상으로 작품 수도 많았고 김환기나 윤형근, 오지호 등의 작가의 공간을 따로 기획한 것이 좋았음. 큐레이션이 돋보임. 지난 이건희 컬렉션 때부터 큐레이션 스타일이 고급스럽게 변했음. 북적대고 소문난  전시는 인스타쟁이들이 가지만 여긴 진짜가 오는 곳이라 혼자 조용히 감상하는 사람들이 많음. 주차료는 입장권으로 할인이 안됨.","과천국립현대미술관아름다운 정원도 있고 멋진 작품들을 여유롭게 감상할 수 있는 곳. 상설 전시가 유료로 전환되었고 3000원으로 모든 전시를 볼 수 있게 바뀜. 이번 한국근현대미술전시는 기대 이상으로 작품 수도 많았고 김환기나 윤형근, 오지호 등의 작가의 공간을 따로 기획한 것이 좋았음. 큐레이션이 돋보임. 지난 이건희 컬렉션 때부터 큐레이션 스타일이 고급스럽게 변했음. 북적대고 소문난 전시는 인스타쟁이들이 가지만 여긴 진짜가 오는 곳이라 혼자 조용히 감상하는 사람들이 많음. 주차료는 입장권으로 할인이 안됨.","['과천', '국립', '미술관', '아름답다', '정원', '있다', '멋지다', '작품', '감상', '있다', '상설', '전시', '유료', '전환', '모든', '전시', '있다', '이번', '한국', '미술', '전시', '기대', '이상', '작품', '수도', '많다', '김환기', '윤형근', '오지호', '작가', '공간', '기획', '좋다', '레이', '지난', '이건희', '컬렉션', '레이', '스타일', '고급', '변하다', '북적', '대고', '전시', '인스타', '가지', '진짜', '혼자', '조용하다', '감상', '사람', '많다', '주차', '입장권', '할인', '안되다']",Positive,0.9569794535636902
국립현대미술관 서울,서울 종로구 삼청로 30,청솔0,"김창열 작품전은 올해 12월 21일까지 국립현대미술관 서울관에서 열린다고합니다.저는 물방울 작가로만 알고있었는데... 물방울은 작가님이 파리에 거주하면서 작품활동을 할때 발견한 그림소재라고 합니다. 그때부터 철저히 물방울을 연구하여 생생하게 그려내고 있는거 같아요.작품은 미술관 6,7,8 관에서 전시됩니다.","김창열 작품전은 올해 12월 21일까지 국립현대미술관 서울관에서 열린다고합니다.저는 물방울 작가로만 알고있었는데... 물방울은 작가님이 파리에 거주하면서 작품활동을 할때 발견한 그림소재라고 합니다. 그때부터 철저히 물방울을 연구하여 생생하게 그려내고 있는거 같아요.작품은 미술관 6,7,8 관에서 전시됩니다.","['김창열', '작품', '올해', '국립', '현대', '미술관', '물방울', '작가', '로만', '물방울', '작가', '파리', '거주', '작품', '활동', '발견', '그림', '소재', '그때', '철저하다', '물방울', '연구', '생생하다', '있다', '같다', '작품', '미술관', '전시']",Positive,0.9371539354324341
국립현대미술관 서울,서울 종로구 삼청로 30,달려라곰이,"국립현대미술관이 오늘 가봤을때는 전시관이 2-3개만 오픈했지만 알차게 구성돼 있어서 딱 좋았어요.이번 전시중에는 청음과 영상감상 비중이 높았는데 전문성을 요하지 않아서 저같이 잘 모르는사람도 쉽고 재밌게 느낄수 있었어요~입장료도 2천 원이라 부담 없고 잠깐 더위 피하면서 문화생활하기엔 완전 찰떡.무더위 피하면서 힐링하고 왔습니다!- 입장료 : 2천원- 주차 : 1시간 3천원 (관람시 1시간 무료)- 주차요금 : 경차, 장애인등 50% 할인","국립현대미술관이 오늘 가봤을때는 전시관이 23개만 오픈했지만 알차게 구성돼 있어서 딱 좋았어요.이번 전시중에는 청음과 영상감상 비중이 높았는데 전문성을 요하지 않아서 저같이 잘 모르는사람도 쉽고 재밌게 느낄수 있었어요입장료도 2천 원이라 부담 없고 잠깐 더위 피하면서 문화생활하기엔 완전 찰떡.무더위 피하면서 힐링하고 왔습니다! 입장료 2천원 주차 1시간 3천원 관람시 1시간 무료 주차요금 경차, 장애인등 50 할인","['국립', '미술관', '오늘', '전시관', '오픈', '알차다', '구성', '있다', '좋다', '이번', '전시', '청음', '영상', '감상', '비중', '높다', '전문성', '요하', '사람', '재밌다', '있다', '입장료', '부담', '없다', '잠깐', '더위', '피하', '면서', '문화생활', '완전', '찰떡', '무더위', '피하', '면서', '힐링', '입장료', '주차', '관람', '무료', '주차', '요금', '경차', '장애인', '할인']",Positive,0.9706595540046692
국립현대미술관 서울,서울 종로구 삼청로 30,sswdi,김창열 회고전상흔 현상 물방울 회귀마지막 다큐 영상물 보니더 마음에 와닿았어요,김창열 회고전상흔 현상 물방울 회귀마지막 다큐 영상물 보니더 마음에 와닿았어요,"['김창열', '회고', '상흔', '현상', '물방울', '회귀', '마지막', '다큐', '영상', '마음']",Positive,0.9716720581054688
국립현대미술관 서울,서울 종로구 삼청로 30,AQAQAQ,많은 작품을 볼 수 있어 좋았고아이도 기억에 남는 좋은 전시였습니다👍🏻,많은 작품을 볼 수 있어 좋았고아이도 기억에 남는 좋은 전시였습니다,"['많다', '작품', '있다', '좋다', '기억', '좋다', '전시']",Positive,0.9725210666656494
국립현대미술관 서울,서울 종로구 삼청로 30,anonymous68,"지금 한국현대미술전 하고있는데 칙칙한 전시긴하지만 나름 체험존에서 색칠도 할 수 있어서 아이들도 즐길 수 있어요 근데 솔직히 1,3층에 무료인 작품은행 소장품이 더 재밌었어요 ㅎㅎ","지금 한국현대미술전 하고있는데 칙칙한 전시긴하지만 나름 체험존에서 색칠도 할 수 있어서 아이들도 즐길 수 있어요 근데 솔직히 1,3층에 무료인 작품은행 소장품이 더 재밌었어요 ㅎㅎ","['지금', '한국', '현대', '미술', '칙칙하다', '시긴', '나름', '체험', '색칠', '있다', '아이', '있다', '솔직하다', '무료', '작품', '은행', '소장품', '재밌다']",Positive,0.9624898433685303
국립현대미술관 서울,서울 종로구 삼청로 30,XD61,마침 입장 시간이 큐레이터 도는 시간이라 맞춰서 돌았는데 중간에 설명 들으러 따라가다보면 다시 앞부분을 관람하러 되돌아갈 수 없는 미술관의 입장 구조적인 문제가 있긴 했지만 상관없이 쭉 들었고 덕분에 물방울이 작가의 무엇으로부터 시작되었고 생애가 어땠는지에 관해 들었네요. 한자가 크게 그려진 작품의 물방울이 저는 가장 인상적이었습니다. 특히 한자가 언어로의 의미를 가졌다기보다 꾸밈용도로 사용되었다는 것이 마음에 다양하게 와닿습니다. 주고받은 편지들은 무료로 관람할 수 있는 곳에 놓여있어요.,마침 입장 시간이 큐레이터 도는 시간이라 맞춰서 돌았는데 중간에 설명 들으러 따라가다보면 다시 앞부분을 관람하러 되돌아갈 수 없는 미술관의 입장 구조적인 문제가 있긴 했지만 상관없이 쭉 들었고 덕분에 물방울이 작가의 무엇으로부터 시작되었고 생애가 어땠는지에 관해 들었네요. 한자가 크게 그려진 작품의 물방울이 저는 가장 인상적이었습니다. 특히 한자가 언어로의 의미를 가졌다기보다 꾸밈용도로 사용되었다는 것이 마음에 다양하게 와닿습니다. 주고받은 편지들은 무료로 관람할 수 있는 곳에 놓여있어요.,"['마침', '입장', '시간', '큐레이터', '시간', '중간', '설명', '다시', '부분', '관람', '없다', '미술관', '입장', '구조', '문제', '있다', '상관없다', '덕분', '물방울', '작가', '무엇', '시작', '생애', '어떻다', '관해', '한자', '크게', '작품', '물방울', '가장', '인상', '한자', '어로', '의미', '다기', '꾸밈', '용도', '사용', '마음', '다양하다', '편지', '무료', '관람', '있다']",Positive,0.9654299020767212
국립현대미술관 서울,서울 종로구 삼청로 30,jaj****,"청주에도  국립현대미술관이 있으니 딸과함께 여행하듯 다녀왔습니다.이렇게 멋진 문화공간이 있으니 가까운곳 사시는분들 이용하시면 좋겠네요.소장품들도 훌륭했고 특히 ""수채:물을그리다""...수채화 좋아하시는분들 다녀오세요",청주에도 국립현대미술관이 있으니 딸과함께 여행하듯 다녀왔습니다.이렇게 멋진 문화공간이 있으니 가까운곳 사시는분들 이용하시면 좋겠네요.소장품들도 훌륭했고 특히 수채물을그리다...수채화 좋아하시는분들 다녀오세요,"['청주', '국립', '미술관', '있다', '여행', '멋지다', '화공', '있다', '가깝다', '사시', '이용', '좋다', '소장품', '훌륭하다', '수채', '리다', '수채화', '좋아하다']",Positive,0.9731536507606506
국립현대미술관 서울,서울 종로구 삼청로 30,오발탄89,"과천에 있는 국립현대미술관의 분점인 서울관, 통합 입장료는 7,000원이지만 할인으로 무료 입장했습니다. 방문 당시에는 크게 3개 전시로 나뉘어져있었는데  근현대미술전시와 론 뮤익 전시는 재미있었지만 나머지는 아쉬웠습니다. 하지만 전시와 별개로 미술관 자체가 건축학적 예술품처럼 지어졌기 때문에 , 미술관 내부를 걸어다니기만 해도 즐거움을 느낄 수 있었던것 같습니다. 기회가 된다면 꼭 방문을 추천드립니다.","과천에 있는 국립현대미술관의 분점인 서울관, 통합 입장료는 7,000원이지만 할인으로 무료 입장했습니다. 방문 당시에는 크게 3개 전시로 나뉘어져있었는데 근현대미술전시와 론 뮤익 전시는 재미있었지만 나머지는 아쉬웠습니다. 하지만 전시와 별개로 미술관 자체가 건축학적 예술품처럼 지어졌기 때문에 , 미술관 내부를 걸어다니기만 해도 즐거움을 느낄 수 있었던것 같습니다. 기회가 된다면 꼭 방문을 추천드립니다.","['과천', '있다', '국립', '미술관', '분점', '서울', '통합', '입장료', '할인', '무료', '입장', '방문', '당시', '크게', '전시', '미술', '전시', '뮤익', '전시', '재미있다', '나머지', '아쉽다', '전시', '별개', '미술관', '자체', '건축학', '예술', '때문', '미술관', '내부', '해도', '즐거움', '있다', '같다', '기회', '방문', '추천']",Positive,0.958988606929779
국립현대미술관 서울,서울 종로구 삼청로 30,슬갱스터,"이건희 컬렉션 작품이 다양하고, 야외 공간도 너무 좋습니다 ♥️","이건희 컬렉션 작품이 다양하고, 야외 공간도 너무 좋습니다","['이건희', '컬렉션', '작품', '다양하다', '야외', '공간', '좋다']",Positive,0.9739875197410583
국립현대미술관 서울,서울 종로구 삼청로 30,영국댁,국립현대미술관 서울 상설전:한국현대미술 하이라이트 전에 중1&초6남아 2명과 다녀왔습니디. 도슨트시간 오후2시데 입구에수 시작하더라고요. 자세한 설명을 들을수는 있지만 차분함 보다는 호기심강한 아이들이라면 이어폰과 MMCA앱에서 오디오 가이드 듣는거 추천드려요. 가까이서 또는 멀리서 작품감상하고 사람들과 거리두기도 되고 나름 작품 감상할수 있는 시간도 가지게 되는 것 같더라고요. 학구열 불타는 분들은 당연히 시간 맞춰서 도슨트 추천합니다. 개인적으로 도슨트 마무리 되면 체력이 되는 한에 거꾸로 재관람해요. 전시표지인 백남준 화백의 텔레비전은 코너에 있어 깜빡하면 지나갈수 있어요. 이우환 화백의 <선으로부터>가 제일 기억에 남네요. 색감이 세련되고 조회롭더라고요. 다음주는 과천국립미술관으로 고고!,국립현대미술관 서울 상설전한국현대미술 하이라이트 전에 중1초6남아 2명과 다녀왔습니디. 도슨트시간 오후2시데 입구에수 시작하더라고요. 자세한 설명을 들을수는 있지만 차분함 보다는 호기심강한 아이들이라면 이어폰과 MMCA앱에서 오디오 가이드 듣는거 추천드려요. 가까이서 또는 멀리서 작품감상하고 사람들과 거리두기도 되고 나름 작품 감상할수 있는 시간도 가지게 되는 것 같더라고요. 학구열 불타는 분들은 당연히 시간 맞춰서 도슨트 추천합니다. 개인적으로 도슨트 마무리 되면 체력이 되는 한에 거꾸로 재관람해요. 전시표지인 백남준 화백의 텔레비전은 코너에 있어 깜빡하면 지나갈수 있어요. 이우환 화백의 선으로부터가 제일 기억에 남네요. 색감이 세련되고 조회롭더라고요. 다음주는 과천국립미술관으로 고고!,"['국립', '현대', '미술관', '서울', '설전', '한국', '현대', '미술', '하이라이트', '남아', '명과', '도슨', '오후', '입구', '시작', '자세하다', '설명', '있다', '차분하다', '호기심', '강하다', '아이', '이어폰', '오디오', '가이드', '추천', '가까이', '멀리', '작품', '감상', '사람', '거리', '기도', '나름', '작품', '감상', '있다', '시간', '가지', '같다', '학구', '불타다', '당연하다', '시간', '도슨', '추천', '개인', '도슨', '마무리', '체력', '거꾸로', '관람', '표지', '백남준', '화백', '텔레비전', '코너', '있다', '깜빡', '있다', '이우환', '화백', '제일', '기억', '색감', '세련되다', '조회', '덥다', '다음주', '과천', '국립', '미술관', '고고']",Positive,0.9529479146003723
