store_name,address,nickname,content,cleaned_content,tokenized_words,sentiment,sentiment_score
경주월드,경북 경주시 보문로 544,hd71,놀이기구 알차고 동선 짧아서 좋아요 재밌어요,놀이기구 알차고 동선 짧아서 좋아요 재밌어요,"['놀이기구', '알차다', '동선', '짧다', '좋다', '재밌다']",Positive,0.9733647108078003
경주월드,경북 경주시 보문로 544,사과나무7589,아이와 함께 방문했어요~^^날씨도 좋고 놀이기구가 다양해서이것저것 하루종일 잘놀았어요!!초등아이가 다음에 또오자고 하네요~엄청잼있데요!!,아이와 함께 방문했어요날씨도 좋고 놀이기구가 다양해서이것저것 하루종일 잘놀았어요!!초등아이가 다음에 또오자고 하네요엄청잼있데요!!,"['아이', '방문', '날씨', '좋다', '놀이기구', '다양하다', '하루', '종일', '초등', '아이', '다음', '오자']",Positive,0.9746258854866028
경주월드,경북 경주시 보문로 544,김태훈6,저렴하게 예약해서 잘 다녀 왔어요 강추!!,저렴하게 예약해서 잘 다녀 왔어요 강추!!,"['저렴하다', '예약', '강추']",Positive,0.9714213609695435
경주월드,경북 경주시 보문로 544,chanbada,사용하기 편하고 좋았어요~~ 다음에 갈때도 이용할듯요~~~^^,사용하기 편하고 좋았어요 다음에 갈때도 이용할듯요,"['사용', '편하다', '좋다', '다음', '이용']",Positive,0.9750413298606873
경주월드,경북 경주시 보문로 544,지현5566,가격 저렴하게 잘 놀다가요!! 😆놀이시설들이 생각이상으로 좋더라구요아주 만족하는 방문이였습니당 추천!!,가격 저렴하게 잘 놀다가요!! 놀이시설들이 생각이상으로 좋더라구요아주 만족하는 방문이였습니당 추천!!,"['가격', '저렴하다', '놀이', '시설', '생각', '이상', '좋다', '아주', '만족하다', '방문', '추천']",Positive,0.974911093711853
경주월드,경북 경주시 보문로 544,상냥한차돌짬뽕,학창시절에 자주 갔다가 오랜만에 갔는데 여전히 재밌었습니다. 연간회원권 끊어서 자주 가겠습니다.👍😉,학창시절에 자주 갔다가 오랜만에 갔는데 여전히 재밌었습니다. 연간회원권 끊어서 자주 가겠습니다.,"['학창시절', '자주', '여전하다', '재밌다', '연간', '회원', '자주']",Positive,0.9748873114585876
경주월드,경북 경주시 보문로 544,뿡수니91,놀이기구 완전 대박이에요넘 재밌게 잘 놀았어요,놀이기구 완전 대박이에요넘 재밌게 잘 놀았어요,"['놀이기구', '완전', '대박', '재밌다']",Positive,0.9721366763114929
경주월드,경북 경주시 보문로 544,WillowYu,비와서 걱정했는데 운행하는거는 거의 다 즐겼습니다,비와서 걱정했는데 운행하는거는 거의 다 즐겼습니다,"['걱정', '운행', '거의']",Positive,0.9563877582550049
경주월드,경북 경주시 보문로 544,희망찬93,비오는날가서 고생했지만 우의로 재밋게 놀앗어요,비오는날가서 고생했지만 우의로 재밋게 놀앗어요,"['고생', '우의', '재밋']",Positive,0.9720795154571533
경주월드,경북 경주시 보문로 544,디비디비딥딥,캴리포니아비치로 여름휴가 다녀왔습니다!! 8월말에 다녀온거라 생각보다 사람이 적었던것같았어요. 재밌게놀다왔습니다👍,캴리포니아비치로 여름휴가 다녀왔습니다!! 8월말에 다녀온거라 생각보다 사람이 적었던것같았어요. 재밌게놀다왔습니다,"['캴리', '포니', '아비치', '여름', '휴가', '생각', '사람', '같다', '재밌다']",Positive,0.9723470211029053
경주월드,경북 경주시 보문로 544,바람71,너무힘드네요에버랜드만큼은 아니지만 그래도 열심히 놀았습니다,너무힘드네요에버랜드만큼은 아니지만 그래도 열심히 놀았습니다,"['힘드다', '에버랜드', '아니다']",Positive,0.9487850666046143
경주월드,경북 경주시 보문로 544,CarpeDiem3395,와플이 맛있네요,와플이 맛있네요,"['와플', '맛있다']",Positive,0.9457500576972961
경주월드,경북 경주시 보문로 544,로닉스77,뙤양볕 날씨여서 더웠지만 합리적인 가격. 스릴넘치는 놀이기구에 잘 놀다 가요!,뙤양볕 날씨여서 더웠지만 합리적인 가격. 스릴넘치는 놀이기구에 잘 놀다 가요!,"['뙤양볕', '날씨', '덥다', '합리', '가격', '스릴', '넘치다', '놀이기구', '가요']",Positive,0.9731146097183228
경주월드,경북 경주시 보문로 544,돌아온응도67,"가족, 친구들이랑 놀러와서 좋은 추억 만들어 갑니다.","가족, 친구들이랑 놀러와서 좋은 추억 만들어 갑니다.","['가족', '친구', '놀러와', '좋다', '추억']",Positive,0.9686095118522644
경주월드,경북 경주시 보문로 544,전종성,멀미해서 죽을 뻔 ㅠ 그래서 의무실에 들렸는데 직원분이 너무 친절하셔서 좋았습니다. 이 댓글 보시는 관계자분 계시면  꼭 의무실 직원분 두분 칭찬해주세요!!!,멀미해서 죽을 뻔 ㅠ 그래서 의무실에 들렸는데 직원분이 너무 친절하셔서 좋았습니다. 이 댓글 보시는 관계자분 계시면 꼭 의무실 직원분 두분 칭찬해주세요!!!,"['멀미', '의무', '직원', '친절하다', '좋다', '댓글', '보시', '관계자', '계시', '의무', '직원', '칭찬']",Positive,0.9744479060173035
경주월드,경북 경주시 보문로 544,엄태양16,진짜 행복한 시간이었습니다.추천합니다.,진짜 행복한 시간이었습니다.추천합니다.,"['진짜', '행복하다', '시간', '추천']",Positive,0.9736320376396179
경주월드,경북 경주시 보문로 544,hae****,지난해에도 네이버에서 정말 저렴하게 구매했는데 이번에도 저렴하게 구매해서 아이들이랑 왔어요~ 기간 동안 두번 이용하려고 했는데 실외라 날씨가 한동안 너무 더워서 1번 밖에 이용하지 못해서 아쉬워요. 다른 워터파크에 비해 규모는 작지만 아이들이 놀기 좋고 음식값도 합리적인 편이예요.,지난해에도 네이버에서 정말 저렴하게 구매했는데 이번에도 저렴하게 구매해서 아이들이랑 왔어요 기간 동안 두번 이용하려고 했는데 실외라 날씨가 한동안 너무 더워서 1번 밖에 이용하지 못해서 아쉬워요. 다른 워터파크에 비해 규모는 작지만 아이들이 놀기 좋고 음식값도 합리적인 편이예요.,"['지난해', '네이버', '정말', '저렴하다', '구매', '이번', '저렴하다', '구매', '아이', '기간', '동안', '이용', '실외', '날씨', '덥다', '이용', '아쉽다', '다른', '워터파크', '규모', '아이', '좋다', '음식', '합리', '편이']",Positive,0.964478075504303
경주월드,경북 경주시 보문로 544,fun****,"직원분들 친절하시고 알차고 재밌게 놀다갑니다! 4시 20분 쯤 도착해서 발키리, 크라크, 파에톤, 급류타기, 섬머린스플래쉬, 스콜&하티, 드라켄 타고 기념품샵 구경하고 갑니다~~","직원분들 친절하시고 알차고 재밌게 놀다갑니다! 4시 20분 쯤 도착해서 발키리, 크라크, 파에톤, 급류타기, 섬머린스플래쉬, 스콜하티, 드라켄 타고 기념품샵 구경하고 갑니다","['직원', '친절하다', '알차다', '재밌다', '도착', '발키리', '라크', '파에톤', '급류', '섬머', '린스', '플래쉬', '스콜', '하티', '드라켄', '타고', '기념품', '구경']",Positive,0.9552048444747925
경주월드,경북 경주시 보문로 544,han****,놀이기구가 확실히 특색이 있고 재밌어옹,놀이기구가 확실히 특색이 있고 재밌어옹,"['놀이기구', '확실하다', '특색', '있다', '재밌다']",Positive,0.9738768339157104
경주월드,경북 경주시 보문로 544,서니3146,스릴 넘치는 놀이기구는 역싀 경주월드🫠평일에 갔지만 학교에서 놀러와서 눈치게임 실패였지만롤러코스터는 나름 다 타고 와서 재밌었어요섬머린스플랜쉬 드디어 첨 타봤는데 우의 필수,스릴 넘치는 놀이기구는 역싀 경주월드평일에 갔지만 학교에서 놀러와서 눈치게임 실패였지만롤러코스터는 나름 다 타고 와서 재밌었어요섬머린스플랜쉬 드디어 첨 타봤는데 우의 필수,"['스릴', '넘치다', '놀이기구', '역싀', '경주월드', '평일', '학교', '놀러와', '눈치', '게임', '실패', '롤러코스터', '나름', '타고', '재밌다', '섬머', '린스', '플랜', '우의', '필수']",Positive,0.9434272646903992
경주월드,경북 경주시 보문로 544,멍군61,역시 연휴에는...  너무 많이 기다린다ㅠㅠ,역시 연휴에는... 너무 많이 기다린다ㅠㅠ,"['역시', '연휴']",Positive,0.7622295022010803
경주월드,경북 경주시 보문로 544,gkd****,먼 것만 빼면 진짜 최고인듯....,먼 것만 빼면 진짜 최고인듯....,"['멀다', '진짜', '최고']",Positive,0.9669259786605835
경주월드,경북 경주시 보문로 544,PJH3741,진짜 경주월드는 우리나라 원탑 놀이공원임!!! 드라켄 크라크 파에톤 다 재밌었고 그 새로생겼다는.. 이름 까먹었는데 빨간색 싱글레일로 돼있던 그거.. 기대도 안했는데 완전완전 재밌었음!!!!! 주말에 갔는데도 사람 많지않아서 두번씩 연속으로 타기 가능!! 또 갈래~~~~,진짜 경주월드는 우리나라 원탑 놀이공원임!!! 드라켄 크라크 파에톤 다 재밌었고 그 새로생겼다는.. 이름 까먹었는데 빨간색 싱글레일로 돼있던 그거.. 기대도 안했는데 완전완전 재밌었음!!!!! 주말에 갔는데도 사람 많지않아서 두번씩 연속으로 타기 가능!! 또 갈래,"['진짜', '경주월드', '우리나라', '놀이', '공원', '드라켄', '라크', '파에톤', '재밌다', '새롭다', '이름', '빨간색', '싱글', '레일', '그거', '완전', '완전', '재밌다', '주말', '사람', '많다', '연속', '가능', '갈래']",Positive,0.9725528955459595
경주월드,경북 경주시 보문로 544,수달이48,아이들에게 익사이팅한 놀이공원!생각보다 사람이 많은날이라 대기시간이 길었는데 진짜 엄청난 스릴에 놀랐네요최고에요 진짜 ㅎㅎ,아이들에게 익사이팅한 놀이공원!생각보다 사람이 많은날이라 대기시간이 길었는데 진짜 엄청난 스릴에 놀랐네요최고에요 진짜 ㅎㅎ,"['아이', '익사', '놀이', '공원', '생각', '사람', '많다', '시간', '길다', '진짜', '엄청나다', '스릴', '최고', '진짜']",Positive,0.9725200533866882
경주월드,경북 경주시 보문로 544,유진48,편하게 예매하고 잘 다녀왔어요.,편하게 예매하고 잘 다녀왔어요.,"['편하다', '예매']",Positive,0.9710521697998047
경주월드,경북 경주시 보문로 544,쿠로땅,너무 좋았습니다.신규 어트랙션인 타임라이더도 재미있었지만 기존 어트랙션도 너무 좋았습니다.!!,너무 좋았습니다.신규 어트랙션인 타임라이더도 재미있었지만 기존 어트랙션도 너무 좋았습니다.!!,"['좋다', '신규', '어트랙션', '타임', '라이더', '재미있다', '기존', '어트랙션', '좋다']",Positive,0.9732447862625122
경주월드,경북 경주시 보문로 544,nih****,평일이라그런지 대학생위주고 사람도 적고 좋았어요 특히 웨이브캐년인가 이거 재밌네요,평일이라그런지 대학생위주고 사람도 적고 좋았어요 특히 웨이브캐년인가 이거 재밌네요,"['평일', '그렇다', '대학생', '위주', '사람', '좋다', '웨이브', '캐년', '재밌다']",Positive,0.9731238484382629
경주월드,경북 경주시 보문로 544,김톢희,너어어어어어어어어무 재밌었어요ㅜㅜ다음주 또 갈예정..,너어어어어어어어어무 재밌었어요ㅜㅜ다음주 또 갈예정..,"['어어어어', '어어어어', '재밌다', '다음주', '예정']",Positive,0.9712879657745361
경주월드,경북 경주시 보문로 544,ABcD123,정말 재밌었어요 놀이기구도 다양하게 생겼네용,정말 재밌었어요 놀이기구도 다양하게 생겼네용,"['정말', '재밌다', '놀이기구', '다양하다']",Positive,0.9741930961608887
경주월드,경북 경주시 보문로 544,xlw****,무서웠지만 직원분들이 용기 낼 수 있게 도와줘서 재밌게 즐기고 올 수 있었어요. (김xx)사회복지시설에서 시각장애인분을 데리고 함께 놀러 갔는데 직원분들이 저희 이용인을 안전하게 탑승할 수 있도록 도와주고 또 기다려주셔서 너무 감사했습니다. 다음에도 기회가 된다면 또 가고싶네요. 감사합니다 경주월드.,무서웠지만 직원분들이 용기 낼 수 있게 도와줘서 재밌게 즐기고 올 수 있었어요. 김xx사회복지시설에서 시각장애인분을 데리고 함께 놀러 갔는데 직원분들이 저희 이용인을 안전하게 탑승할 수 있도록 도와주고 또 기다려주셔서 너무 감사했습니다. 다음에도 기회가 된다면 또 가고싶네요. 감사합니다 경주월드.,"['무섭다', '직원', '용기', '있다', '재밌다', '있다', '회복', '시설', '시각장애인', '데리', '직원', '저희', '이용', '안전하다', '탑승', '있다', '다음', '기회', '경주월드']",Positive,0.9725822806358337
경주월드,경북 경주시 보문로 544,종이4955,면적은 작은데 규모가 커요평일에 갔는데 사람이 많이 없었어서 좋았어요타볼건 한번씩 다 타봤습니다!,면적은 작은데 규모가 커요평일에 갔는데 사람이 많이 없었어서 좋았어요타볼건 한번씩 다 타봤습니다!,"['면적', '작다', '규모', '평일', '사람', '없다', '좋다', '요타', '한번']",Positive,0.9723811745643616
경주월드,경북 경주시 보문로 544,blu****,혼자가도 재미나게 놀 수 있어요!오질나게 재미짐!,혼자가도 재미나게 놀 수 있어요!오질나게 재미짐!,"['혼자', '가도', '재미나', '있다', '재미']",Positive,0.9718596935272217
경주월드,경북 경주시 보문로 544,45****,경주월드표는 역시 네이버에서,경주월드표는 역시 네이버에서,"['경주월드', '역시', '네이버']",Positive,0.5642711520195007
경주월드,경북 경주시 보문로 544,냥이파부두목,추억여행.. 다른 곳 보다 놀이기구가 너무 재밌어요,추억여행.. 다른 곳 보다 놀이기구가 너무 재밌어요,"['추억', '여행', '다른', '놀이기구', '재밌다']",Positive,0.9729570746421814
경주월드,경북 경주시 보문로 544,바른생활어머니,여기 놀이기구는 하나하나 다 재미있네요..더워서 쓰러질 지경이였지만 잼나게 놀다 왔어요..어떤 여자분 카트에 실려가시던데 더위 드시지않게 조심히 안전하게 노세요~내년에 또 오겠습니다.,여기 놀이기구는 하나하나 다 재미있네요..더워서 쓰러질 지경이였지만 잼나게 놀다 왔어요..어떤 여자분 카트에 실려가시던데 더위 드시지않게 조심히 안전하게 노세요내년에 또 오겠습니다.,"['여기', '놀이기구', '하나', '하나', '재미있다', '덥다', '지경', '어떻다', '여자', '카트', '더위', '조심', '안전하다', '내년']",Positive,0.9731332659721375
경주월드,경북 경주시 보문로 544,j680133,이틀 다 재밌게 놀고가요날이 너무더웠지만그래도 너무재밌게 놀고가오!,이틀 다 재밌게 놀고가요날이 너무더웠지만그래도 너무재밌게 놀고가오!,"['이틀', '재밌다', '무덥다', '재밌다']",Positive,0.9707552790641785
경주월드,경북 경주시 보문로 544,응영이,외국에서 보던 젤리 종류나 처음보는 특이한 젤리가 많아요! 궁금했던 여러가지 종류를 하나씩 맛볼수있어서 좋았어용ㅎㅎ,외국에서 보던 젤리 종류나 처음보는 특이한 젤리가 많아요! 궁금했던 여러가지 종류를 하나씩 맛볼수있어서 좋았어용ㅎㅎ,"['외국', '젤리', '종류', '처음', '특이하다', '젤리', '많다', '궁금하다', '여러가지', '종류', '하나', '좋다']",Positive,0.970845639705658
경주월드,경북 경주시 보문로 544,자두오마니,경주월드  아이와 진짜  즐겁게 잘 즐기다 왔어요아이가 너무 잘 놀고와서  저희도 덩달아 더 잼있었답니다다음에   또 또 갈거예요  경주월드   강추합니다,경주월드 아이와 진짜 즐겁게 잘 즐기다 왔어요아이가 너무 잘 놀고와서 저희도 덩달아 더 잼있었답니다다음에 또 또 갈거예요 경주월드 강추합니다,"['경주월드', '아이', '진짜', '즐겁다', '아이', '저희', '덩달아', '다음', '경주월드', '추하다']",Positive,0.9745408892631531
경주월드,경북 경주시 보문로 544,아이조아79,놀거리가 다양하고 아이들이 재미있게 탔다고 합니다,놀거리가 다양하고 아이들이 재미있게 탔다고 합니다,"['거리', '다양하다', '아이', '재미있다']",Positive,0.9693011045455933
경주월드,경북 경주시 보문로 544,무거동큰손,놀거리가 많은 경주월드에요,놀거리가 많은 경주월드에요,"['거리', '많다', '경주월드']",Positive,0.9705307483673096
경주월드,경북 경주시 보문로 544,jwk****,다른 놀이동산도 많이 가봤지만 그중에서 가장 스릴넘치는 놀이기구가 많아서 좋았습니다👍👍 스릴 좋아한다면 최고!,다른 놀이동산도 많이 가봤지만 그중에서 가장 스릴넘치는 놀이기구가 많아서 좋았습니다 스릴 좋아한다면 최고!,"['다른', '놀이동산', '가장', '스릴', '넘치다', '놀이기구', '많다', '좋다', '스릴', '좋아하다', '최고']",Positive,0.9716845154762268
경주월드,경북 경주시 보문로 544,sajagirls,연휴라 대기가 많았지만 재밌었어요,연휴라 대기가 많았지만 재밌었어요,"['연휴', '대기', '많다', '재밌다']",Positive,0.9700219035148621
경주월드,경북 경주시 보문로 544,Tucsonjjoa,재미난 여행이었어요!,재미난 여행이었어요!,"['재미', '여행']",Positive,0.9716647267341614
경주월드,경북 경주시 보문로 544,2zzx,"하루는,,워터파크,,🛝하루는,,놀이공원,,🎡","하루는,,워터파크,,하루는,,놀이공원,,","['하루', '워터파크', '하루', '놀이', '공원']",Negative,0.7379140257835388
경주월드,경북 경주시 보문로 544,너나들이8337,아이들이 신나해요!! 시간가는줄 모르고 다녔어요. 날씨도 햇볕이 많이 없이 좋았고 무엇보다 서커스공연이 인상깊어요. 어린시절로 돌아간것처럼 아이들이랑 즐겁게 보았어요!! 다음번에도 다시 놀러올께요^^,아이들이 신나해요!! 시간가는줄 모르고 다녔어요. 날씨도 햇볕이 많이 없이 좋았고 무엇보다 서커스공연이 인상깊어요. 어린시절로 돌아간것처럼 아이들이랑 즐겁게 보았어요!! 다음번에도 다시 놀러올께요,"['아이', '신나다', '시간', '날씨', '햇볕', '좋다', '무엇', '서커스', '공연', '인상', '깊다', '어린시절', '아이', '즐겁다', '다음', '다시']",Positive,0.9748746156692505
경주월드,경북 경주시 보문로 544,당그니25,여름휴가를 시작하는 첫날 경주월드에서 신나게 놀고 왔습니다^^ 가을에 또 가고싶어요~,여름휴가를 시작하는 첫날 경주월드에서 신나게 놀고 왔습니다 가을에 또 가고싶어요,"['여름', '휴가', '시작', '첫날', '경주월드', '신나다', '가을']",Positive,0.9732411503791809
경주월드,경북 경주시 보문로 544,감자전86,날이 더운데도 사람이 많아서 대기가 길어 힘들었어요,날이 더운데도 사람이 많아서 대기가 길어 힘들었어요,"['덥다', '사람', '많다', '대기', '길다', '힘들다']",Positive,0.648557186126709
경주월드,경북 경주시 보문로 544,푸루루5724,경주 캘리포니아 비치,경주 캘리포니아 비치,"['경주', '캘리포니아', '비치']",Positive,0.6171656250953674
경주월드,경북 경주시 보문로 544,요니요니요니,추석연휴 기간중에 10/11일 방문했어요9시 20분쯤 줄서서 오픈런 했는데오전에 사람이 적어 놀이기구 많이 탔어요오픈런 추천 드립니다.,추석연휴 기간중에 1011일 방문했어요9시 20분쯤 줄서서 오픈런 했는데오전에 사람이 적어 놀이기구 많이 탔어요오픈런 추천 드립니다.,"['추석', '연휴', '기간', '방문', '서서', '오픈', '오전', '사람', '놀이기구', '오픈', '추천']",Positive,0.9283751845359802
경주월드,경북 경주시 보문로 544,얌얌생0,역시 드라켄이 최고인듯줄이 길어도 빨리 줄어서 좋아요,역시 드라켄이 최고인듯줄이 길어도 빨리 줄어서 좋아요,"['역시', '드라켄', '최고', '좋다']",Positive,0.9694256782531738
경주월드,경북 경주시 보문로 544,워니 엄마,조카랑 월요일에 갔는데 대기도없고 계속 탈수있어서 좋았어요~ 2명에서 탑승해도 친절하게 맞이해주고 좋아요!!,조카랑 월요일에 갔는데 대기도없고 계속 탈수있어서 좋았어요 2명에서 탑승해도 친절하게 맞이해주고 좋아요!!,"['조카', '월요일', '기도', '없다', '계속', '좋다', '탑승', '친절하다', '맞이', '좋다']",Positive,0.9741023182868958
경주월드,경북 경주시 보문로 544,미야예요,너무 잼 나게 잘 놀다가요~,너무 잼 나게 잘 놀다가요,[],Positive,0.973230242729187
경주월드,경북 경주시 보문로 544,snocat820209,경주월드 첫 방문인데 너무 만족합니다.놀이기구마다 테마가 있어서 재미를 더해주네요.짜릿하고 스릴넘치는 놀이기구와 아이와 타기좋은 신나는 놀이기구가 같이 있어 온가족 함께하기 너무 좋고 물벼락 맞는재미도 있네요 ㅎㅎ다른 놀이동산보다 푸드코트등이 비싸지 않고 맛있는 먹거리도 많아서 하루종일 놀기 좋아요.또 방문하려구요.정말 신나는 하루였어요^^,경주월드 첫 방문인데 너무 만족합니다.놀이기구마다 테마가 있어서 재미를 더해주네요.짜릿하고 스릴넘치는 놀이기구와 아이와 타기좋은 신나는 놀이기구가 같이 있어 온가족 함께하기 너무 좋고 물벼락 맞는재미도 있네요 ㅎㅎ다른 놀이동산보다 푸드코트등이 비싸지 않고 맛있는 먹거리도 많아서 하루종일 놀기 좋아요.또 방문하려구요.정말 신나는 하루였어요,"['경주월드', '방문', '만족하다', '놀이기구', '테마', '있다', '재미', '짜릿하다', '스릴', '넘치다', '놀이기구', '아이', '좋다', '신나다', '놀이기구', '있다', '가족', '좋다', '물벼락', '재미', '있다', '다른', '놀이동산', '푸드코트', '비싸다', '맛있다', '먹거리', '많다', '하루', '종일', '좋다', '방문', '정말', '신나다', '하루']",Positive,0.9730938673019409
경주월드,경북 경주시 보문로 544,구름냥,사람 없어서 제일 오래기다린 크라켄도 30분이면 탔고 나머지 놀이기구 들도 5분이면 탔어요,사람 없어서 제일 오래기다린 크라켄도 30분이면 탔고 나머지 놀이기구 들도 5분이면 탔어요,"['사람', '없다', '제일', '크라켄', '나머지', '놀이기구']",Positive,0.7154371738433838
경주월드,경북 경주시 보문로 544,디비디비딥딥,재밌게놀고왔습니다!! 기념품가게도 들려 물건도 사고 좋았습니다,재밌게놀고왔습니다!! 기념품가게도 들려 물건도 사고 좋았습니다,"['재밌다', '기념품', '가게', '물건', '사고', '좋다']",Positive,0.9714316725730896
경주월드,경북 경주시 보문로 544,윤빠방,특가 덕분에 좋은 가격에 다녀왔어요! 날씨가 좋아서 다들 꽃놀이 간 건지 생각보다 많이 기다리지않고 탈 수 있어 좋았습니다!,특가 덕분에 좋은 가격에 다녀왔어요! 날씨가 좋아서 다들 꽃놀이 간 건지 생각보다 많이 기다리지않고 탈 수 있어 좋았습니다!,"['덕분', '좋다', '가격', '날씨', '좋다', '꽃놀이', '생각', '있다', '좋다']",Positive,0.9687204957008362
경주월드,경북 경주시 보문로 544,딸셋맘1,요번에는 물놀이낀지 같이 이용했는데 애들이 너무 좋아했어요 내년에 또 오고 싶다고 하네요 너무 만족했습니다,요번에는 물놀이낀지 같이 이용했는데 애들이 너무 좋아했어요 내년에 또 오고 싶다고 하네요 너무 만족했습니다,"['물놀이', '이용', '좋아하다', '내년', '만족하다']",Positive,0.9734878540039062
경주월드,경북 경주시 보문로 544,iloveu31,경주 갈때마다 가는데 항상 만족스럽게 놀다 옵니다.,경주 갈때마다 가는데 항상 만족스럽게 놀다 옵니다.,"['경주', '항상', '만족']",Positive,0.974137544631958
경주월드,경북 경주시 보문로 544,sehun516,입장줄 없이 바로들어왔어요.날씨가 너무 더워서 그런지 생각보단 사람 적었어요!!,입장줄 없이 바로들어왔어요.날씨가 너무 더워서 그런지 생각보단 사람 적었어요!!,"['입장', '바로', '날씨', '덥다', '그렇다', '생각', '사람']",Positive,0.960553765296936
