store_name,address,nickname,content,cleaned_content,tokenized_words,sentiment,sentiment_score
스카이라인루지 통영,경남 통영시 발개로 178,뚜빵떡,"스카이라인루지는 통영에 여행가면 꼭 가봐야 하는 곳입니다!액티비티로 개꿀잼을 느낄 수 있어서 즐거워요!가족단위, 친구들 같이가서 놀고오면 추억도 쌓이고신나고 스릴 넘치게 루지를 타고 올 수 있습니다.한번타면 계속 타고싶어지니 애초에 5회권 구매하는게 좋아요!날씨 좋을때 가면 풍경이 더 예쁘고 멋집니다!다음에 또 통영 오면 루지타러 오겠습니다!>_<","스카이라인루지는 통영에 여행가면 꼭 가봐야 하는 곳입니다!액티비티로 개꿀잼을 느낄 수 있어서 즐거워요!가족단위, 친구들 같이가서 놀고오면 추억도 쌓이고신나고 스릴 넘치게 루지를 타고 올 수 있습니다.한번타면 계속 타고싶어지니 애초에 5회권 구매하는게 좋아요!날씨 좋을때 가면 풍경이 더 예쁘고 멋집니다!다음에 또 통영 오면 루지타러 오겠습니다!","['스카이라인', '루지', '통영', '여행가', '이다', '티비', '개꿀잼', '있다', '즐겁다', '가족', '단위', '친구', '추억', '신나다', '스릴', '넘치다', '루지', '타고', '있다', '한번', '계속', '애초', '구매', '좋다', '날씨', '좋다', '가면', '풍경', '예쁘다', '멋지다', '다음', '통영', '루지']",Positive,0.9686039686203003
스카이라인루지 통영,경남 통영시 발개로 178,에이진0,날씨도 흐리고 비가 와서 타도 될까 했는데 바람도 불고 너무 좋았어요~,날씨도 흐리고 비가 와서 타도 될까 했는데 바람도 불고 너무 좋았어요,"['날씨', '타도', '바람', '좋다']",Positive,0.9712770581245422
스카이라인루지 통영,경남 통영시 발개로 178,min****,평일 낮에 가서 대기 안 하고 바로바로 탈 수 있어 좋았음. 근데 한 코스가 정비중이라 막혀있었음 ㅠㅠ 코스 4개길래 4회권 결제한 건데 3코스만 열려 있어 아쉬웠음 ㅠㅠㅠ 그래두 재밋엇다!! 오션뷰에서 달리니까 시원하도 좋어융,평일 낮에 가서 대기 안 하고 바로바로 탈 수 있어 좋았음. 근데 한 코스가 정비중이라 막혀있었음 ㅠㅠ 코스 4개길래 4회권 결제한 건데 3코스만 열려 있어 아쉬웠음 ㅠㅠㅠ 그래두 재밋엇다!! 오션뷰에서 달리니까 시원하도 좋어융,"['평일', '대기', '있다', '좋다', '코스', '정비', '코스', '결제', '코스', '있다', '아쉽다', '그렇다', '재밋엇다', '오션', '달리', '시원하다', '좋다']",Positive,0.9471932053565979
스카이라인루지 통영,경남 통영시 발개로 178,디퍼런트,전밍좋구  가족과 즐거운시간 보냈어요,전밍좋구 가족과 즐거운시간 보냈어요,"['좋다', '가족', '즐겁다', '시간']",Positive,0.9721635580062866
스카이라인루지 통영,경남 통영시 발개로 178,쓸로로,루지는 진짜 엉덩이가 텅텅거리면서 타는데 정말 코스도 여러가지라서 너무 재미있어요:) 심지어 속도 조절을 제가 할 수 있어서 정말 재미있었어요!! 루지랑 더카트인으로 묶여있어서 예약 했는데루지랑 더 카트인은 위치와 거리가 다르니 유의하시기를!!더카트인도 타러왔는데 우천중이라 실내에서 속도감을 즐겼는데 무조건 타세여!! 실내여도 속도감은 그대로라서 진짜 재미있어요♥♥더카트인은 속도감이 남다르고 진짜 속도감 즐기고 싶은 사람은 꼭꼭 타기♥♥,루지는 진짜 엉덩이가 텅텅거리면서 타는데 정말 코스도 여러가지라서 너무 재미있어요 심지어 속도 조절을 제가 할 수 있어서 정말 재미있었어요!! 루지랑 더카트인으로 묶여있어서 예약 했는데루지랑 더 카트인은 위치와 거리가 다르니 유의하시기를!!더카트인도 타러왔는데 우천중이라 실내에서 속도감을 즐겼는데 무조건 타세여!! 실내여도 속도감은 그대로라서 진짜 재미있어요더카트인은 속도감이 남다르고 진짜 속도감 즐기고 싶은 사람은 꼭꼭 타기,"['루지', '진짜', '엉덩이', '텅텅', '거리', '면서', '정말', '코스', '여러가지', '재미있다', '심지어', '속도', '조절', '있다', '정말', '재미있다', '루지', '카트', '예약', '루지', '카트', '위치', '거리', '다르다', '유의', '카트', '인도', '우천', '실내', '도감', '무조건', '실내', '도감', '그대로', '진짜', '재미있다', '카트', '도감', '남다르다', '진짜', '도감', '사람', '꼭꼭']",Positive,0.9660422801971436
스카이라인루지 통영,경남 통영시 발개로 178,에이미7770,이용권 2번은 아쉬울 것 같아요. 3회도 좋은데 4회도 좋을 것 같아요 그 만큼 재미있었어요.,이용권 2번은 아쉬울 것 같아요. 3회도 좋은데 4회도 좋을 것 같아요 그 만큼 재미있었어요.,"['이용권', '번은', '아쉽다', '같다', '좋다', '좋다', '같다', '만큼', '재미있다']",Positive,0.9734997153282166
스카이라인루지 통영,경남 통영시 발개로 178,알빠녀,루지타기전 교육해주시는 분들 불친절함,루지타기전 교육해주시는 분들 불친절함,"['루지', '기전', '교육', '불친절하다']",Negative,0.9581132531166077
스카이라인루지 통영,경남 통영시 발개로 178,jekkkkkkkkk,너무 신나고 재밌었어요진짜 많이 길고 3번이 부족할 정도였어요 👍👍👍,너무 신나고 재밌었어요진짜 많이 길고 3번이 부족할 정도였어요,"['신나다', '재밌다', '진짜', '길다', '부족하다', '정도']",Positive,0.9738577604293823
스카이라인루지 통영,경남 통영시 발개로 178,mozzisson,"통영여행 중 루지탔는데 너무 재미있었어요!! 트랙도 4가지나 있어서 골라타는 재미가 쏠쏠했어용>< 안 탔으면 후회할 뻔했어요. 꼭 타세요!! 부모님도 부담없이 타실 수 있고, 재미있어하셔서 뿌듯했어요ㅎㅎ","통영여행 중 루지탔는데 너무 재미있었어요!! 트랙도 4가지나 있어서 골라타는 재미가 쏠쏠했어용 안 탔으면 후회할 뻔했어요. 꼭 타세요!! 부모님도 부담없이 타실 수 있고, 재미있어하셔서 뿌듯했어요ㅎㅎ","['통영', '여행', '루지', '재미있다', '트랙', '가지', '있다', '재미', '쏠쏠하다', '후회', '뻔하다', '부모님', '부담', '있다', '재미있다', '뿌듯하다']",Positive,0.9713146090507507
스카이라인루지 통영,경남 통영시 발개로 178,122117,코스가 많아서 다양하게 탔습니다!부모님도 즐거워하셔서 기분이 좋습니다~~~,코스가 많아서 다양하게 탔습니다!부모님도 즐거워하셔서 기분이 좋습니다,"['코스', '많다', '다양하다', '부모님', '즐겁다', '기분', '좋다']",Positive,0.9727861285209656
스카이라인루지 통영,경남 통영시 발개로 178,도몽이의일상,"통영에 갈때마다 꼭 들르는 필수코스‼️처음엔 값이 좀 있다고 생각할 수 있지만, 다 타고나면 그 값이 전혀 아깝지 않다고 생각드는 곳이에요-!5회권에 사진까지 얻어가는 코스 제일 강추입니다!","통영에 갈때마다 꼭 들르는 필수코스처음엔 값이 좀 있다고 생각할 수 있지만, 다 타고나면 그 값이 전혀 아깝지 않다고 생각드는 곳이에요!5회권에 사진까지 얻어가는 코스 제일 강추입니다!","['통영', '필수', '코스', '처음', '있다', '생각', '있다', '전혀', '아깝다', '생각', '사진', '코스', '제일', '강추', '이다']",Positive,0.9727140069007874
스카이라인루지 통영,경남 통영시 발개로 178,kgc972,너무나 재미있게 탓습니다,너무나 재미있게 탓습니다,"['재미있다', '탓습니']",Positive,0.9723559617996216
스카이라인루지 통영,경남 통영시 발개로 178,Yoon4091,타다가 남자친구 실수로 차키를 잃어버렸는데직원분들이 빠르게 어디선가 차키를 찾아주셨어요당황스럽고 일정이 엉킬까봐 불안했는데 아주 행복하게 나섰습니다. ㅠㅜ 루지 재미도 있고 엔진으로 가는게 아니다보니까 시각적으로도 깔끔해서 좋았어요,타다가 남자친구 실수로 차키를 잃어버렸는데직원분들이 빠르게 어디선가 차키를 찾아주셨어요당황스럽고 일정이 엉킬까봐 불안했는데 아주 행복하게 나섰습니다. ㅠㅜ 루지 재미도 있고 엔진으로 가는게 아니다보니까 시각적으로도 깔끔해서 좋았어요,"['다가', '남자친구', '실수', '차키', '직원', '빠르다', '어디', '차키', '당황', '스럽다', '일정', '엉킬까봐', '불안하다', '아주', '행복하다', '루지', '재미', '있다', '엔진', '아니다', '시각', '깔끔하다', '좋다']",Positive,0.9720422625541687
스카이라인루지 통영,경남 통영시 발개로 178,eyelight63,아이들이 재미있게 탔어요. 코스가 다양하고 재미있어요. 아이들이 더 타고 싶어했어요,아이들이 재미있게 탔어요. 코스가 다양하고 재미있어요. 아이들이 더 타고 싶어했어요,"['아이', '재미있다', '코스', '다양하다', '재미있다', '아이', '타고']",Positive,0.9748876690864563
스카이라인루지 통영,경남 통영시 발개로 178,김주섭75,만족합니다 오래만에 와이프랑 루지 재미있게 탓어요 ㅋㅋㅋ,만족합니다 오래만에 와이프랑 루지 재미있게 탓어요 ㅋㅋㅋ,"['만족하다', '와이프', '루지', '재미있다']",Positive,0.9735144972801208
스카이라인루지 통영,경남 통영시 발개로 178,착한희야41,너무 재밌어요~~ 네이버 예약으로 두개 세트로하니 저렴하고 간편하고 좋아요!,너무 재밌어요 네이버 예약으로 두개 세트로하니 저렴하고 간편하고 좋아요!,"['재밌다', '네이버', '예약', '세트', '하니', '저렴하다', '간편하다', '좋다']",Positive,0.9727404117584229
스카이라인루지 통영,경남 통영시 발개로 178,pangpang9568,애들과 통영오면 항상 들리는 코스죠~ㅎㅎ,애들과 통영오면 항상 들리는 코스죠ㅎㅎ,"['영오면', '항상', '코스']",Positive,0.9686182737350464
스카이라인루지 통영,경남 통영시 발개로 178,95돼지,혼자가서 탔는데도 너무 재미있었습니다~~,혼자가서 탔는데도 너무 재미있었습니다,"['혼자', '재미있다']",Positive,0.9733529686927795
스카이라인루지 통영,경남 통영시 발개로 178,doj****,운전(?)에 미숙한 제 딸도 루지교육과 1바퀴 정도 타고 나니까 재미있다고하며 잘 탑니다직원분들도 친절하시고 매표소 직원분께서공식 홈페이지에 2회권도 판매한다고 안내해주셔서 잘 이용했습니다탈 때 손잡이를 계속 잡아당기는 듯하게 해야해서 다음날 팔뚝이 약간 뻐근합니다.루지 이용하시고 사진 및 동영상을 구매하고 싶으시면 썼던 헬멧으로 해당 자료를 추출하는 시스템이므로 헬멧 반납말고 기념품샵으로 가세요아쉬운 점은 사진 및 동영상 현상 뿐만이 아니라 파일 보내는 것도 돈을 받으십니다건당 5000원 정도?매우 아쉽습니다 마치 사진관에서 흔히 하는 가족사진 파일 받으려면 돈 내라 하는 것이 생각나는 경우였습니다,운전?에 미숙한 제 딸도 루지교육과 1바퀴 정도 타고 나니까 재미있다고하며 잘 탑니다직원분들도 친절하시고 매표소 직원분께서공식 홈페이지에 2회권도 판매한다고 안내해주셔서 잘 이용했습니다탈 때 손잡이를 계속 잡아당기는 듯하게 해야해서 다음날 팔뚝이 약간 뻐근합니다.루지 이용하시고 사진 및 동영상을 구매하고 싶으시면 썼던 헬멧으로 해당 자료를 추출하는 시스템이므로 헬멧 반납말고 기념품샵으로 가세요아쉬운 점은 사진 및 동영상 현상 뿐만이 아니라 파일 보내는 것도 돈을 받으십니다건당 5000원 정도?매우 아쉽습니다 마치 사진관에서 흔히 하는 가족사진 파일 받으려면 돈 내라 하는 것이 생각나는 경우였습니다,"['운전', '미숙', '딸도', '루지', '교육', '바퀴', '정도', '타고', '재미있다', '직원', '친절하다', '매표소', '직원', '공식', '홈페이지', '판매', '안내', '이용', '손잡이', '계속', '다음', '팔뚝', '약간', '뻐근하다', '루지', '이용', '사진', '동영상', '구매', '헬멧', '해당', '자료', '추출', '시스템', '헬멧', '반납', '기념품', '가세', '아쉽다', '사진', '동영상', '현상', '아니다', '파일', '정도', '매우', '아쉽다', '마치', '사진관', '흔하다', '가족사진', '파일', '경우']",Positive,0.871290385723114
스카이라인루지 통영,경남 통영시 발개로 178,찐19,아이들이 너무좋아하고 안전하게. 잘탔어요 👍 👍 👍,아이들이 너무좋아하고 안전하게. 잘탔어요,"['아이', '좋아하다', '안전하다']",Positive,0.9745294451713562
스카이라인루지 통영,경남 통영시 발개로 178,아루마루90,좋아요,좋아요,['좋다'],Positive,0.9396566152572632
스카이라인루지 통영,경남 통영시 발개로 178,nise0622,재밌어요,재밌어요,['재밌다'],Positive,0.973504900932312
스카이라인루지 통영,경남 통영시 발개로 178,초생달94,재미있게 잘~탔어요.^^,재미있게 잘탔어요.,['재미있다'],Positive,0.9726353287696838
스카이라인루지 통영,경남 통영시 발개로 178,쭈누43,리프트 부터 재미있어요다소 팔힘이 필요해서 유의하시구요3회권으로 다양하게 즐겼습니다,리프트 부터 재미있어요다소 팔힘이 필요해서 유의하시구요3회권으로 다양하게 즐겼습니다,"['리프트', '부터', '재미있다', '다소', '필요하다', '유의', '다양하다']",Positive,0.9742845892906189
스카이라인루지 통영,경남 통영시 발개로 178,wls****,오랜만에 데이트로 루지를 탔는데 정말 재미있었습니다! 다음에 통영 여행하면 재방문 의사있습니다!,오랜만에 데이트로 루지를 탔는데 정말 재미있었습니다! 다음에 통영 여행하면 재방문 의사있습니다!,"['데이트', '루지', '정말', '재미있다', '다음', '통영', '여행', '방문', '의사', '있다']",Positive,0.97196364402771
스카이라인루지 통영,경남 통영시 발개로 178,mik****,거제 온김에 통영루지 타러 왔는데 너무 재밌습니다. (계~~속 타고 싶어요!),거제 온김에 통영루지 타러 왔는데 너무 재밌습니다. 계속 타고 싶어요!,"['거제', '통영', '루지', '재밌다', '계속', '타고']",Positive,0.9744131565093994
스카이라인루지 통영,경남 통영시 발개로 178,yiu****,어린이날이라 대기가 길었는데 막상 대기시간이 많이 길지는 않았어요. 금방금방 대기줄이 줄었어요. 손님 많고 힘드실텐데 직원분들 모두 친절하셨어요^^,어린이날이라 대기가 길었는데 막상 대기시간이 많이 길지는 않았어요. 금방금방 대기줄이 줄었어요. 손님 많고 힘드실텐데 직원분들 모두 친절하셨어요,"['어린이날', '대기', '길다', '막상', '시간', '금방', '금방', '손님', '많다', '힘들다', '직원', '모두', '친절하다']",Positive,0.9622713327407837
스카이라인루지 통영,경남 통영시 발개로 178,qmf****,굿,굿,[],Positive,0.9277362823486328
스카이라인루지 통영,경남 통영시 발개로 178,Jyj3,"아이들과 5-6번쯤 방문한듯~깔끔하고  직원들도 친절하시고, 재미있어요~~오늘 날씨도 좋고 꽃향기가 사방팔방에!!너무 좋았습니다. 끝나고 2시쯤되니 사람이 엄청 많아짐!!","아이들과 56번쯤 방문한듯깔끔하고 직원들도 친절하시고, 재미있어요오늘 날씨도 좋고 꽃향기가 사방팔방에!!너무 좋았습니다. 끝나고 2시쯤되니 사람이 엄청 많아짐!!","['아이', '방문', '깔끔하다', '직원', '친절하다', '재미있다', '오늘', '날씨', '좋다', '향기', '사방', '팔방', '좋다', '사람']",Positive,0.9753835797309875
스카이라인루지 통영,경남 통영시 발개로 178,모랑65,"여행온 사람들 모두, 여기 모인 듯^^어린이날 이라고솜사탕도 페이스페인팅도 풍선도즐길거리, 재미만 가득한 곳♡","여행온 사람들 모두, 여기 모인 듯어린이날 이라고솜사탕도 페이스페인팅도 풍선도즐길거리, 재미만 가득한 곳","['행온', '사람', '모두', '여기', '어린이날', '솜사탕', '페이', '스페인', '풍선', '재미', '가득하다']",Positive,0.9328813552856445
스카이라인루지 통영,경남 통영시 발개로 178,soo****,루지중에선 통영이짱,루지중에선 통영이짱,"['루지', '통영']",Positive,0.7717591524124146
스카이라인루지 통영,경남 통영시 발개로 178,예비대딩,통영에 방문한다면 추천입니다.루지 + 통영 더카트 이용권으로 다양한 체험을 하면서 시간보내는게 ㄹㅇ 좋습니다^^주말보단 평일을 추천합니다^^,통영에 방문한다면 추천입니다.루지 통영 더카트 이용권으로 다양한 체험을 하면서 시간보내는게 ㄹㅇ 좋습니다주말보단 평일을 추천합니다,"['통영', '방문', '추천', '이다', '루지', '통영', '카트', '이용권', '다양하다', '체험', '시간', '좋다', '주말', '평일', '추천']",Positive,0.9503220915794373
스카이라인루지 통영,경남 통영시 발개로 178,hjt****,"오랜만에 루지 탔는데, 재미있었고, 사람들이 많이 없어서 안기다리고 타서 더 좋았던 것 같아요. 레전드 코스가 좋았어요!!","오랜만에 루지 탔는데, 재미있었고, 사람들이 많이 없어서 안기다리고 타서 더 좋았던 것 같아요. 레전드 코스가 좋았어요!!","['루지', '재미있다', '사람', '없다', '좋다', '같다', '레전드', '코스', '좋다']",Positive,0.9734328389167786
스카이라인루지 통영,경남 통영시 발개로 178,kik****,4번탔는데 재미있었어요 중간중간에 가다가 멈춰 있는 사람들이 많아서 부딪힐뻔 했네요,4번탔는데 재미있었어요 중간중간에 가다가 멈춰 있는 사람들이 많아서 부딪힐뻔 했네요,"['재미있다', '중간', '중간', '가다가', '있다', '사람', '많다']",Positive,0.9703116416931152
스카이라인루지 통영,경남 통영시 발개로 178,kiss10622,잘놀다갑니다,잘놀다갑니다,[],Negative,0.853441596031189
스카이라인루지 통영,경남 통영시 발개로 178,로닝91,네이버로 예약했어요가족과 함께 주말 오후에 갔는데 생각보다 줄이 길지않아 바로바로 탈수 있었어요가격이 조금 더 합리적이면 더 자주 이용할것 같아요,네이버로 예약했어요가족과 함께 주말 오후에 갔는데 생각보다 줄이 길지않아 바로바로 탈수 있었어요가격이 조금 더 합리적이면 더 자주 이용할것 같아요,"['네이버', '예약', '가족', '주말', '오후', '생각', '길다', '탈수', '있다', '가격', '조금', '합리', '이면', '자주', '이용', '같다']",Positive,0.9707306623458862
스카이라인루지 통영,경남 통영시 발개로 178,dd1698,친구와 함께 이용했습니다. 바다도 잘 보이고 재미있어서 좋았어요. 특히 마지막에 급경사로 있는 코스가 재미있었습니다!,친구와 함께 이용했습니다. 바다도 잘 보이고 재미있어서 좋았어요. 특히 마지막에 급경사로 있는 코스가 재미있었습니다!,"['친구', '이용', '바다', '보이', '재미있다', '좋다', '마지막', '급경사', '있다', '코스', '재미있다']",Positive,0.9728220105171204
스카이라인루지 통영,경남 통영시 발개로 178,찐이216,재미잇고 신나게 즐기다 왓는데 미리 예매시 할인도 안되고 바코드로 받아가니 다시 줄서서 기다리고. 그게 쬠 불편,재미잇고 신나게 즐기다 왓는데 미리 예매시 할인도 안되고 바코드로 받아가니 다시 줄서서 기다리고. 그게 쬠 불편,"['재미', '신나다', '왓는데', '미리', '예매', '할인', '안되다', '바코드', '다시', '서서', '그게', '불편']",Positive,0.9373334050178528
스카이라인루지 통영,경남 통영시 발개로 178,똘딱꼬맘,코스마다 볼거리가 달라 재미남.길이도 길어서 아이들이 좋아함.,코스마다 볼거리가 달라 재미남.길이도 길어서 아이들이 좋아함.,"['코스', '볼거리', '달라', '재미', '길이', '아이', '좋아하다']",Positive,0.9732868075370789
스카이라인루지 통영,경남 통영시 발개로 178,응암동식가,늙은이들은 3회 이상타면 힘들어요,늙은이들은 3회 이상타면 힘들어요,"['늙은이', '이상', '힘들다']",Negative,0.8852706551551819
스카이라인루지 통영,경남 통영시 발개로 178,mij****,사람은 많은데  대기시간짦고 애들이넘  좋았다고 하네요즐거운 여행이었어요~^^,사람은 많은데 대기시간짦고 애들이넘 좋았다고 하네요즐거운 여행이었어요,"['사람', '많다', '시간', '좋다', '즐겁다', '여행']",Positive,0.974980890750885
스카이라인루지 통영,경남 통영시 발개로 178,나다룽,루지 3회권+케이블카 구입했는데 제가 수요일에 방문했거든요 근데 수요일이 케이블카 정비하는 날이라고 하더라고요 그래서 케이블카는 못탔어요 근데 데스크에서 처음에 그런 안내가 전혀 없어서 다시 데스크가서 물어보니 자기들 관할이 아니라고 예약한곳에 문의해보라는데 나몰라라 하는 응대가 어이없었어요 네이버예약엔 고객센터도 없고 아무것도 없던데 어디에 문의하라는건지 모르겠네요 재밌게 탔는데 이것때문에 기분도 나쁘고 케이블카 타지도 않고 쌩돈 날렸어요,루지 3회권케이블카 구입했는데 제가 수요일에 방문했거든요 근데 수요일이 케이블카 정비하는 날이라고 하더라고요 그래서 케이블카는 못탔어요 근데 데스크에서 처음에 그런 안내가 전혀 없어서 다시 데스크가서 물어보니 자기들 관할이 아니라고 예약한곳에 문의해보라는데 나몰라라 하는 응대가 어이없었어요 네이버예약엔 고객센터도 없고 아무것도 없던데 어디에 문의하라는건지 모르겠네요 재밌게 탔는데 이것때문에 기분도 나쁘고 케이블카 타지도 않고 쌩돈 날렸어요,"['루지', '구입', '수요일', '방문', '수요일', '케이블카', '정비', '케이블카', '데스크', '처음', '그렇다', '안내', '전혀', '없다', '다시', '데스크', '자기', '관할', '아니다', '문의', '응대', '어이없다', '네이버', '예약', '고객', '센터', '없다', '없다', '어디', '문의', '재밌다', '때문', '기분', '나쁘다', '케이블카', '타지', '쌩돈']",Negative,0.8909722566604614
스카이라인루지 통영,경남 통영시 발개로 178,긴티보끔밥,통영가서 루지 안타면 바부🫠 제발 오픈런 해서 타주세요... 그리고 공식홈페이지에서 온라인 예매가 현장예매보다 좀 더 저렴함! 그리고 무엇보다도! 아무한테도 방해안받고 여유있게 탈수 있음!!! 유치하지도 않고 ㅋㅋㅋ 코스도 길어서 너무 좋음 그리고 무엇보다도 사진찍힐때 뒤에 아무도 안찍혀서 너무 좋아요 ㅋㅋㅋ 다시 탈때도 바로 탈수잇음...기다리지 않고ㅠㅠ 제발 오픈런 ㄱㄱ솔직히 여러가지 재미를 느끼고 싶다면 레전드 코스 추천바다보면서 달리고싶으면 울트라 코스 추천! 사진 잘찍힌거 꼭 사진 인화 신청하세요!그리고 아이스크림 꼭 받아서 나오세염>_< 2회권 끊으면 후회하는점. 3회탈껄. 껄껄무새가 될수있음,통영가서 루지 안타면 바부 제발 오픈런 해서 타주세요... 그리고 공식홈페이지에서 온라인 예매가 현장예매보다 좀 더 저렴함! 그리고 무엇보다도! 아무한테도 방해안받고 여유있게 탈수 있음!!! 유치하지도 않고 ㅋㅋㅋ 코스도 길어서 너무 좋음 그리고 무엇보다도 사진찍힐때 뒤에 아무도 안찍혀서 너무 좋아요 ㅋㅋㅋ 다시 탈때도 바로 탈수잇음...기다리지 않고ㅠㅠ 제발 오픈런 ㄱㄱ솔직히 여러가지 재미를 느끼고 싶다면 레전드 코스 추천바다보면서 달리고싶으면 울트라 코스 추천! 사진 잘찍힌거 꼭 사진 인화 신청하세요!그리고 아이스크림 꼭 받아서 나오세염 2회권 끊으면 후회하는점. 3회탈껄. 껄껄무새가 될수있음,"['통영', '루지', '안타', '바부', '제발', '오픈', '공식', '홈페이지', '온라인', '예매', '현장', '예매', '저렴하다', '무엇', '여유', '있다', '탈수', '있다', '유치하다', '코스', '좋다', '무엇', '사진', '아무', '좋다', '다시', '탈때', '바로', '탈수', '제발', '오픈', '솔직하다', '여러가지', '재미', '레전드', '코스', '추천', '바다', '울트라', '코스', '추천', '사진', '사진', '인화', '신청', '아이스크림', '후회', '껄껄', '무새']",Positive,0.9418188333511353
