store_name,address,nickname,content,cleaned_content,tokenized_words,sentiment,sentiment_score
서울스카이,서울 송파구 올림픽로 300 117~123층,아장아장4091,비가와서 안개가 많이 끼어서 뷰가 좀 아쉬웠어요. 그렇지만 신기했답니다.  명절이라 사람도 많아서 사진찍기 좀 힘들기도 했어요. 엘레베이터도 1시간 정도 대기해야 해서....다음번에는 체험활동이랑 123라운지도가봐야겠어요.,비가와서 안개가 많이 끼어서 뷰가 좀 아쉬웠어요. 그렇지만 신기했답니다. 명절이라 사람도 많아서 사진찍기 좀 힘들기도 했어요. 엘레베이터도 1시간 정도 대기해야 해서....다음번에는 체험활동이랑 123라운지도가봐야겠어요.,"['안개', '아쉽다', '신기하다', '명절', '사람', '많다', '사진', '찍기', '힘들다', '기도', '엘레베이터', '정도', '대기', '다음', '체험', '활동', '라운지']",Positive,0.9631035923957825
서울스카이,서울 송파구 올림픽로 300 117~123층,효니1764,가격에 비해별로였다..! 너무 대기도 길고 비도와서 잘보이지도않았음..,가격에 비해별로였다..! 너무 대기도 길고 비도와서 잘보이지도않았음..,"['가격', '별로', '대기', '길다', '비도']",Negative,0.9609226584434509
서울스카이,서울 송파구 올림픽로 300 117~123층,ggamani36,엄마가 오랫만에 서울오셔서 모시고 갔는데 타이밍 기가 막히게 비가 와서 사실 제대로 된 구경을 못시켜드려 아쉬웠습니다. 구름이 대부분. 한쪽은 거의 못봤어요. 날씨 좋으면 좋을 것 같습니다아무래도 동선은 좀... 아쉬웠고 쉴 공간이 여유가 있으면 더 좋을 듯 합니다,엄마가 오랫만에 서울오셔서 모시고 갔는데 타이밍 기가 막히게 비가 와서 사실 제대로 된 구경을 못시켜드려 아쉬웠습니다. 구름이 대부분. 한쪽은 거의 못봤어요. 날씨 좋으면 좋을 것 같습니다아무래도 동선은 좀... 아쉬웠고 쉴 공간이 여유가 있으면 더 좋을 듯 합니다,"['엄마', '서울', '모시', '타이밍', '사실', '제대로', '구경', '아쉽다', '구름', '대부분', '한쪽', '거의', '날씨', '좋다', '좋다', '같다', '동선', '아쉽다', '공간', '여유', '있다', '좋다']",Positive,0.5057711005210876
서울스카이,서울 송파구 올림픽로 300 117~123층,ask****,지인들과 함께 스카이전망대를 이용했어요.커피도 마시고 뷰도 감상하고 사진도 찍고 즐거운 친목이었습니다.,지인들과 함께 스카이전망대를 이용했어요.커피도 마시고 뷰도 감상하고 사진도 찍고 즐거운 친목이었습니다.,"['지인', '스카이', '전망대', '이용', '커피', '감상', '사진', '즐겁다', '친목']",Positive,0.9688981771469116
서울스카이,서울 송파구 올림픽로 300 117~123층,꾹이01,서울 나들이로 데이트하기좋아요공원도 크게있어서 걷기도좋고나무로 그늘되어있어 선선하니 다니기좋았어요,서울 나들이로 데이트하기좋아요공원도 크게있어서 걷기도좋고나무로 그늘되어있어 선선하니 다니기좋았어요,"['서울', '나들이', '데이트', '좋다', '공원', '크게', '있다', '걷기', '좋다', '나무', '그늘', '선선', '좋다']",Positive,0.971118152141571
서울스카이,서울 송파구 올림픽로 300 117~123층,이재훈8314,즐거운시간 뷰가 좋아요,즐거운시간 뷰가 좋아요,"['즐겁다', '시간', '좋다']",Positive,0.9712775945663452
서울스카이,서울 송파구 올림픽로 300 117~123층,공지사항19,한눈에 보이는 서울이 아이와 함께하기 너무 좋아요,한눈에 보이는 서울이 아이와 함께하기 너무 좋아요,"['한눈', '서울', '아이', '좋다']",Positive,0.9724025726318359
서울스카이,서울 송파구 올림픽로 300 117~123층,률쓰 3남매아빠,"멋지네요. 대한민국 최고 높이!아이들도 좋아했고, 교통편이 양호하니 접근성이 크게 떨어지지 않고 잘 구경하고 왔습니다.미취학 자녀가 있는 집도 추천합니다.","멋지네요. 대한민국 최고 높이!아이들도 좋아했고, 교통편이 양호하니 접근성이 크게 떨어지지 않고 잘 구경하고 왔습니다.미취학 자녀가 있는 집도 추천합니다.","['멋지다', '대한민국', '최고', '높이', '아이', '좋아하다', '교통', '편이', '양호', '접근성', '크게', '구경', '미취', '자녀', '있다', '집도', '추천']",Positive,0.973086416721344
서울스카이,서울 송파구 올림픽로 300 117~123층,온새미로j,한번쯤은 가보길 추천~ 표현할수없는 자연앞에. 인간이 만든 건물들... 아름답게 어우러지는~ 훗날 어떻게 변할지도 궁금해지네~,한번쯤은 가보길 추천 표현할수없는 자연앞에. 인간이 만든 건물들... 아름답게 어우러지는 훗날 어떻게 변할지도 궁금해지네,"['한번', '추천', '표현', '없다', '자연', '인간', '건물', '아름답다', '훗날', '어떻다', '변하다', '궁금하다']",Positive,0.9732551574707031
서울스카이,서울 송파구 올림픽로 300 117~123층,참입맛광배,디즈니랑 협업 기간인가 봄,디즈니랑 협업 기간인가 봄,"['디즈니', '협업', '기간']",Negative,0.8596538305282593
서울스카이,서울 송파구 올림픽로 300 117~123층,안동100곰,기념품으로 마그넷 구매!!!,기념품으로 마그넷 구매!!!,"['기념품', '마그넷', '구매']",Positive,0.7454901933670044
서울스카이,서울 송파구 올림픽로 300 117~123층,참이슬2996,"다 좋아요 근데 사실 벨루가 보러 간건데 윗층 , 아랫층 돌아다녀도 벨루가가 없어서 물어보니 쉬고 있는 것 같다해서 기다리는데 하도 안나오더라구요 ,,,근데 단체 안내하시는 분이 벨루가 수조 청소중이라고 하는 바람에 청소중이라는걸 알았어요 ,,,,벨루가만 40분 기다리다 지쳐 그냥 왔네요 ㅠㅠ수조 앞이나 뭐 사전에 안내라도 했으면 좋았을 것 같아요 ,,,벨루가 때문에 여기 왔는데 보지도 못하고 아쉽네요","다 좋아요 근데 사실 벨루가 보러 간건데 윗층 , 아랫층 돌아다녀도 벨루가가 없어서 물어보니 쉬고 있는 것 같다해서 기다리는데 하도 안나오더라구요 ,,,근데 단체 안내하시는 분이 벨루가 수조 청소중이라고 하는 바람에 청소중이라는걸 알았어요 ,,,,벨루가만 40분 기다리다 지쳐 그냥 왔네요 ㅠㅠ수조 앞이나 뭐 사전에 안내라도 했으면 좋았을 것 같아요 ,,,벨루가 때문에 여기 왔는데 보지도 못하고 아쉽네요","['좋다', '사실', '벨루가', '벨루가', '없다', '있다', '같다', '단체', '안내', '벨루가', '수조', '청소', '바람', '청소', '는걸', '벨루가', '그냥', '수조', '사전', '안내', '좋다', '같다', '벨루가', '때문', '여기', '보지', '아쉽다']",Negative,0.8485086560249329
서울스카이,서울 송파구 올림픽로 300 117~123층,먹고마시고놀고또먹고,"그냥 딱 서울 시내 궁금하면 가볼법 해요.다만 금액도 너무 비싸고, 들어가는 법도 구불구불 정신없고, 무한 대기라 추천은 못하겠습니다.","그냥 딱 서울 시내 궁금하면 가볼법 해요.다만 금액도 너무 비싸고, 들어가는 법도 구불구불 정신없고, 무한 대기라 추천은 못하겠습니다.","['그냥', '서울', '시내', '궁금하다', '다만', '금액', '비싸다', '법도', '정신', '없다', '무한', '대기', '추천']",Negative,0.928097665309906
서울스카이,서울 송파구 올림픽로 300 117~123층,윤정플라워,사진만 남길 수 있는... 즐길거 1도 없음^^ㅎ솔직히 돈 아깝습미다.그리고 더웠어요.,사진만 남길 수 있는... 즐길거 1도 없음ㅎ솔직히 돈 아깝습미다.그리고 더웠어요.,"['사진', '있다', '없다', '솔직하다', '아깝다', '밉다', '덥다']",Negative,0.9635555744171143
서울스카이,서울 송파구 올림픽로 300 117~123층,rab****,부모님하고 방문했는데 한번쯤은 와볼만 하네요,부모님하고 방문했는데 한번쯤은 와볼만 하네요,"['부모님', '방문', '한번']",Positive,0.9638832211494446
서울스카이,서울 송파구 올림픽로 300 117~123층,shi****,평일이지만 사람이 많아 대기 후 입장할수 있었습니다. 방문일 미세먼지가 좋지 않아 뿌옇게 보인건 아쉬웠지만 층마다 아기자기하게 잘 꾸며 놓은 것 같아요,평일이지만 사람이 많아 대기 후 입장할수 있었습니다. 방문일 미세먼지가 좋지 않아 뿌옇게 보인건 아쉬웠지만 층마다 아기자기하게 잘 꾸며 놓은 것 같아요,"['평일', '사람', '많다', '대기', '입장', '있다', '방문', '미세먼지', '좋다', '뿌옇다', '아쉽다', '아기자기하다', '같다']",Positive,0.9693217277526855
서울스카이,서울 송파구 올림픽로 300 117~123층,크앙이둘 엄마,노을질때가니까 너무 좋네요,노을질때가니까 너무 좋네요,['좋다'],Positive,0.9646013975143433
서울스카이,서울 송파구 올림픽로 300 117~123층,제이당28,서울 야경을 예쁘게 볼 수 있어서 좋았어요,서울 야경을 예쁘게 볼 수 있어서 좋았어요,"['서울', '야경', '예쁘다', '있다', '좋다']",Positive,0.9636356234550476
서울스카이,서울 송파구 올림픽로 300 117~123층,KIMNIM,예쁘게 사진 잘 찍고 갔어요! 저녁먹고 8시반 넘어 갔더니 관람시간이 조금 부족했어요~9시 45분이면 다 내려가라 하시네요!,예쁘게 사진 잘 찍고 갔어요! 저녁먹고 8시반 넘어 갔더니 관람시간이 조금 부족했어요9시 45분이면 다 내려가라 하시네요!,"['예쁘다', '사진', '저녁', '관람', '시간', '조금', '부족하다']",Positive,0.931546688079834
서울스카이,서울 송파구 올림픽로 300 117~123층,막사는듯잘사는듯,생각보다 볼 거 많고 재밌어요. 콜라보도 자주 하는듯,생각보다 볼 거 많고 재밌어요. 콜라보도 자주 하는듯,"['생각', '많다', '재밌다', '콜라보', '자주']",Positive,0.9737754464149475
서울스카이,서울 송파구 올림픽로 300 117~123층,노는여자1,서울스카이전망대 ~~부산엘시티보다 더 높은곳 ~아찔한곳이 많고 뷰가 멋쪄요서울이 한곳에 다 보여서 사진 엄청 찍었어요한번쯤은 꼭 와봐야할곳서울스카이 전망대 ~~ 좋아요,서울스카이전망대 부산엘시티보다 더 높은곳 아찔한곳이 많고 뷰가 멋쪄요서울이 한곳에 다 보여서 사진 엄청 찍었어요한번쯤은 꼭 와봐야할곳서울스카이 전망대 좋아요,"['서울', '스카이', '전망대', '부산', '시티', '높다', '아찔하다', '많다', '서울', '사진', '한번', '야하다', '서울', '스카이', '전망대', '좋다']",Positive,0.9754044413566589
서울스카이,서울 송파구 올림픽로 300 117~123층,lsb****,날이 좋아서 뷰가 너무 좋았어요꼭대기에 아이스크림도 맛있었어요~~,날이 좋아서 뷰가 너무 좋았어요꼭대기에 아이스크림도 맛있었어요,"['좋다', '좋다', '꼭대기', '아이스크림', '맛있다']",Positive,0.9732654690742493
서울스카이,서울 송파구 올림픽로 300 117~123층,Commander1012,모든 포토존에서 사진 찍으시고 제일 마음에 드는 사진 한 장 인화하시면 모든 사진 파일 받을 수 있어요!15000원에 모든 사진 파일이면 가성비 좋다고 생각합니다! 저희 가족은 일부 포토존에서 사진 안 찍고 3장 짜리 구매했는데 일부 포토존에서 사진 안 찍은 거 매우 후회 중 ㅠㅜㅋㅋ,모든 포토존에서 사진 찍으시고 제일 마음에 드는 사진 한 장 인화하시면 모든 사진 파일 받을 수 있어요!15000원에 모든 사진 파일이면 가성비 좋다고 생각합니다! 저희 가족은 일부 포토존에서 사진 안 찍고 3장 짜리 구매했는데 일부 포토존에서 사진 안 찍은 거 매우 후회 중 ㅠㅜㅋㅋ,"['모든', '포토', '사진', '제일', '마음', '사진', '인화', '모든', '사진', '파일', '있다', '모든', '사진', '파일', '이면', '가성', '좋다', '생각', '저희', '가족', '일부', '포토', '사진', '구매', '일부', '포토', '사진', '매우', '후회']",Positive,0.9239860773086548
서울스카이,서울 송파구 올림픽로 300 117~123층,super우먼,구름이 타워위에 머물고있어서 입장할때마다 날씨안내를 듣고 올라갔는데  올라가보니 다행히 구름이 걷혀서 전망이 좋았습니다! 평일이라서 사람이 적어서 조용하게 즐기고 왔습니다~,구름이 타워위에 머물고있어서 입장할때마다 날씨안내를 듣고 올라갔는데 올라가보니 다행히 구름이 걷혀서 전망이 좋았습니다! 평일이라서 사람이 적어서 조용하게 즐기고 왔습니다,"['구름', '타워', '입장', '날씨', '안내', '다행하다', '구름', '전망', '좋다', '평일', '사람', '조용하다']",Positive,0.9436256885528564
서울스카이,서울 송파구 올림픽로 300 117~123층,깨어진꿈결,처음 방문했는 데 너무 만족했어요,처음 방문했는 데 너무 만족했어요,"['처음', '방문', '만족하다']",Positive,0.9720416069030762
서울스카이,서울 송파구 올림픽로 300 117~123층,세줄후추,"큰돈 주고 경험할 일은 아닌거 같아요주변에 고층건물이 많아 높아 보이지도 않고 , 사람도 많고진짜 한번만 가볼 정도?","큰돈 주고 경험할 일은 아닌거 같아요주변에 고층건물이 많아 높아 보이지도 않고 , 사람도 많고진짜 한번만 가볼 정도?","['경험', '아니다', '같다', '주변', '고층', '건물', '많다', '높다', '보이지', '사람', '많다', '진짜', '한번', '정도']",Negative,0.846153974533081
서울스카이,서울 송파구 올림픽로 300 117~123층,bat****,길 가따가 우연히 들어가서 운동도 하고 재미있는 게임들도 하고 즐거웠어요!!!,길 가따가 우연히 들어가서 운동도 하고 재미있는 게임들도 하고 즐거웠어요!!!,"['따갑다', '운동', '재미있다', '게임', '즐겁다']",Positive,0.97213214635849
서울스카이,서울 송파구 올림픽로 300 117~123층,고구마ㅋ,😊😊😊😊😊😊😊,,[],Neutral,0.0
서울스카이,서울 송파구 올림픽로 300 117~123층,DYC416,너무 만족스럽게 구경 잘했습니다,너무 만족스럽게 구경 잘했습니다,"['만족', '구경']",Positive,0.9733116626739502
서울스카이,서울 송파구 올림픽로 300 117~123층,청포도가익는계절,멋져요!  우리나라 건물중 가장 높은곳에서 볼수 있는 뷰..한번쯤 가볼만해요,멋져요! 우리나라 건물중 가장 높은곳에서 볼수 있는 뷰..한번쯤 가볼만해요,"['멋지다', '우리나라', '건물', '가장', '높다', '있다', '한번', '만해']",Positive,0.9744701981544495
서울스카이,서울 송파구 올림픽로 300 117~123층,따뜻해530,너무멋졌어요,너무멋졌어요,['멋지다'],Positive,0.9746599793434143
서울스카이,서울 송파구 올림픽로 300 117~123층,지구별 탐험가,"전통과 현대적 감각의 영상 퀄리티 👍 이번에도 놀이동산 갈까했다가..날이 너무 더워서 아쿠아리움+타워로 결정했는데, 해외여행가서 남의나라 타워를 기어코 갔는데 우리나라 타워를 이제사 가보다니..반성합니다ㅋ아직 안가보셨다면...추천드립니다. 붐비지도 않고 적당했어요어느새 4천뷰_","전통과 현대적 감각의 영상 퀄리티 이번에도 놀이동산 갈까했다가..날이 너무 더워서 아쿠아리움타워로 결정했는데, 해외여행가서 남의나라 타워를 기어코 갔는데 우리나라 타워를 이제사 가보다니..반성합니다ㅋ아직 안가보셨다면...추천드립니다. 붐비지도 않고 적당했어요어느새 4천뷰","['전통', '현대', '감각', '영상', '퀄리티', '이번', '놀이동산', '덥다', '아쿠아리움', '타워', '결정', '해외여행', '나라', '타워', '기어', '우리나라', '타워', '제사', '반성', '추천', '적당하다', '어느새다']",Positive,0.9087859988212585
서울스카이,서울 송파구 올림픽로 300 117~123층,hye****,입장하기까지 대기가 길긴 했지만 여유롭게 전망감상하기 좋았어요,입장하기까지 대기가 길긴 했지만 여유롭게 전망감상하기 좋았어요,"['입장', '대기', '길다', '전망', '감상', '좋다']",Positive,0.9671667814254761
서울스카이,서울 송파구 올림픽로 300 117~123층,MAY49,또가고싶어요 ㅠㅠ 아이도 저희부부도 너무 잘 놀다갑니다,또가고싶어요 ㅠㅠ 아이도 저희부부도 너무 잘 놀다갑니다,"['아이', '부부']",Positive,0.9747368693351746
서울스카이,서울 송파구 올림픽로 300 117~123층,진여심737,"솔직히 조금 실망했습니다. 지하철에서 어떻게 가는 지 안내가 더 자세하면 좋겠어요. 전망대 위에도 안내 직원이 더 필요한 듯 보입니다. 화장실, 엘리베이터 등등 안내가 너무 부족해요. 저도 초행길인라 헤메는데. 또 저에게 물어보는 분들, 외국인들도 많았어요..아쉽네요","솔직히 조금 실망했습니다. 지하철에서 어떻게 가는 지 안내가 더 자세하면 좋겠어요. 전망대 위에도 안내 직원이 더 필요한 듯 보입니다. 화장실, 엘리베이터 등등 안내가 너무 부족해요. 저도 초행길인라 헤메는데. 또 저에게 물어보는 분들, 외국인들도 많았어요..아쉽네요","['솔직하다', '조금', '실망하다', '지하철', '어떻다', '안내', '자세하다', '좋다', '전망대', '안내', '직원', '필요하다', '화장실', '엘리베이터', '등등', '안내', '부족하다', '초행길', '헤메', '외국인', '많다', '아쉽다']",Negative,0.8932697772979736
서울스카이,서울 송파구 올림픽로 300 117~123층,새강자80,가까이 살지만 지방분들이나 외국인들은 많이 오는데 정작 서울사람이 안오는 곳 같아요엘베도 빠르고 편히볼수 있어서 좋았어요 123층에 레스토랑 있는줄알았으면 식사때 맞춰왔을텐데 롯데타워에서 밥먹고 가서 아쉽습니다ㅎ 아이가 아주 좋아해요,가까이 살지만 지방분들이나 외국인들은 많이 오는데 정작 서울사람이 안오는 곳 같아요엘베도 빠르고 편히볼수 있어서 좋았어요 123층에 레스토랑 있는줄알았으면 식사때 맞춰왔을텐데 롯데타워에서 밥먹고 가서 아쉽습니다ㅎ 아이가 아주 좋아해요,"['가까이', '지방', '외국인', '정작', '사람', '같다', '엘베', '빠르다', '편하다', '있다', '좋다', '레스토랑', '있다', '식사', '롯데', '타워', '아쉽다', '아이', '아주', '좋아하다']",Positive,0.9625463485717773
서울스카이,서울 송파구 올림픽로 300 117~123층,시그마걸옥지,단언컨데 우리나라에서 제일 멋진 야경을 볼 수 있는 곳은 여기가 아닐까..👍🏻,단언컨데 우리나라에서 제일 멋진 야경을 볼 수 있는 곳은 여기가 아닐까..,"['컨데', '우리나라', '제일', '멋지다', '야경', '있다', '여기', '아니다']",Positive,0.9693692922592163
서울스카이,서울 송파구 올림픽로 300 117~123층,caca3193,볼거리가 많아 돈이 아깝지 않아요다시 또 오고 싶어요,볼거리가 많아 돈이 아깝지 않아요다시 또 오고 싶어요,"['볼거리', '많다', '아깝다', '다시']",Positive,0.9729209542274475
서울스카이,서울 송파구 올림픽로 300 117~123층,eun****,날이 맑은 날 꼭 가보셔요~!한번정도는 한국살면서 방문하면 좋을 곳입니다^^노을 시간 맞게 갔더니 더 훌륭했네요.에어컨은 약해서 내부는 외부보다 더운 감 있었어요,날이 맑은 날 꼭 가보셔요!한번정도는 한국살면서 방문하면 좋을 곳입니다노을 시간 맞게 갔더니 더 훌륭했네요.에어컨은 약해서 내부는 외부보다 더운 감 있었어요,"['맑은', '한번', '정도', '한국', '방문', '좋다', '이다', '노을', '시간', '훌륭하다', '에어컨', '약하다', '내부', '외부', '덥다', '있다']",Positive,0.972798764705658
서울스카이,서울 송파구 올림픽로 300 117~123층,gumeo100,부모님이 지방에서 올라오셔서 서울나들이합니다.볼거리가 아주 다양하게 있어요~~ 1분만에 오른 초고속엘베부터 고층뷰가 아주 절경입니다. 아이들도 신기해하며 너무 즐거운 시간보냈어요.곳곳에 사진찍을 곳도 많고  최고네요^^,부모님이 지방에서 올라오셔서 서울나들이합니다.볼거리가 아주 다양하게 있어요 1분만에 오른 초고속엘베부터 고층뷰가 아주 절경입니다. 아이들도 신기해하며 너무 즐거운 시간보냈어요.곳곳에 사진찍을 곳도 많고 최고네요,"['부모님', '지방', '나들이', '볼거리', '아주', '다양하다', '있다', '오른', '초고', '엘베', '고층', '아주', '절경', '이다', '아이', '신기하다', '즐겁다', '시간', '곳곳', '사진', '곳도', '많다', '최고']",Positive,0.9747359752655029
서울스카이,서울 송파구 올림픽로 300 117~123층,포시즌스토어,너무 무서워요 뷰는 좋아요,너무 무서워요 뷰는 좋아요,"['무섭다', '좋다']",Positive,0.967948317527771
서울스카이,서울 송파구 올림픽로 300 117~123층,햇병아리쥬,181층 까지 1분도 안걸려서 이동ㅎ 신기했어요~서울 야경도 이쁘고 너무 좋은 경험이었어요ㅎ,181층 까지 1분도 안걸려서 이동ㅎ 신기했어요서울 야경도 이쁘고 너무 좋은 경험이었어요ㅎ,"['이동', '신기하다', '서울', '야경', '이쁘다', '좋다', '경험']",Positive,0.9742151498794556
서울스카이,서울 송파구 올림픽로 300 117~123층,Jolie Laide9,노을이 걸렸을때 도착해서 멋졌어요 주말이라 혼잡했지만 보안요원들이 정리를 잘해주셨어요 쇼공간이 협소했지만 간단히 즐기기 좋았어요,노을이 걸렸을때 도착해서 멋졌어요 주말이라 혼잡했지만 보안요원들이 정리를 잘해주셨어요 쇼공간이 협소했지만 간단히 즐기기 좋았어요,"['노을', '도착', '멋지다', '주말', '혼잡하다', '보안요원', '정리', '공간', '협소했', '간단하다', '좋다']",Positive,0.9737846851348877
서울스카이,서울 송파구 올림픽로 300 117~123층,블루데이지비누,서울 여행 중 다녀온 곳미리 할인받아 티켓 구매 후 입장다음번엔 야경보러 오고싶네요,서울 여행 중 다녀온 곳미리 할인받아 티켓 구매 후 입장다음번엔 야경보러 오고싶네요,"['서울', '여행', '미리', '할인', '티켓', '구매', '음번', '야경']",Positive,0.9653165936470032
서울스카이,서울 송파구 올림픽로 300 117~123층,pyw****,하필 안개껴서 최악이었음…,하필 안개껴서 최악이었음,"['하필', '안개', '최악']",Negative,0.9329296946525574
서울스카이,서울 송파구 올림픽로 300 117~123층,쭈운이50,부모님과 함께 방문했어요~ 주말이라 사람 많을 것을 예상했지만 생각보다 대기를 많이 하진 않은 것 같아요~높은 곳에서 보는 뷰는 말해 뭐해요~ 포토존도 너무 예쁘게 잘 되어 있어 좋았습니다!!🤗,부모님과 함께 방문했어요 주말이라 사람 많을 것을 예상했지만 생각보다 대기를 많이 하진 않은 것 같아요높은 곳에서 보는 뷰는 말해 뭐해요 포토존도 너무 예쁘게 잘 되어 있어 좋았습니다!!,"['부모님', '방문', '주말', '사람', '많다', '예상', '생각', '대기', '하진', '같다', '높다', '포토', '예쁘다', '있다', '좋다']",Positive,0.9727941155433655
서울스카이,서울 송파구 올림픽로 300 117~123층,httr23,급으로 떠난 가족여행에서 네이버예약까지ㅋㅋ주말인데 대기짧게해서 멋진구경했습니다^^,급으로 떠난 가족여행에서 네이버예약까지ㅋㅋ주말인데 대기짧게해서 멋진구경했습니다,"['가족', '여행', '네이버', '예약', '주말', '대기', '짧게하다', '멋지다', '구경']",Positive,0.9562798142433167
서울스카이,서울 송파구 올림픽로 300 117~123층,kim****,야경이 너무 이뻤습니다 아이도 무서워하지않아서 좋았아요 다만 몰린 사람들이많아서인지 더웠습니당 ㅠㅠ,야경이 너무 이뻤습니다 아이도 무서워하지않아서 좋았아요 다만 몰린 사람들이많아서인지 더웠습니당 ㅠㅠ,"['야경', '이쁘다', '아이', '무섭다', '좋다', '다만', '사람', '많다', '인지', '덥다']",Positive,0.969964861869812
서울스카이,서울 송파구 올림픽로 300 117~123층,빤선생82,시설이 깔끔하고 안전해요 역시 랜드마크,시설이 깔끔하고 안전해요 역시 랜드마크,"['시설', '깔끔하다', '안전하다', '역시', '랜드마크']",Positive,0.9742981791496277
