store_name,address,nickname,content,cleaned_content,tokenized_words,sentiment,sentiment_score
광명동굴,경기 광명시 가학로85번길 142,교교다,"볼거리가 많아요 나들이로 추천합니다👍주차장은 1,2 두 군데  동굴까지는 5-10분정도 올라가는 길이 있어요!올라가는 길도 경사가 완만한 코스도 따로 만들어놔서 아이들도 엄마아빠 손잡고 많이들 가더라구요!당일 키오스크 사용안된다고 적혀있는데 어떤 분 후기에 된다고 하셔서 해봤는데 진짜 됩니다,,🫢네이버로 티켓구매하고 매표소옆에 있는 키오스크쪽가서 바코드 스캔! 조금 더 저렴하게 갈 수 있어요ㅎㅎ동굴은 왕복 40분 코스이고,9월말에 갔는데 오래있으니까 약간 서늘해서 (추위 많이타시는 분들은) 얇은 겉옷 챙겨가시는 거 추천해요중반부터 오르락내리락 하는 계단이 좀 많아서 편한 운동화 신고가셔요ㅠㅠ!동굴도 볼거리가 많고, 나와서도 넓은 광장도 있어서 가족단위로 오시기 좋을 거 같아요☺️","볼거리가 많아요 나들이로 추천합니다주차장은 1,2 두 군데 동굴까지는 510분정도 올라가는 길이 있어요!올라가는 길도 경사가 완만한 코스도 따로 만들어놔서 아이들도 엄마아빠 손잡고 많이들 가더라구요!당일 키오스크 사용안된다고 적혀있는데 어떤 분 후기에 된다고 하셔서 해봤는데 진짜 됩니다,,네이버로 티켓구매하고 매표소옆에 있는 키오스크쪽가서 바코드 스캔! 조금 더 저렴하게 갈 수 있어요ㅎㅎ동굴은 왕복 40분 코스이고,9월말에 갔는데 오래있으니까 약간 서늘해서 추위 많이타시는 분들은 얇은 겉옷 챙겨가시는 거 추천해요중반부터 오르락내리락 하는 계단이 좀 많아서 편한 운동화 신고가셔요ㅠㅠ!동굴도 볼거리가 많고, 나와서도 넓은 광장도 있어서 가족단위로 오시기 좋을 거 같아요","['볼거리', '많다', '나들이', '추천', '주차장', '군데', '동굴', '길이', '있다', '길다', '경사', '완만', '코스', '아이', '엄마', '아빠', '당일', '오스', '사용', '안되다', '어떻다', '후기', '진짜', '네이버', '티켓', '구매', '매표소', '있다', '오스', '바코드', '스캔', '조금', '저렴하다', '있다', '동굴', '왕복', '코스', '있다', '약간', '서늘하다', '추위', '얇다', '겉옷', '추천', '중반', '오르락내리락', '계단', '많다', '편하다', '운동화', '동굴', '볼거리', '많다', '넓다', '광장', '있다', '가족', '위로', '시기', '좋다', '같다']",Positive,0.9547582268714905
광명동굴,경기 광명시 가학로85번길 142,tns****,예쁘다 볼거리가많고 아이들이 좋아했다.몰랐는데 티켓발행하다 알게되었는데다둥이혜택이있었다 ~최고!,예쁘다 볼거리가많고 아이들이 좋아했다.몰랐는데 티켓발행하다 알게되었는데다둥이혜택이있었다 최고!,"['예쁘다', '볼거리', '많다', '아이', '좋아하다', '티켓', '발행', '둥이', '혜택', '있다', '최고']",Positive,0.9740511178970337
광명동굴,경기 광명시 가학로85번길 142,Zbaa,"광명동굴. 이름은 이전부터 쭈욱 들어왔고 가벼운 마음으로 입장~입구부터 냉랭한 바람이 불어왔고 수족관, 미디어파사드, 황금존, 지하세계, 근대사, 와인 주제별로 나누어져 있어 볼거리가 다채로웠음.기대치이상으로 즐거웠고 특히 드래곤의 위용은 남달랐음. 살아숨쉬는 것만 같고 가장 오래 머물다 갔습니다. 오르락내리락 계단이 힘들고 기온이 낮아 어린이, 노약자분은 유의필요.사견으로 동굴을 배경으로한 테마의 전시물이 스팟성으로 전개되면 재밌겠다~ 싶습니다.폐광을 훌륭한 콘텐츠로 승화시켜주셔서 감삼다.","광명동굴. 이름은 이전부터 쭈욱 들어왔고 가벼운 마음으로 입장입구부터 냉랭한 바람이 불어왔고 수족관, 미디어파사드, 황금존, 지하세계, 근대사, 와인 주제별로 나누어져 있어 볼거리가 다채로웠음.기대치이상으로 즐거웠고 특히 드래곤의 위용은 남달랐음. 살아숨쉬는 것만 같고 가장 오래 머물다 갔습니다. 오르락내리락 계단이 힘들고 기온이 낮아 어린이, 노약자분은 유의필요.사견으로 동굴을 배경으로한 테마의 전시물이 스팟성으로 전개되면 재밌겠다 싶습니다.폐광을 훌륭한 콘텐츠로 승화시켜주셔서 감삼다.","['광명', '동굴', '이름', '이전', '쭈욱', '가볍다', '마음', '입장', '입구', '냉랭하다', '바람', '수족관', '미디어', '파사드', '황금', '지하세계', '근대사', '와인', '주제', '별로', '있다', '볼거리', '다채로웠음', '대치', '이상', '즐겁다', '드래곤', '남다르다', '같다', '가장', '오르락내리락', '계단', '힘들다', '기온', '낮다', '어린이', '약자', '유의', '필요', '사견', '동굴', '배경', '테마', '전시', '물이', '스팟', '전개', '재밌다', '폐광', '훌륭하다', '콘텐츠', '승화']",Positive,0.9713257551193237
광명동굴,경기 광명시 가학로85번길 142,김지윤5,"볼거리도 다양하고 바닥에 관람순서도 잘 안내되어있어서 관람객들이랑 서로 부딪힐 일 없이 편안하게 관람했어요~~ 난생처음 로봇물고기 봤는데 진짜신기하고,, 관람공연? 비스무리하게도 해서 너무 볼거리 다양했어요! 데이트로 가도 좋고 다른나라에사 관광객으로도 많이 오는 것 같아요 ㅎㅎ 주차도 편하고 그리 힘들지도 않으니 꼭 가보시길 추천해요!","볼거리도 다양하고 바닥에 관람순서도 잘 안내되어있어서 관람객들이랑 서로 부딪힐 일 없이 편안하게 관람했어요 난생처음 로봇물고기 봤는데 진짜신기하고,, 관람공연? 비스무리하게도 해서 너무 볼거리 다양했어요! 데이트로 가도 좋고 다른나라에사 관광객으로도 많이 오는 것 같아요 ㅎㅎ 주차도 편하고 그리 힘들지도 않으니 꼭 가보시길 추천해요!","['볼거리', '다양하다', '바닥', '관람', '순서도', '관람객', '서로', '편안하다', '관람', '난생처음', '로봇', '물고기', '진짜', '신기하다', '관람', '공연', '리하', '볼거리', '다양하다', '데이트', '가도', '좋다', '나라', '관광객', '같다', '주차', '편하다', '힘들다', '추천']",Positive,0.9710503816604614
광명동굴,경기 광명시 가학로85번길 142,행복이구,광명동굴~♡♡가까운곳에 동굴이...?!!시원하니~ 볼거리도 많아요!!안내하시는 분들도 적재적소에서 친절하게 안내해주셔서 좋아요~♡♡이른시간에 갔는데도 사람들도 엄청 많네요!!그런데 시설들도 엄청 깨끗하고 관리도 엄청 신경 쓰시는게 느껴집니다!! 화장실도 엄청 깨끗해요!!!시간가는줄 모르고 시원하게잘 보고 갑니다~♡♡+ 반팔입고 구경했는데 추운느낌은 없고   슬리퍼 신고 1시간넘게 편하게 구경했어요~,광명동굴가까운곳에 동굴이...?!!시원하니 볼거리도 많아요!!안내하시는 분들도 적재적소에서 친절하게 안내해주셔서 좋아요이른시간에 갔는데도 사람들도 엄청 많네요!!그런데 시설들도 엄청 깨끗하고 관리도 엄청 신경 쓰시는게 느껴집니다!! 화장실도 엄청 깨끗해요!!!시간가는줄 모르고 시원하게잘 보고 갑니다 반팔입고 구경했는데 추운느낌은 없고 슬리퍼 신고 1시간넘게 편하게 구경했어요,"['광명', '동굴', '가깝다', '동굴', '시원하다', '볼거리', '많다', '안내', '적재적소', '친절하다', '안내', '좋다', '시간', '사람', '많다', '시설', '깨끗하다', '관리', '신경', '화장실', '깨끗하다', '시간', '시원하다', '보고', '구경', '느낌', '없다', '슬리퍼', '신고', '편하다', '구경']",Positive,0.973757266998291
광명동굴,경기 광명시 가학로85번길 142,예띠용,작년 추석연휴때 특별한 데이트를 찾다 동굴데이트를 다녀왔어요ㅋㅋ. 은근 사람도 많고 외국인 관광객들도 많았습니다. 동굴이라 해서 칙칙한 분위기일줄 알았는데 잘꾸며놔서 볼거리도 많고 포토스팟도 많아요:)수족관과 작은 식물원이 있는것도 정말 신기하고 광명동굴의 역사도 알 수있어 유익했습니다. 그러나 가장 기대한 공포체험관이 문을 닫은것은 아쉬웠어요ㅠㅠ.. 버스가 다녀서 뚜벅이들 데이트가기에 좋아요~,작년 추석연휴때 특별한 데이트를 찾다 동굴데이트를 다녀왔어요ㅋㅋ. 은근 사람도 많고 외국인 관광객들도 많았습니다. 동굴이라 해서 칙칙한 분위기일줄 알았는데 잘꾸며놔서 볼거리도 많고 포토스팟도 많아요수족관과 작은 식물원이 있는것도 정말 신기하고 광명동굴의 역사도 알 수있어 유익했습니다. 그러나 가장 기대한 공포체험관이 문을 닫은것은 아쉬웠어요ㅠㅠ.. 버스가 다녀서 뚜벅이들 데이트가기에 좋아요,"['작년', '추석', '연휴', '특별하다', '데이트', '동굴', '데이트', '은근', '사람', '많다', '외국인', '관광객', '많다', '동굴', '칙칙하다', '분위기', '볼거리', '많다', '포토', '스팟', '많다', '수족관', '작다', '식물원', '있다', '정말', '신기하다', '광명', '동굴', '역사', '있다', '유익하다', '가장', '기대하다', '공포', '체험', '아쉽다', '버스', '뚜벅', '데이트', '가기', '좋다']",Positive,0.9701593518257141
광명동굴,경기 광명시 가학로85번길 142,꾸꾸까까a,짧은동굴이지만 한번쯤~,짧은동굴이지만 한번쯤,"['짧다', '동굴', '한번']",Positive,0.8898898363113403
광명동굴,경기 광명시 가학로85번길 142,아배불러50,굳 시원해여,굳 시원해여,"['굳다', '시원하다']",Positive,0.9716637134552002
광명동굴,경기 광명시 가학로85번길 142,콸츠,서울에서 가까운 광명에 동굴이 있다는 게 신기했고 내부 공간을 매우 잘 구획해서 관람거리를 조성해 놓아 볼거리가 많았습니다. 여름엔 피서 대용으로도 널리 사랑 받을 수 있을 듯하네요.,서울에서 가까운 광명에 동굴이 있다는 게 신기했고 내부 공간을 매우 잘 구획해서 관람거리를 조성해 놓아 볼거리가 많았습니다. 여름엔 피서 대용으로도 널리 사랑 받을 수 있을 듯하네요.,"['서울', '가깝다', '광명', '동굴', '있다', '신기하다', '내부', '공간', '매우', '구획', '관람', '거리', '조성', '볼거리', '많다', '여름', '대용', '널리', '사랑', '있다']",Positive,0.9735325574874878
광명동굴,경기 광명시 가학로85번길 142,bisang9,광명동굴~ 입구부터 시원한 바람이 솔솔~ 다양한 테마로 가득한 동굴 계속 계속 여러가지 볼 것들이 많아 지루하지 않았어요!! 그리고 바로 옆에 보물탐험도 너무 재밌더라구요!! 시간이 짧아 아쉽지만 포크레인도 직접 해보고 보석 채취까지 너무 즐거워 했어요!! 다음에도 또 가고 싶어요!! 근처에 피크닉으로 가는것도 나쁘지 않는 곳이예요!!,광명동굴 입구부터 시원한 바람이 솔솔 다양한 테마로 가득한 동굴 계속 계속 여러가지 볼 것들이 많아 지루하지 않았어요!! 그리고 바로 옆에 보물탐험도 너무 재밌더라구요!! 시간이 짧아 아쉽지만 포크레인도 직접 해보고 보석 채취까지 너무 즐거워 했어요!! 다음에도 또 가고 싶어요!! 근처에 피크닉으로 가는것도 나쁘지 않는 곳이예요!!,"['광명', '동굴', '입구', '시원하다', '바람', '솔솔', '다양하다', '테마', '가득하다', '동굴', '계속', '계속', '여러가지', '많다', '지루하다', '바로', '보물', '탐험', '재밌다', '시간', '짧다', '아쉽다', '포크레인', '직접', '보석', '채취', '즐겁다', '다음', '근처', '피크닉', '나쁘다']",Positive,0.9734978675842285
광명동굴,경기 광명시 가학로85번길 142,rebmucuc52,이번이 두 번째 방문인데 2년 전에 방문했을 때에 비해 볼거리가 많이 줄은 탓에 코스가 굉장히 짧게 느껴져서 아쉬움이 많았어요..ㅠㅠ (공포체험도 재밌게 했던 기억이 있어서 기대하고 갔는데 준비 중이었어요ㅠ) 그래도 신기하고 재밌었어요! 참고로 물품 보관소는 따로 없으니 참고하세용,이번이 두 번째 방문인데 2년 전에 방문했을 때에 비해 볼거리가 많이 줄은 탓에 코스가 굉장히 짧게 느껴져서 아쉬움이 많았어요..ㅠㅠ 공포체험도 재밌게 했던 기억이 있어서 기대하고 갔는데 준비 중이었어요ㅠ 그래도 신기하고 재밌었어요! 참고로 물품 보관소는 따로 없으니 참고하세용,"['이번', '방문', '방문', '볼거리', '코스', '굉장하다', '짧다', '아쉬움', '많다', '공포', '체험', '재밌다', '기억', '있다', '기대하다', '준비', '신기하다', '재밌다', '참고', '물품', '보관', '없다', '참고']",Positive,0.9595176577568054
광명동굴,경기 광명시 가학로85번길 142,PeeKaBoO,아이들과 가기 좋을것 같아요~,아이들과 가기 좋을것 같아요,"['아이', '가기', '좋다', '같다']",Positive,0.9713491201400757
광명동굴,경기 광명시 가학로85번길 142,가을소나기잘피해,볼거리'많아서 좋네요,볼거리많아서 좋네요,"['볼거리', '많다', '좋다']",Positive,0.9682174324989319
광명동굴,경기 광명시 가학로85번길 142,소백산3871,광명동굴 노천카페 직원들 정말 불친절하고 일하기 싫어하는 표정과 말투 최악임아메리카노는 정말 먹지 말아야 함 진짜 맛 없어요관리가 안되어서 직원들이 불친절 한듯참고 하세요 너무 황당해서 리뷰함,광명동굴 노천카페 직원들 정말 불친절하고 일하기 싫어하는 표정과 말투 최악임아메리카노는 정말 먹지 말아야 함 진짜 맛 없어요관리가 안되어서 직원들이 불친절 한듯참고 하세요 너무 황당해서 리뷰함,"['광명', '동굴', '노천', '카페', '직원', '정말', '불친절하다', '싫어하다', '표정', '말투', '최악', '아메리카노', '정말', '진짜', '없다', '관리', '안되다', '직원', '불친절', '참고', '황당하다', '리뷰']",Negative,0.9585978388786316
광명동굴,경기 광명시 가학로85번길 142,통통이89,조아요,조아요,['좋다'],Positive,0.9475513100624084
광명동굴,경기 광명시 가학로85번길 142,ㅇㅇㄴ0,굳,굳,['굳다'],Positive,0.9499149918556213
광명동굴,경기 광명시 가학로85번길 142,올리브쇼콜라,한번쯤 갈만합니다~ 크고 깨끗하게 잘 되어있네요. 주말에 갔는데도 사람 많이 없어서 여유롭게 구경했어요! 옆에 아이 체험관도 갔었는데 거긴 좀 비싸다는 생각이 드네요 ㅠㅠㅎㅎ,한번쯤 갈만합니다 크고 깨끗하게 잘 되어있네요. 주말에 갔는데도 사람 많이 없어서 여유롭게 구경했어요! 옆에 아이 체험관도 갔었는데 거긴 좀 비싸다는 생각이 드네요 ㅠㅠㅎㅎ,"['한번', '깨끗하다', '주말', '사람', '없다', '구경', '아이', '체험', '관도', '비싸다', '생각', '드네']",Positive,0.9739100933074951
광명동굴,경기 광명시 가학로85번길 142,취미사진가 히아신스,동굴안이 다양하게 이쁘게 밝게 잘 꾸며둬서 시간 가는 줄 모르고 감상하고 보고 서로의 추억 한편을 담을 수 있었네요 다음에 또 시간내서 들러보겠습니다 너무 행복 했습니다 무엇보다 사진엔 없지만 와인 시음 할 수 있는 것도 정말 좋았습니다,동굴안이 다양하게 이쁘게 밝게 잘 꾸며둬서 시간 가는 줄 모르고 감상하고 보고 서로의 추억 한편을 담을 수 있었네요 다음에 또 시간내서 들러보겠습니다 너무 행복 했습니다 무엇보다 사진엔 없지만 와인 시음 할 수 있는 것도 정말 좋았습니다,"['동굴', '안이', '다양하다', '이쁘다', '시간', '감상', '보고', '서로', '추억', '한편', '있다', '다음', '시간', '행복', '무엇', '사진', '없다', '와인', '있다', '정말', '좋다']",Positive,0.9747110605239868
광명동굴,경기 광명시 가학로85번길 142,sun****,광명동굴~♡,광명동굴,"['광명', '동굴']",Positive,0.8440333008766174
광명동굴,경기 광명시 가학로85번길 142,케이B용,예전부터 이름만 들어봤지 별거없다 생각하고 가보진 않았는데 들어가자마자 시원하고 기분이 너무 좋았어요 볼거리도 많고 전 운전때문에 못 마셨는데 와인도 마시고 구매하실 수 있어서 너무 아쉬웠어요 😅 강추합니다 ~,예전부터 이름만 들어봤지 별거없다 생각하고 가보진 않았는데 들어가자마자 시원하고 기분이 너무 좋았어요 볼거리도 많고 전 운전때문에 못 마셨는데 와인도 마시고 구매하실 수 있어서 너무 아쉬웠어요 강추합니다,"['예전', '이름', '별거', '없다', '생각', '시원하다', '기분', '좋다', '볼거리', '많다', '운전', '때문', '와인', '구매', '있다', '아쉽다', '추하다']",Positive,0.9702906608581543
광명동굴,경기 광명시 가학로85번길 142,아이디트랙,아이들과 주말에 방문했어요 관람객이 꽤 많았지만 워낙 커서 볼만 했습니다. 계단이 있어서 유모차 사용이 안되고 어르신들은 힘들어 하시네요 곳곳에 포토포인트있고 일제감정기 힘든 노동의 역사를 볼 수 있는 점도 의미있었어요 와인시음도 있구요 애들 좋아해요,아이들과 주말에 방문했어요 관람객이 꽤 많았지만 워낙 커서 볼만 했습니다. 계단이 있어서 유모차 사용이 안되고 어르신들은 힘들어 하시네요 곳곳에 포토포인트있고 일제감정기 힘든 노동의 역사를 볼 수 있는 점도 의미있었어요 와인시음도 있구요 애들 좋아해요,"['아이', '주말', '방문', '관람객', '많다', '워낙', '커서', '계단', '있다', '유모차', '사용', '안되다', '어르신', '힘들다', '곳곳', '포토', '포인트', '있다', '일제', '감정', '힘드다', '노동', '역사', '있다', '점도', '의미', '있다', '와인', '있다', '좋아하다']",Positive,0.9735503196716309
광명동굴,경기 광명시 가학로85번길 142,ggdlsh,아기랑 볼게 많았고 계단이 좀있어서 계단 못타는 아기와 다니기가 조금 힘들었습니다.직원분들이 너무친절 하셨고 설명도 잘 해주셨어요,아기랑 볼게 많았고 계단이 좀있어서 계단 못타는 아기와 다니기가 조금 힘들었습니다.직원분들이 너무친절 하셨고 설명도 잘 해주셨어요,"['아기', '많다', '계단', '좋다', '계단', '아기', '조금', '힘들다', '직원', '친절', '설명']",Positive,0.9683793187141418
광명동굴,경기 광명시 가학로85번길 142,Ray5,정말 좋았습니다. 이정도 퀄리티의 체험 기회가 쉽지 않은데 수도권에서 동굴도 보고 거기에 숨겨진 다양한 이야기도 들을 수 있어서 너무 좋았어요.,정말 좋았습니다. 이정도 퀄리티의 체험 기회가 쉽지 않은데 수도권에서 동굴도 보고 거기에 숨겨진 다양한 이야기도 들을 수 있어서 너무 좋았어요.,"['정말', '좋다', '이정', '퀄리티', '체험', '기회', '수도권', '동굴', '보고', '거기', '다양하다', '이야기', '있다', '좋다']",Positive,0.972095787525177
광명동굴,경기 광명시 가학로85번길 142,김치볶볶,간단히 걸을 수 있는 줄 알았는데 계단도 가파르고 아이데려가거나 나이있으신분들이랑 갈때는 조심히 걸어야할듯해요시원하고 안에 깨알같이 볼거리도 많아서 좋아요,간단히 걸을 수 있는 줄 알았는데 계단도 가파르고 아이데려가거나 나이있으신분들이랑 갈때는 조심히 걸어야할듯해요시원하고 안에 깨알같이 볼거리도 많아서 좋아요,"['간단하다', '있다', '계단', '가파르', '아이', '나이', '있다', '신분', '조심', '야하다', '시원하다', '깨알', '볼거리', '많다', '좋다']",Positive,0.9722283482551575
광명동굴,경기 광명시 가학로85번길 142,ooj****,"두번째 방문, 1시간 딱 구경하기에 적당한 동굴 경험ㅡ아쉽다면 작년보다 뭔가 코스가 적어졌다는 느낌이기 하지만 그래도 정기적으로 변화를 주는 것 같아서 이해가 된다.4~7살 아이와 주말 가깝게 다녀가기 좋은곳!","두번째 방문, 1시간 딱 구경하기에 적당한 동굴 경험ㅡ아쉽다면 작년보다 뭔가 코스가 적어졌다는 느낌이기 하지만 그래도 정기적으로 변화를 주는 것 같아서 이해가 된다.47살 아이와 주말 가깝게 다녀가기 좋은곳!","['두번째', '방문', '구경', '적당하다', '동굴', '경험', '아쉽다', '작년', '뭔가', '코스', '느낌', '이기', '정기', '변화', '같다', '이해', '아이', '주말', '가깝다', '좋다']",Positive,0.9671922326087952
광명동굴,경기 광명시 가학로85번길 142,아마다스35,아이가 체험을 좋아했어요.동굴도 볼거리가 많아서 좋았구요.집에서도 1시간 이내라서 다녀오기 딱 좋네요.한 2시간 정도 동굴구경과 체험 까지 알차게 잘 다녀왔네요.,아이가 체험을 좋아했어요.동굴도 볼거리가 많아서 좋았구요.집에서도 1시간 이내라서 다녀오기 딱 좋네요.한 2시간 정도 동굴구경과 체험 까지 알차게 잘 다녀왔네요.,"['아이', '체험', '좋아하다', '동굴', '볼거리', '많다', '좋다', '이내', '좋다', '정도', '동굴', '구경', '체험', '알차다']",Positive,0.9728760123252869
광명동굴,경기 광명시 가학로85번길 142,맛집찾는우주떠돌이,가까이에 이렇게 멋진 곳이 있는데 왜 이제서야 왔을까 싶네요~ 규모도 어마어마하고 진짜 잘 꾸며놨어요👍 안내도 잘해주시고 아이들과 정말 좋은 시간 보내고 왔습니다😆,가까이에 이렇게 멋진 곳이 있는데 왜 이제서야 왔을까 싶네요 규모도 어마어마하고 진짜 잘 꾸며놨어요 안내도 잘해주시고 아이들과 정말 좋은 시간 보내고 왔습니다,"['가까이', '멋지다', '있다', '이제', '규모', '어마어마하다', '진짜', '안내', '아이', '정말', '좋다', '시간']",Positive,0.9724224209785461
광명동굴,경기 광명시 가학로85번길 142,뀨리링,굿,굿,[],Positive,0.9277362823486328
광명동굴,경기 광명시 가학로85번길 142,테라코미,"사당에서 광역버스 8507타고 광명역에서 77번타고 왔더니 총40분정도 소요되었고.광명동굴 매표 성인요금 6000원,동굴내 와인동굴탐방도 재미있었고 곳곳에 다양한 테마로 꾸며져 볼거리가 많이 있어 입장료가 과하지 않은 곳이었습니다.","사당에서 광역버스 8507타고 광명역에서 77번타고 왔더니 총40분정도 소요되었고.광명동굴 매표 성인요금 6000원,동굴내 와인동굴탐방도 재미있었고 곳곳에 다양한 테마로 꾸며져 볼거리가 많이 있어 입장료가 과하지 않은 곳이었습니다.","['사당', '광역버스', '타고', '광명역', '타고', '소요', '광명', '동굴', '매표', '성인', '요금', '동굴', '와인', '동굴', '탐방', '재미있다', '곳곳', '다양하다', '테마', '볼거리', '있다', '입장료']",Positive,0.9672712683677673
광명동굴,경기 광명시 가학로85번길 142,줄리엣7022,수도권 근거리에 동굴체험할수있어 좋고 하루전에 할인된 금액으로 네이버에서 구매후가면 저렴한 가격에 가족들과 산책겸 가볍게 다녀오기 좋은거 같아요~^^대중교통 이용해 가기는 시간이 많이 걸리고 차를 가지고 가면 입구에서 일반 승용차는 3천원 선결재하고 들어가서 편한곳에 주차하면되고 일요일인데도 주차하는건 어렵지 않게 자리는 넉넉했습니다,수도권 근거리에 동굴체험할수있어 좋고 하루전에 할인된 금액으로 네이버에서 구매후가면 저렴한 가격에 가족들과 산책겸 가볍게 다녀오기 좋은거 같아요대중교통 이용해 가기는 시간이 많이 걸리고 차를 가지고 가면 입구에서 일반 승용차는 3천원 선결재하고 들어가서 편한곳에 주차하면되고 일요일인데도 주차하는건 어렵지 않게 자리는 넉넉했습니다,"['수도권', '근거리', '동굴', '체험', '좋다', '하루', '할인', '금액', '네이버', '구매', '가면', '저렴하다', '가격', '가족', '산책', '가볍다', '좋다', '같다', '대중교통', '이용', '가기', '시간', '가지', '가면', '입구', '일반', '승용차', '결재', '편하다', '주차', '일요일', '주차', '어렵다', '자리다', '넉넉하다']",Positive,0.9466301202774048
